2026-03-15 23:22:22,572 - optuna.study.study - INFO - Trial 147 finished with value: 0.7600730745675556 and parameters: {'imbalance_method': 'Baseline', 'n_estimators': 748, 'max_depth': 6, 'learning_rate': 0.01947535513860367, 'gamma': 7.960681313135251e-07, 'lambda': 0.001436710569205034, 'alpha': 0.12898900954943981, 'subsample': 0.7907708483435378, 'colsample_bytree': 0.7577569060345716}. Best is trial 73 with value: 0.7610533332344204.
2026-03-15 23:23:20,110 - optuna.study.study - INFO - Trial 148 finished with value: 0.758378763485779 and parameters: {'imbalance_method': 'SMOTETomek', 'n_estimators': 792, 'max_depth': 7, 'learning_rate': 0.015072073278374834, 'gamma': 1.5175962323718758e-07, 'lambda': 0.0002626743072969456, 'alpha': 0.5278406738535641, 'subsample': 0.7319779866370055, 'colsample_bytree': 0.740668831021813}. Best is trial 73 with value: 0.7610533332344204.
2026-03-15 23:23:39,893 - optuna.study.study - INFO - Trial 149 finished with value: 0.7519090096910318 and parameters: {'imbalance_method': 'RandomUnderSampler', 'n_estimators': 828, 'max_depth': 6, 'learning_rate': 0.011362236916615153, 'gamma': 2.6188328195688915e-07, 'lambda': 0.00010056723271768635, 'alpha': 1.1822573177960531, 'subsample': 0.8015868844961972, 'colsample_bytree': 0.7127955766260207}. Best is trial 73 with value: 0.7610533332344204.
2026-03-15 23:24:17,962 - optuna.study.study - INFO - Trial 150 finished with value: 0.7605752421158688 and parameters: {'imbalance_method': 'Baseline', 'n_estimators': 712, 'max_depth': 8, 'learning_rate': 0.013120461801697458, 'gamma': 4.805807994697685e-07, 'lambda': 0.002218997570330454, 'alpha': 0.28612237631356563, 'subsample': 0.7827145826245412, 'colsample_bytree': 0.7648920006493503}. Best is trial 73 with value: 0.7610533332344204.
2026-03-15 23:24:55,353 - optuna.study.study - INFO - Trial 151 finished with value: 0.7605494612486203 and parameters: {'imbalance_method': 'Baseline', 'n_estimators': 708, 'max_depth': 8, 'learning_rate': 0.013858350204690043, 'gamma': 5.830360328213468e-07, 'lambda': 0.00249894150263053, 'alpha': 0.23842539613832167, 'subsample': 0.7793989928896086, 'colsample_bytree': 0.7721185511400869}. Best is trial 73 with value: 0.7610533332344204.
2026-03-15 23:25:34,669 - optuna.study.study - INFO - Trial 152 finished with value: 0.7594918405639729 and parameters: {'imbalance_method': 'Baseline', 'n_estimators': 707, 'max_depth': 8, 'learning_rate': 0.013586774907604708, 'gamma': 1.676887407713862e-06, 'lambda': 0.004648453491399284, 'alpha': 0.24108067704130764, 'subsample': 0.7796134524387741, 'colsample_bytree': 0.7910006509127006}. Best is trial 73 with value: 0.7610533332344204.
2026-03-15 23:26:26,629 - optuna.study.study - INFO - Trial 153 finished with value: 0.7579875346734255 and parameters: {'imbalance_method': 'Baseline', 'n_estimators': 764, 'max_depth': 9, 'learning_rate': 0.016035228344592728, 'gamma': 4.923777641999786e-07, 'lambda': 0.0020868035714055543, 'alpha': 0.3291630682240217, 'subsample': 0.7693156757497995, 'colsample_bytree': 0.7530472164824399}. Best is trial 73 with value: 0.7610533332344204.
2026-03-15 23:27:05,089 - optuna.study.study - INFO - Trial 154 finished with value: 0.7602469923012434 and parameters: {'imbalance_method': 'Baseline', 'n_estimators': 721, 'max_depth': 8, 'learning_rate': 0.012360271391747488, 'gamma': 3.880535702503014e-07, 'lambda': 0.006455081817383832, 'alpha': 0.761218484353364, 'subsample': 0.7885652226012413, 'colsample_bytree': 0.7759137196488515}. Best is trial 73 with value: 0.7610533332344204.
2026-03-15 23:27:41,593 - optuna.study.study - INFO - Trial 155 finished with value: 0.757729425186874 and parameters: {'imbalance_method': 'TomekLinks', 'n_estimators': 691, 'max_depth': 8, 'learning_rate': 0.014466257799934946, 'gamma': 9.961615535534982e-07, 'lambda': 0.002529494309326814, 'alpha': 0.40869755094257826, 'subsample': 0.815617201705452, 'colsample_bytree': 0.7306032911554959}. Best is trial 73 with value: 0.7610533332344204.
2026-03-15 23:28:20,045 - optuna.study.study - INFO - Trial 156 finished with value: 0.7593692797527081 and parameters: {'imbalance_method': 'Baseline', 'n_estimators': 737, 'max_depth': 8, 'learning_rate': 0.016994505197180314, 'gamma': 2.2507662108914071e-07, 'lambda': 0.0010376895291608242, 'alpha': 0.6558302364689648, 'subsample': 0.759430688203523, 'colsample_bytree': 0.7634851524958167}. Best is trial 73 with value: 0.7610533332344204.
2026-03-15 23:28:55,115 - optuna.study.study - INFO - Trial 157 finished with value: 0.7152239486397199 and parameters: {'imbalance_method': 'SMOTEENN', 'n_estimators': 292, 'max_depth': 9, 'learning_rate': 0.013451506836493642, 'gamma': 1.29804178947011e-07, 'lambda': 0.010025516355053155, 'alpha': 0.10466017497911968, 'subsample': 0.7933606139201552, 'colsample_bytree': 0.7240105897483663}. Best is trial 73 with value: 0.7610533332344204.
2026-03-15 23:29:54,744 - optuna.study.study - INFO - Trial 158 finished with value: 0.756586905738768 and parameters: {'imbalance_method': 'SMOTE', 'n_estimators': 773, 'max_depth': 8, 'learning_rate': 0.020538833766623573, 'gamma': 6.219095913979327e-07, 'lambda': 0.0030192066527259614, 'alpha': 3.6334429586229004e-05, 'subsample': 0.7502072531879933, 'colsample_bytree': 0.6932140816051369}. Best is trial 73 with value: 0.7610533332344204.
2026-03-15 23:30:24,837 - optuna.study.study - INFO - Trial 159 finished with value: 0.7610362388293078 and parameters: {'imbalance_method': 'Baseline', 'n_estimators': 706, 'max_depth': 7, 'learning_rate': 0.011144127802034115, 'gamma': 3.6706352754101486e-07, 'lambda': 0.0005397423667374416, 'alpha': 0.20900571309106775, 'subsample': 0.8340622746910281, 'colsample_bytree': 0.7453498103746314}. Best is trial 73 with value: 0.7610533332344204.
2026-03-15 23:30:55,152 - optuna.study.study - INFO - Trial 160 finished with value: 0.7605684066651967 and parameters: {'imbalance_method': 'Baseline', 'n_estimators': 706, 'max_depth': 7, 'learning_rate': 0.0107855253399598, 'gamma': 2.408291796244413e-06, 'lambda': 0.0006403748770169485, 'alpha': 0.12516584054586788, 'subsample': 0.8234894368973724, 'colsample_bytree': 0.7427867172702829}. Best is trial 73 with value: 0.7610533332344204.
2026-03-15 23:31:25,903 - optuna.study.study - INFO - Trial 161 finished with value: 0.7608449115017062 and parameters: {'imbalance_method': 'Baseline', 'n_estimators': 709, 'max_depth': 7, 'learning_rate': 0.011109844470438234, 'gamma': 2.3503350894203946e-06, 'lambda': 0.05448916590501584, 'alpha': 0.27794649565453017, 'subsample': 0.8318957759311042, 'colsample_bytree': 0.7456164909174269}. Best is trial 73 with value: 0.7610533332344204.
2026-03-15 23:31:56,000 - optuna.study.study - INFO - Trial 162 finished with value: 0.7600858970410855 and parameters: {'imbalance_method': 'Baseline', 'n_estimators': 699, 'max_depth': 7, 'learning_rate': 0.01104793911679573, 'gamma': 5.031015114179295e-06, 'lambda': 0.0620124215420082, 'alpha': 0.06733600744954805, 'subsample': 0.8336829633662701, 'colsample_bytree': 0.7436659660428787}. Best is trial 73 with value: 0.7610533332344204.
2026-03-15 23:32:24,246 - optuna.study.study - INFO - Trial 163 finished with value: 0.7601195948372442 and parameters: {'imbalance_method': 'Baseline', 'n_estimators': 672, 'max_depth': 7, 'learning_rate': 0.012083969713362201, 'gamma': 2.146947077941981e-06, 'lambda': 0.15467939043761164, 'alpha': 0.14403931476438855, 'subsample': 0.821244101931697, 'colsample_bytree': 0.7572869727076896}. Best is trial 73 with value: 0.7610533332344204.
2026-03-15 23:32:53,942 - optuna.study.study - INFO - Trial 164 finished with value: 0.7599678851388992 and parameters: {'imbalance_method': 'Baseline', 'n_estimators': 709, 'max_depth': 7, 'learning_rate': 0.014275421432940884, 'gamma': 1.1642575380329377e-05, 'lambda': 0.046714899295909926, 'alpha': 0.22933864637798626, 'subsample': 0.8043500829565579, 'colsample_bytree': 0.742062802342416}. Best is trial 73 with value: 0.7610533332344204.
2026-03-15 23:33:34,331 - optuna.study.study - INFO - Trial 165 finished with value: 0.7592863842461791 and parameters: {'imbalance_method': 'Baseline', 'n_estimators': 749, 'max_depth': 8, 'learning_rate': 0.01286353353928234, 'gamma': 1.4321768587129126e-06, 'lambda': 0.1737816771362409, 'alpha': 0.18963124230056524, 'subsample': 0.8323369993847217, 'colsample_bytree': 0.7145390826774503}. Best is trial 73 with value: 0.7610533332344204.
2026-03-15 23:34:03,528 - optuna.study.study - INFO - Trial 166 finished with value: 0.7607426422080471 and parameters: {'imbalance_method': 'Baseline', 'n_estimators': 688, 'max_depth': 7, 'learning_rate': 0.010637568968444805, 'gamma': 8.384704148169682e-07, 'lambda': 0.0005360602661775751, 'alpha': 0.3628556781289577, 'subsample': 0.812874769387094, 'colsample_bytree': 0.7514599483862255}. Best is trial 73 with value: 0.7610533332344204.
2026-03-15 23:34:32,661 - optuna.study.study - INFO - Trial 167 finished with value: 0.7605999195022717 and parameters: {'imbalance_method': 'Baseline', 'n_estimators': 686, 'max_depth': 7, 'learning_rate': 0.01089589242228666, 'gamma': 2.7314427726633593e-06, 'lambda': 0.0005408984606262341, 'alpha': 0.037695565642888514, 'subsample': 0.8138059707582996, 'colsample_bytree': 0.7513235144735415}. Best is trial 73 with value: 0.7610533332344204.
2026-03-15 23:35:02,036 - optuna.study.study - INFO - Trial 168 finished with value: 0.760482100073599 and parameters: {'imbalance_method': 'Baseline', 'n_estimators': 685, 'max_depth': 7, 'learning_rate': 0.011584576464624442, 'gamma': 8.743519782166512e-07, 'lambda': 0.0004860012271454084, 'alpha': 0.34606696442066326, 'subsample': 0.8129133397641853, 'colsample_bytree': 0.752908312185814}. Best is trial 73 with value: 0.7610533332344204.
2026-03-15 23:35:40,792 - optuna.study.study - INFO - Trial 169 finished with value: 0.7602720187818081 and parameters: {'imbalance_method': 'Baseline', 'n_estimators': 660, 'max_depth': 8, 'learning_rate': 0.010180032026652096, 'gamma': 7.687750270535089e-06, 'lambda': 0.0003550739885266824, 'alpha': 0.033989092805006435, 'subsample': 0.8224784643513773, 'colsample_bytree': 0.7669869666295845}. Best is trial 73 with value: 0.7610533332344204.
2026-03-15 23:36:11,553 - optuna.study.study - INFO - Trial 170 finished with value: 0.7599055116170529 and parameters: {'imbalance_method': 'Baseline', 'n_estimators': 716, 'max_depth': 7, 'learning_rate': 0.011152906584508208, 'gamma': 2.7857430085316987e-06, 'lambda': 0.0007534867534645032, 'alpha': 0.10676010721611146, 'subsample': 0.841536824864257, 'colsample_bytree': 0.7366769186152751}. Best is trial 73 with value: 0.7610533332344204.
2026-03-15 23:36:41,381 - optuna.study.study - INFO - Trial 171 finished with value: 0.7603367677002387 and parameters: {'imbalance_method': 'Baseline', 'n_estimators': 693, 'max_depth': 7, 'learning_rate': 0.010536338747043085, 'gamma': 5.128406549687351e-07, 'lambda': 0.0005950947711837875, 'alpha': 0.07786614389331706, 'subsample': 0.7854509261759555, 'colsample_bytree': 0.7503013362066416}. Best is trial 73 with value: 0.7610533332344204.
2026-03-15 23:37:12,896 - optuna.study.study - INFO - Trial 172 finished with value: 0.7605089933976369 and parameters: {'imbalance_method': 'Baseline', 'n_estimators': 738, 'max_depth': 7, 'learning_rate': 0.012438977866324892, 'gamma': 1.215377746327337e-06, 'lambda': 0.00027310408685650927, 'alpha': 0.20597110196582838, 'subsample': 0.7980262942154293, 'colsample_bytree': 0.7697906425795078}. Best is trial 73 with value: 0.7610533332344204.
2026-03-15 23:37:40,252 - optuna.study.study - INFO - Trial 173 finished with value: 0.7599024995919383 and parameters: {'imbalance_method': 'Baseline', 'n_estimators': 611, 'max_depth': 7, 'learning_rate': 0.008976708091276958, 'gamma': 1.8996647803353814e-06, 'lambda': 1.2310130238713632, 'alpha': 0.42874988188215, 'subsample': 0.815677394675087, 'colsample_bytree': 0.7570371456055052}. Best is trial 73 with value: 0.7610533332344204.
2026-03-15 23:38:07,483 - optuna.study.study - INFO - Trial 174 finished with value: 0.7606507003042712 and parameters: {'imbalance_method': 'Baseline', 'n_estimators': 648, 'max_depth': 7, 'learning_rate': 0.015604830920667513, 'gamma': 2.9007015823546303e-06, 'lambda': 0.00015717224008926316, 'alpha': 0.14546145534324767, 'subsample': 0.7725768122976842, 'colsample_bytree': 0.7871187744318408}. Best is trial 73 with value: 0.7610533332344204.
2026-03-15 23:38:34,344 - optuna.study.study - INFO - Trial 175 finished with value: 0.7607218237730938 and parameters: {'imbalance_method': 'Baseline', 'n_estimators': 652, 'max_depth': 7, 'learning_rate': 0.015424570194407707, 'gamma': 3.046785559870391e-06, 'lambda': 0.000965118844082721, 'alpha': 0.1400864867504455, 'subsample': 0.7768718164203785, 'colsample_bytree': 0.7864596044939673}. Best is trial 73 with value: 0.7610533332344204.
2026-03-15 23:39:01,739 - optuna.study.study - INFO - Trial 176 finished with value: 0.7601852444667644 and parameters: {'imbalance_method': 'Baseline', 'n_estimators': 650, 'max_depth': 7, 'learning_rate': 0.01607615300571922, 'gamma': 3.0892727053989735e-06, 'lambda': 0.00019822557795352166, 'alpha': 0.05246921195594864, 'subsample': 0.7672807319019115, 'colsample_bytree': 0.7943741878758835}. Best is trial 73 with value: 0.7610533332344204.
2026-03-15 23:39:57,651 - optuna.study.study - INFO - Trial 177 finished with value: 0.7564295408766517 and parameters: {'imbalance_method': 'ADASYN', 'n_estimators': 640, 'max_depth': 8, 'learning_rate': 0.013463183677964206, 'gamma': 4.636997465716024e-06, 'lambda': 0.0004162811390247588, 'alpha': 0.1505503465794168, 'subsample': 0.8071424824697975, 'colsample_bytree': 0.7849597068363586}. Best is trial 73 with value: 0.7610533332344204.
2026-03-15 23:40:26,419 - optuna.study.study - INFO - Trial 178 finished with value: 0.7604750668396134 and parameters: {'imbalance_method': 'Baseline', 'n_estimators': 672, 'max_depth': 7, 'learning_rate': 0.010794891581744251, 'gamma': 9.360301457207252e-06, 'lambda': 0.0001507417065542572, 'alpha': 0.26483021526377565, 'subsample': 0.7778480090121276, 'colsample_bytree': 0.804096955872372}. Best is trial 73 with value: 0.7610533332344204.
2026-03-15 23:40:51,934 - optuna.study.study - INFO - Trial 179 finished with value: 0.7604447484705142 and parameters: {'imbalance_method': 'Baseline', 'n_estimators': 605, 'max_depth': 7, 'learning_rate': 0.01192715374012439, 'gamma': 2.073572352464482e-06, 'lambda': 0.0014047976976184946, 'alpha': 0.13734450384185645, 'subsample': 0.8357304080997793, 'colsample_bytree': 0.7761562576020935}. Best is trial 73 with value: 0.7610533332344204.
2026-03-15 23:41:29,260 - optuna.study.study - INFO - Trial 180 finished with value: 0.7601545200594656 and parameters: {'imbalance_method': 'Baseline', 'n_estimators': 666, 'max_depth': 8, 'learning_rate': 0.01450711190494338, 'gamma': 2.1546917481709916e-05, 'lambda': 0.03581316306866571, 'alpha': 0.49936168129495073, 'subsample': 0.7740587756808398, 'colsample_bytree': 0.8988006045648047}. Best is trial 73 with value: 0.7610533332344204.
2026-03-15 23:41:58,521 - optuna.study.study - INFO - Trial 181 finished with value: 0.7605394052710491 and parameters: {'imbalance_method': 'Baseline', 'n_estimators': 703, 'max_depth': 7, 'learning_rate': 0.015295807819808925, 'gamma': 9.851758729257888e-07, 'lambda': 0.0009258967586039859, 'alpha': 0.1980398627950851, 'subsample': 0.7890397412137007, 'colsample_bytree': 0.7644497347604414}. Best is trial 73 with value: 0.7610533332344204.
2026-03-15 23:42:24,495 - optuna.study.study - INFO - Trial 182 finished with value: 0.7605779654291934 and parameters: {'imbalance_method': 'Baseline', 'n_estimators': 623, 'max_depth': 7, 'learning_rate': 0.01587797534476079, 'gamma': 1.0720174161177998e-06, 'lambda': 0.000619296574127502, 'alpha': 0.26724731902339505, 'subsample': 0.7966074320704679, 'colsample_bytree': 0.7656154543774136}. Best is trial 73 with value: 0.7610533332344204.
2026-03-15 23:42:50,324 - optuna.study.study - INFO - Trial 183 finished with value: 0.7603659272476923 and parameters: {'imbalance_method': 'Baseline', 'n_estimators': 631, 'max_depth': 7, 'learning_rate': 0.017445506350406297, 'gamma': 1.2692775996614487e-06, 'lambda': 0.0005315506037653104, 'alpha': 0.2753534981852232, 'subsample': 0.7963075590557054, 'colsample_bytree': 0.7687294724833549}. Best is trial 73 with value: 0.7610533332344204.
2026-03-15 23:43:23,598 - optuna.study.study - INFO - Trial 184 finished with value: 0.759889303271219 and parameters: {'imbalance_method': 'RandomOverSampler', 'n_estimators': 623, 'max_depth': 7, 'learning_rate': 0.015856524092487615, 'gamma': 3.049807612271202e-06, 'lambda': 0.001034584517838655, 'alpha': 0.08789462958131729, 'subsample': 0.7609457049609305, 'colsample_bytree': 0.7753222853035396}. Best is trial 73 with value: 0.7610533332344204.
2026-03-15 23:43:50,492 - optuna.study.study - INFO - Trial 185 finished with value: 0.7598742465328426 and parameters: {'imbalance_method': 'Baseline', 'n_estimators': 596, 'max_depth': 7, 'learning_rate': 0.0130702529719657, 'gamma': 3.8378645656380533e-07, 'lambda': 0.00036587455548691875, 'alpha': 0.23334798989286706, 'subsample': 0.7837470123720224, 'colsample_bytree': 0.7872090611630921}. Best is trial 73 with value: 0.7610533332344204.
2026-03-15 23:44:14,534 - optuna.study.study - INFO - Trial 186 finished with value: 0.7600282623938753 and parameters: {'imbalance_method': 'Baseline', 'n_estimators': 565, 'max_depth': 7, 'learning_rate': 0.015242248578926611, 'gamma': 8.516973460779148e-07, 'lambda': 0.0007615727662831438, 'alpha': 0.14471726534674814, 'subsample': 0.806779782476532, 'colsample_bytree': 0.7615654469493441}. Best is trial 73 with value: 0.7610533332344204.
2026-03-15 23:45:02,499 - optuna.study.study - INFO - Trial 187 finished with value: 0.7587125983427252 and parameters: {'imbalance_method': 'SMOTETomek', 'n_estimators': 681, 'max_depth': 7, 'learning_rate': 0.013418075534360922, 'gamma': 1.3625043505226439e-06, 'lambda': 0.0002509491390592267, 'alpha': 0.3663667445598936, 'subsample': 0.7955071328354466, 'colsample_bytree': 0.7427559572568203}. Best is trial 73 with value: 0.7610533332344204.
2026-03-15 23:45:24,581 - optuna.study.study - INFO - Trial 188 finished with value: 0.7476836463226283 and parameters: {'imbalance_method': 'Baseline', 'n_estimators': 643, 'max_depth': 6, 'learning_rate': 0.16128103554581613, 'gamma': 5.6923465841094395e-05, 'lambda': 0.001689387870738023, 'alpha': 0.5563435029633189, 'subsample': 0.7390645117414818, 'colsample_bytree': 0.7835223159807917}. Best is trial 73 with value: 0.7610533332344204.
2026-03-15 23:45:54,179 - optuna.study.study - INFO - Trial 189 finished with value: 0.7607836431174825 and parameters: {'imbalance_method': 'Baseline', 'n_estimators': 696, 'max_depth': 7, 'learning_rate': 0.017891607091298393, 'gamma': 2.2406836684786867e-06, 'lambda': 0.0009554828816535835, 'alpha': 0.04261627118671971, 'subsample': 0.7722668059638426, 'colsample_bytree': 0.7640080474123051}. Best is trial 73 with value: 0.7610533332344204.
2026-03-15 23:46:30,002 - optuna.study.study - INFO - Trial 190 finished with value: 0.7590602915790466 and parameters: {'imbalance_method': 'Baseline', 'n_estimators': 667, 'max_depth': 8, 'learning_rate': 0.017165341388580658, 'gamma': 2.2584223847262813e-06, 'lambda': 0.0005528491986025516, 'alpha': 0.05542622980685324, 'subsample': 0.7693967546351443, 'colsample_bytree': 0.799413730681583}. Best is trial 73 with value: 0.7610533332344204.
2026-03-15 23:46:59,301 - optuna.study.study - INFO - Trial 191 finished with value: 0.7605418350059958 and parameters: {'imbalance_method': 'Baseline', 'n_estimators': 693, 'max_depth': 7, 'learning_rate': 0.017613239208212506, 'gamma': 4.3795563749840455e-06, 'lambda': 0.001141524291953461, 'alpha': 0.16939864299532878, 'subsample': 0.7513465267828126, 'colsample_bytree': 0.7610001752802407}. Best is trial 73 with value: 0.7610533332344204.
2026-03-15 23:47:27,725 - optuna.study.study - INFO - Trial 192 finished with value: 0.7606136762839523 and parameters: {'imbalance_method': 'Baseline', 'n_estimators': 685, 'max_depth': 7, 'learning_rate': 0.01732842209629024, 'gamma': 5.1090407463436285e-06, 'lambda': 0.0012744665034218057, 'alpha': 0.04095828309838954, 'subsample': 0.7561478338439814, 'colsample_bytree': 0.7468115647094992}. Best is trial 73 with value: 0.7610533332344204.
2026-03-15 23:47:54,772 - optuna.study.study - INFO - Trial 193 finished with value: 0.7601251467122419 and parameters: {'imbalance_method': 'Baseline', 'n_estimators': 651, 'max_depth': 7, 'learning_rate': 0.01859184720661148, 'gamma': 3.5670297809229834e-06, 'lambda': 0.0003102139505576548, 'alpha': 0.028746759610852574, 'subsample': 0.7646325697136875, 'colsample_bytree': 0.7468741564585059}. Best is trial 73 with value: 0.7610533332344204.
2026-03-15 23:48:27,243 - optuna.study.study - INFO - Trial 194 finished with value: 0.7602581540117749 and parameters: {'imbalance_method': 'Baseline', 'n_estimators': 729, 'max_depth': 7, 'learning_rate': 0.016664828068963262, 'gamma': 1.741261338436633e-06, 'lambda': 0.00047147757906064724, 'alpha': 0.08236035377893591, 'subsample': 0.779923449231401, 'colsample_bytree': 0.7325403186313355}. Best is trial 73 with value: 0.7610533332344204.
2026-03-15 23:48:48,073 - optuna.study.study - INFO - Trial 195 finished with value: 0.7481414487418562 and parameters: {'imbalance_method': 'RandomUnderSampler', 'n_estimators': 682, 'max_depth': 7, 'learning_rate': 0.019201609790161295, 'gamma': 5.211350964384055e-06, 'lambda': 0.0001610095282220869, 'alpha': 0.0403659690311127, 'subsample': 0.774244059371628, 'colsample_bytree': 0.7767529793111851}. Best is trial 73 with value: 0.7610533332344204.
