2026-03-15 22:05:02,498 - optuna.storages._in_memory - INFO - A new study created in memory with name: Optimizacion_XGB_Balanceo
2026-03-15 22:05:33,117 - optuna.study.study - INFO - Trial 0 finished with value: 0.7138394570813714 and parameters: {'imbalance_method': 'SMOTEENN', 'n_estimators': 718, 'max_depth': 4, 'learning_rate': 0.012713028407710558, 'gamma': 1.1699440705459433e-05, 'lambda': 1.1231410286104488e-07, 'alpha': 0.003557309060870807, 'subsample': 0.5443938658136758, 'colsample_bytree': 0.7055625786657869}. Best is trial 0 with value: 0.7138394570813714.
2026-03-15 22:07:03,133 - optuna.study.study - INFO - Trial 1 finished with value: 0.7197107003483393 and parameters: {'imbalance_method': 'SMOTEENN', 'n_estimators': 946, 'max_depth': 10, 'learning_rate': 0.017121480638268734, 'gamma': 0.11392698097560597, 'lambda': 3.199003760590812e-05, 'alpha': 1.919788501756336e-08, 'subsample': 0.5492313386028445, 'colsample_bytree': 0.5085238396368866}. Best is trial 1 with value: 0.7197107003483393.
2026-03-15 22:07:21,837 - optuna.study.study - INFO - Trial 2 finished with value: 0.7489022609795737 and parameters: {'imbalance_method': 'TomekLinks', 'n_estimators': 354, 'max_depth': 7, 'learning_rate': 0.006319518554970409, 'gamma': 1.7078326340619148e-07, 'lambda': 0.00038534195255584874, 'alpha': 1.5122063436220282e-08, 'subsample': 0.8176072193186792, 'colsample_bytree': 0.9007388679077339}. Best is trial 2 with value: 0.7489022609795737.
2026-03-15 22:07:57,305 - optuna.study.study - INFO - Trial 3 finished with value: 0.7521907546031698 and parameters: {'imbalance_method': 'ADASYN', 'n_estimators': 694, 'max_depth': 5, 'learning_rate': 0.01326850296056118, 'gamma': 0.001887066469320371, 'lambda': 3.920475621884393, 'alpha': 1.6680475907429922e-05, 'subsample': 0.6447070261528833, 'colsample_bytree': 0.8371240428037265}. Best is trial 3 with value: 0.7521907546031698.
2026-03-15 22:08:23,606 - optuna.study.study - INFO - Trial 4 finished with value: 0.7584277862678062 and parameters: {'imbalance_method': 'SMOTE', 'n_estimators': 188, 'max_depth': 9, 'learning_rate': 0.024205675840314217, 'gamma': 0.009409786562671874, 'lambda': 7.4794855773628475e-06, 'alpha': 0.01520245547074227, 'subsample': 0.6624695627955629, 'colsample_bytree': 0.8057326089233792}. Best is trial 4 with value: 0.7584277862678062.
2026-03-15 22:08:45,343 - optuna.study.study - INFO - Trial 5 finished with value: 0.7521558670392526 and parameters: {'imbalance_method': 'TomekLinks', 'n_estimators': 789, 'max_depth': 5, 'learning_rate': 0.11397168942022584, 'gamma': 6.18141323556753e-05, 'lambda': 0.037503659254604235, 'alpha': 0.2750011972669233, 'subsample': 0.9493880310192295, 'colsample_bytree': 0.6646523382085032}. Best is trial 4 with value: 0.7584277862678062.
2026-03-15 22:10:53,152 - optuna.study.study - INFO - Trial 6 finished with value: 0.7515142383993704 and parameters: {'imbalance_method': 'SMOTE', 'n_estimators': 875, 'max_depth': 12, 'learning_rate': 0.04862825845224704, 'gamma': 0.22314134490492982, 'lambda': 0.0032767154146069455, 'alpha': 0.0009880588854986102, 'subsample': 0.6436846345528489, 'colsample_bytree': 0.7827922795552871}. Best is trial 4 with value: 0.7584277862678062.
2026-03-15 22:11:04,003 - optuna.study.study - INFO - Trial 7 finished with value: 0.7537133200388663 and parameters: {'imbalance_method': 'SMOTE', 'n_estimators': 248, 'max_depth': 5, 'learning_rate': 0.02509907134089027, 'gamma': 0.0003648528538592236, 'lambda': 2.0780045302429875e-06, 'alpha': 0.00018218801942852575, 'subsample': 0.6756694127320482, 'colsample_bytree': 0.6230592568187092}. Best is trial 4 with value: 0.7584277862678062.
2026-03-15 22:11:54,195 - optuna.study.study - INFO - Trial 8 finished with value: 0.6989334940918895 and parameters: {'imbalance_method': 'SMOTEENN', 'n_estimators': 229, 'max_depth': 11, 'learning_rate': 0.005241948946813357, 'gamma': 6.266719248091345e-05, 'lambda': 5.254208487093948e-06, 'alpha': 0.03370339266361434, 'subsample': 0.8971341745635748, 'colsample_bytree': 0.9289411068587654}. Best is trial 4 with value: 0.7584277862678062.
2026-03-15 22:12:17,998 - optuna.study.study - INFO - Trial 9 finished with value: 0.7562158452729802 and parameters: {'imbalance_method': 'SMOTE', 'n_estimators': 565, 'max_depth': 5, 'learning_rate': 0.07128730344400759, 'gamma': 1.6053908715296648e-05, 'lambda': 0.11287551752921572, 'alpha': 1.094508541546566e-06, 'subsample': 0.6988660045483635, 'colsample_bytree': 0.614386696810955}. Best is trial 4 with value: 0.7584277862678062.
2026-03-15 22:12:36,931 - optuna.study.study - INFO - Trial 10 finished with value: 0.7490158472787409 and parameters: {'imbalance_method': 'SMOTETomek', 'n_estimators': 71, 'max_depth': 9, 'learning_rate': 0.2841104216731818, 'gamma': 0.009555036078184921, 'lambda': 1.6744824988505474e-08, 'alpha': 4.818950547069989, 'subsample': 0.7989431386239492, 'colsample_bytree': 0.9867823506311441}. Best is trial 4 with value: 0.7584277862678062.
2026-03-15 22:13:29,134 - optuna.study.study - INFO - Trial 11 finished with value: 0.7538559732187834 and parameters: {'imbalance_method': 'SMOTE', 'n_estimators': 482, 'max_depth': 8, 'learning_rate': 0.061510352012817356, 'gamma': 1.5286606822713239e-06, 'lambda': 0.42549352316485695, 'alpha': 2.8344837681046574e-06, 'subsample': 0.7181494039980411, 'colsample_bytree': 0.5565182390333143}. Best is trial 4 with value: 0.7584277862678062.
2026-03-15 22:14:07,669 - optuna.study.study - INFO - Trial 12 finished with value: 0.7508441637710129 and parameters: {'imbalance_method': 'Baseline', 'n_estimators': 563, 'max_depth': 7, 'learning_rate': 0.1031831013903458, 'gamma': 1.1965613900224504e-08, 'lambda': 0.021410674739662787, 'alpha': 9.272554001018005e-07, 'subsample': 0.7473624909434837, 'colsample_bytree': 0.7728570670216659}. Best is trial 4 with value: 0.7584277862678062.
2026-03-15 22:14:35,244 - optuna.study.study - INFO - Trial 13 finished with value: 0.744870352715492 and parameters: {'imbalance_method': 'RandomUnderSampler', 'n_estimators': 523, 'max_depth': 7, 'learning_rate': 0.036291210451310556, 'gamma': 0.008962141953663716, 'lambda': 0.00020376245616624355, 'alpha': 3.182228497089464e-05, 'subsample': 0.6040856575145879, 'colsample_bytree': 0.6323239108650172}. Best is trial 4 with value: 0.7584277862678062.
2026-03-15 22:14:39,527 - optuna.study.study - INFO - Trial 14 finished with value: 0.745500945591056 and parameters: {'imbalance_method': 'RandomOverSampler', 'n_estimators': 73, 'max_depth': 3, 'learning_rate': 0.09634002033847484, 'gamma': 3.596517427078012e-06, 'lambda': 7.031902296190793e-07, 'alpha': 3.0765113356441936e-07, 'subsample': 0.8304815738308468, 'colsample_bytree': 0.8361370884511141}. Best is trial 4 with value: 0.7584277862678062.
2026-03-15 22:15:32,532 - optuna.study.study - INFO - Trial 15 finished with value: 0.7450496389728046 and parameters: {'imbalance_method': 'SMOTE', 'n_estimators': 416, 'max_depth': 9, 'learning_rate': 0.23727602874497727, 'gamma': 0.0008216927427499325, 'lambda': 0.6738233020700912, 'alpha': 0.012545248124353939, 'subsample': 0.7104751177643573, 'colsample_bytree': 0.7168009947210027}. Best is trial 4 with value: 0.7584277862678062.
2026-03-15 22:16:15,068 - optuna.study.study - INFO - Trial 16 finished with value: 0.7581321473423039 and parameters: {'imbalance_method': 'SMOTE', 'n_estimators': 633, 'max_depth': 6, 'learning_rate': 0.02821475881345056, 'gamma': 0.025053573046318636, 'lambda': 8.53635798945814e-05, 'alpha': 0.3358748227025578, 'subsample': 0.501976032773725, 'colsample_bytree': 0.5572495999384429}. Best is trial 4 with value: 0.7584277862678062.
2026-03-15 22:16:32,178 - optuna.study.study - INFO - Trial 17 finished with value: 0.756745510894823 and parameters: {'imbalance_method': 'Baseline', 'n_estimators': 255, 'max_depth': 8, 'learning_rate': 0.028681077123010792, 'gamma': 0.03557331830073475, 'lambda': 2.8663435702288908e-05, 'alpha': 9.168785107069109, 'subsample': 0.5025208974309042, 'colsample_bytree': 0.5024315029652191}. Best is trial 4 with value: 0.7584277862678062.
2026-03-15 22:17:12,523 - optuna.study.study - INFO - Trial 18 finished with value: 0.7575152161880764 and parameters: {'imbalance_method': 'RandomOverSampler', 'n_estimators': 645, 'max_depth': 6, 'learning_rate': 0.008974283233047331, 'gamma': 0.9019003874122179, 'lambda': 0.0013903489631591397, 'alpha': 0.18232436535806584, 'subsample': 0.5956156671774313, 'colsample_bytree': 0.8236309790862046}. Best is trial 4 with value: 0.7584277862678062.
2026-03-15 22:18:22,177 - optuna.study.study - INFO - Trial 19 finished with value: 0.7523838150160627 and parameters: {'imbalance_method': 'ADASYN', 'n_estimators': 333, 'max_depth': 10, 'learning_rate': 0.02033254220191245, 'gamma': 0.004961975448600379, 'lambda': 3.251130663483111e-05, 'alpha': 0.6495678899483804, 'subsample': 0.5044125622912562, 'colsample_bytree': 0.5800031298937187}. Best is trial 4 with value: 0.7584277862678062.
2026-03-15 22:19:07,445 - optuna.study.study - INFO - Trial 20 finished with value: 0.7389421693579109 and parameters: {'imbalance_method': 'RandomUnderSampler', 'n_estimators': 825, 'max_depth': 9, 'learning_rate': 0.03988851947477838, 'gamma': 0.044688674553123725, 'lambda': 1.429502765561855e-07, 'alpha': 0.030710220099703093, 'subsample': 0.5875946186208496, 'colsample_bytree': 0.7123912667673162}. Best is trial 4 with value: 0.7584277862678062.
2026-03-15 22:19:43,950 - optuna.study.study - INFO - Trial 21 finished with value: 0.7566343236021656 and parameters: {'imbalance_method': 'RandomOverSampler', 'n_estimators': 658, 'max_depth': 6, 'learning_rate': 0.008362462181057595, 'gamma': 0.9025727180361256, 'lambda': 0.0017849331072752762, 'alpha': 0.12138078827291669, 'subsample': 0.5940923279148314, 'colsample_bytree': 0.8323138855848156}. Best is trial 4 with value: 0.7584277862678062.
2026-03-15 22:20:17,916 - optuna.study.study - INFO - Trial 22 finished with value: 0.7561537097020535 and parameters: {'imbalance_method': 'RandomOverSampler', 'n_estimators': 643, 'max_depth': 6, 'learning_rate': 0.008275041304213027, 'gamma': 0.9412136295520753, 'lambda': 0.0008933817865661901, 'alpha': 0.6667232266099855, 'subsample': 0.6399101479464535, 'colsample_bytree': 0.8836253288157331}. Best is trial 4 with value: 0.7584277862678062.
2026-03-15 22:20:52,559 - optuna.study.study - INFO - Trial 23 finished with value: 0.7558255141206186 and parameters: {'imbalance_method': 'SMOTETomek', 'n_estimators': 451, 'max_depth': 6, 'learning_rate': 0.012744362738418833, 'gamma': 0.16481740896902167, 'lambda': 0.0001056713690909818, 'alpha': 0.004814327125404277, 'subsample': 0.5585544915721579, 'colsample_bytree': 0.795094794785324}. Best is trial 4 with value: 0.7584277862678062.
2026-03-15 22:21:12,997 - optuna.study.study - INFO - Trial 24 finished with value: 0.749774958629222 and parameters: {'imbalance_method': 'RandomOverSampler', 'n_estimators': 613, 'max_depth': 3, 'learning_rate': 0.018978863053289996, 'gamma': 0.04601602584571723, 'lambda': 0.0036663931049258406, 'alpha': 1.1533941999775286, 'subsample': 0.6128590748548914, 'colsample_bytree': 0.7383255797962438}. Best is trial 4 with value: 0.7584277862678062.
2026-03-15 22:22:19,201 - optuna.study.study - INFO - Trial 25 finished with value: 0.7538247486471844 and parameters: {'imbalance_method': 'SMOTE', 'n_estimators': 755, 'max_depth': 8, 'learning_rate': 0.030592079027885723, 'gamma': 0.00030920602358083506, 'lambda': 6.270633302749573e-06, 'alpha': 0.11257019471054808, 'subsample': 0.539263165382699, 'colsample_bytree': 0.6744763836438301}. Best is trial 4 with value: 0.7584277862678062.
2026-03-15 22:22:26,327 - optuna.study.study - INFO - Trial 26 finished with value: 0.7232435722968273 and parameters: {'imbalance_method': 'SMOTE', 'n_estimators': 142, 'max_depth': 4, 'learning_rate': 0.011062890952014414, 'gamma': 0.3213976519750336, 'lambda': 0.007302993639144299, 'alpha': 0.0011311547691196593, 'subsample': 0.6735404935384818, 'colsample_bytree': 0.8643019083536253}. Best is trial 4 with value: 0.7584277862678062.
2026-03-15 22:23:15,827 - optuna.study.study - INFO - Trial 27 finished with value: 0.7583115076204665 and parameters: {'imbalance_method': 'RandomOverSampler', 'n_estimators': 977, 'max_depth': 6, 'learning_rate': 0.008549910105501596, 'gamma': 0.0036934524273071227, 'lambda': 8.896968090389728e-05, 'alpha': 1.989465768770039, 'subsample': 0.7635933811990202, 'colsample_bytree': 0.9632350714375252}. Best is trial 4 with value: 0.7584277862678062.
2026-03-15 22:25:47,908 - optuna.study.study - INFO - Trial 28 finished with value: 0.7558113922659743 and parameters: {'imbalance_method': 'SMOTE', 'n_estimators': 843, 'max_depth': 10, 'learning_rate': 0.022607798410827076, 'gamma': 0.003231997381140132, 'lambda': 8.524070770048433e-07, 'alpha': 4.1312471688195584, 'subsample': 0.7698452251408023, 'colsample_bytree': 0.9428908295140835}. Best is trial 4 with value: 0.7584277862678062.
2026-03-15 22:26:12,595 - optuna.study.study - INFO - Trial 29 finished with value: 0.7581425972783054 and parameters: {'imbalance_method': 'Baseline', 'n_estimators': 992, 'max_depth': 4, 'learning_rate': 0.01545485801563954, 'gamma': 0.018714477990737197, 'lambda': 1.600388333071229e-07, 'alpha': 0.026374337683313907, 'subsample': 0.8588160851797285, 'colsample_bytree': 0.988378304750967}. Best is trial 4 with value: 0.7584277862678062.
2026-03-15 22:26:37,776 - optuna.study.study - INFO - Trial 30 finished with value: 0.7586042693587323 and parameters: {'imbalance_method': 'Baseline', 'n_estimators': 991, 'max_depth': 4, 'learning_rate': 0.01578490903239386, 'gamma': 0.0016720398997028475, 'lambda': 1.3273630460231332e-08, 'alpha': 0.007898958593221225, 'subsample': 0.867853937607621, 'colsample_bytree': 0.9810768477323603}. Best is trial 30 with value: 0.7586042693587323.
2026-03-15 22:27:04,172 - optuna.study.study - INFO - Trial 31 finished with value: 0.7587769051543171 and parameters: {'imbalance_method': 'Baseline', 'n_estimators': 997, 'max_depth': 4, 'learning_rate': 0.01494440644366506, 'gamma': 0.0014276076155207275, 'lambda': 4.2760255107603015e-08, 'alpha': 0.00632328920551157, 'subsample': 0.8683460546910056, 'colsample_bytree': 0.998520445168277}. Best is trial 31 with value: 0.7587769051543171.
2026-03-15 22:27:26,472 - optuna.study.study - INFO - Trial 32 finished with value: 0.7559209813250732 and parameters: {'imbalance_method': 'Baseline', 'n_estimators': 935, 'max_depth': 4, 'learning_rate': 0.010742471907405947, 'gamma': 0.00109956160835041, 'lambda': 2.435322243454617e-08, 'alpha': 0.003475870391759552, 'subsample': 0.9130811795330742, 'colsample_bytree': 0.9514819985969535}. Best is trial 31 with value: 0.7587769051543171.
2026-03-15 22:27:46,995 - optuna.study.study - INFO - Trial 33 finished with value: 0.7557130396639483 and parameters: {'imbalance_method': 'Baseline', 'n_estimators': 996, 'max_depth': 3, 'learning_rate': 0.015203301767063013, 'gamma': 0.0002519051633341541, 'lambda': 2.4226141005798295e-08, 'alpha': 7.24192770988166e-05, 'subsample': 0.983595553804904, 'colsample_bytree': 0.9707266795960138}. Best is trial 31 with value: 0.7587769051543171.
2026-03-15 22:28:12,806 - optuna.study.study - INFO - Trial 34 finished with value: 0.7511530277986864 and parameters: {'imbalance_method': 'Baseline', 'n_estimators': 906, 'max_depth': 4, 'learning_rate': 0.006716996257706719, 'gamma': 0.0013375211269970743, 'lambda': 7.049525410149953e-08, 'alpha': 0.0008319946403296703, 'subsample': 0.865419712149935, 'colsample_bytree': 0.9128817001637176}. Best is trial 31 with value: 0.7587769051543171.
2026-03-15 22:28:41,038 - optuna.study.study - INFO - Trial 35 finished with value: 0.7570575772470933 and parameters: {'imbalance_method': 'TomekLinks', 'n_estimators': 947, 'max_depth': 5, 'learning_rate': 0.019430991561334404, 'gamma': 0.0001152783029193443, 'lambda': 2.9979651111735363e-07, 'alpha': 0.006641242585303347, 'subsample': 0.7722336516944185, 'colsample_bytree': 0.9942272597904163}. Best is trial 31 with value: 0.7587769051543171.
2026-03-15 22:29:05,892 - optuna.study.study - INFO - Trial 36 finished with value: 0.691326989502818 and parameters: {'imbalance_method': 'SMOTEENN', 'n_estimators': 729, 'max_depth': 3, 'learning_rate': 0.0065634416963236695, 'gamma': 0.0032971333099456883, 'lambda': 6.280118225428968e-06, 'alpha': 0.0003312573029134131, 'subsample': 0.9260121709034925, 'colsample_bytree': 0.8849967315371831}. Best is trial 31 with value: 0.7587769051543171.
2026-03-15 22:29:41,847 - optuna.study.study - INFO - Trial 37 finished with value: 0.7503755064012054 and parameters: {'imbalance_method': 'ADASYN', 'n_estimators': 888, 'max_depth': 4, 'learning_rate': 0.015577327507964431, 'gamma': 0.01176171725367931, 'lambda': 1.1045387204665861e-08, 'alpha': 0.0020690488235386305, 'subsample': 0.8561943801880374, 'colsample_bytree': 0.9637260539246144}. Best is trial 31 with value: 0.7587769051543171.
2026-03-15 22:30:06,839 - optuna.study.study - INFO - Trial 38 finished with value: 0.7578280574406803 and parameters: {'imbalance_method': 'Baseline', 'n_estimators': 802, 'max_depth': 5, 'learning_rate': 0.010480403252661922, 'gamma': 0.0006063346603081281, 'lambda': 6.776460540707201e-08, 'alpha': 0.02376781580015574, 'subsample': 0.8094869370186527, 'colsample_bytree': 0.9132896225780776}. Best is trial 31 with value: 0.7587769051543171.
2026-03-15 22:31:54,693 - optuna.study.study - INFO - Trial 39 finished with value: 0.7547218751372654 and parameters: {'imbalance_method': 'TomekLinks', 'n_estimators': 933, 'max_depth': 11, 'learning_rate': 0.01279809330342738, 'gamma': 2.0621910687903792e-05, 'lambda': 2.04300672049519e-06, 'alpha': 0.00031920109720866096, 'subsample': 0.9581845331919012, 'colsample_bytree': 0.9335081658770805}. Best is trial 31 with value: 0.7587769051543171.
2026-03-15 22:32:48,722 - optuna.study.study - INFO - Trial 40 finished with value: 0.7249777790325619 and parameters: {'imbalance_method': 'SMOTEENN', 'n_estimators': 869, 'max_depth': 7, 'learning_rate': 0.039903032538982086, 'gamma': 0.0778756044231471, 'lambda': 1.3070835117049873e-05, 'alpha': 2.075401869396428, 'subsample': 0.8835624971979914, 'colsample_bytree': 0.85813518054829}. Best is trial 31 with value: 0.7587769051543171.
2026-03-15 22:33:13,596 - optuna.study.study - INFO - Trial 41 finished with value: 0.7583008608763472 and parameters: {'imbalance_method': 'Baseline', 'n_estimators': 985, 'max_depth': 4, 'learning_rate': 0.015225282340680494, 'gamma': 0.012794120447053147, 'lambda': 2.5635053801350555e-07, 'alpha': 0.07175710766912091, 'subsample': 0.8359651934901751, 'colsample_bytree': 0.9970761042952279}. Best is trial 31 with value: 0.7587769051543171.
2026-03-15 22:33:40,466 - optuna.study.study - INFO - Trial 42 finished with value: 0.7489338614539073 and parameters: {'imbalance_method': 'Baseline', 'n_estimators': 1000, 'max_depth': 4, 'learning_rate': 0.005066921562472114, 'gamma': 0.0022838398353526297, 'lambda': 4.046484165407822e-07, 'alpha': 0.08746235003281512, 'subsample': 0.8381636694050703, 'colsample_bytree': 0.9677694535480148}. Best is trial 31 with value: 0.7587769051543171.
2026-03-15 22:34:09,886 - optuna.study.study - INFO - Trial 43 finished with value: 0.7593410154633714 and parameters: {'imbalance_method': 'Baseline', 'n_estimators': 964, 'max_depth': 5, 'learning_rate': 0.024040023904595725, 'gamma': 0.007232639572612177, 'lambda': 1.7735101733450217e-06, 'alpha': 0.012056631633617336, 'subsample': 0.7888129503557195, 'colsample_bytree': 0.9875255623149821}. Best is trial 43 with value: 0.7593410154633714.
2026-03-15 22:34:58,896 - optuna.study.study - INFO - Trial 44 finished with value: 0.7583785215143136 and parameters: {'imbalance_method': 'SMOTETomek', 'n_estimators': 938, 'max_depth': 5, 'learning_rate': 0.023353598941444943, 'gamma': 0.005782576164755185, 'lambda': 2.3929208315846885e-06, 'alpha': 0.008936557163001091, 'subsample': 0.7414736797797702, 'colsample_bytree': 0.9308839292682316}. Best is trial 43 with value: 0.7593410154633714.
2026-03-15 22:35:42,336 - optuna.study.study - INFO - Trial 45 finished with value: 0.7587609283155569 and parameters: {'imbalance_method': 'SMOTETomek', 'n_estimators': 765, 'max_depth': 5, 'learning_rate': 0.024621110197813833, 'gamma': 0.00013343768762629792, 'lambda': 1.1742633833346447e-06, 'alpha': 0.009772737591897738, 'subsample': 0.732773462960271, 'colsample_bytree': 0.9264741699162088}. Best is trial 43 with value: 0.7593410154633714.
2026-03-15 22:36:24,608 - optuna.study.study - INFO - Trial 46 finished with value: 0.755356863012727 and parameters: {'imbalance_method': 'SMOTETomek', 'n_estimators': 780, 'max_depth': 5, 'learning_rate': 0.05154781333379176, 'gamma': 0.00013324926832526036, 'lambda': 4.530720136190157e-08, 'alpha': 0.013839775080127466, 'subsample': 0.7968190104529972, 'colsample_bytree': 0.8986665601317517}. Best is trial 43 with value: 0.7593410154633714.
2026-03-15 22:37:59,523 - optuna.study.study - INFO - Trial 47 finished with value: 0.7538844727185477 and parameters: {'imbalance_method': 'SMOTETomek', 'n_estimators': 715, 'max_depth': 9, 'learning_rate': 0.03281625991269461, 'gamma': 3.194829717162813e-05, 'lambda': 5.388668056565591e-07, 'alpha': 0.002107013146505886, 'subsample': 0.6724675707565206, 'colsample_bytree': 0.9828002645991482}. Best is trial 43 with value: 0.7593410154633714.
2026-03-15 22:38:18,536 - optuna.study.study - INFO - Trial 48 finished with value: 0.7575751969126961 and parameters: {'imbalance_method': 'Baseline', 'n_estimators': 841, 'max_depth': 3, 'learning_rate': 0.04812171803468062, 'gamma': 0.0005252686703915047, 'lambda': 1.0232399709547367e-06, 'alpha': 0.00011321591766020026, 'subsample': 0.7253512769277904, 'colsample_bytree': 0.7997834511428059}. Best is trial 43 with value: 0.7593410154633714.
