2026-03-16 11:05:11,200 - optuna.study.study - INFO - Trial 1 finished with value: 0.7567423318416746 and parameters: {'n_estimators': 271, 'max_depth': 4, 'learning_rate': 0.07147566538868565, 'gamma': 1.9227544132338914, 'lambda': 0.5211478723331716, 'alpha': 3.1971300042500865, 'subsample': 0.5678498940988508, 'colsample_bytree': 0.7756308814768118, 'min_child_weight': 20, 'max_delta_step': 8.98469616128458}. Best is trial 1 with value: 0.7567423318416746.
2026-03-16 11:05:33,327 - optuna.study.study - INFO - Trial 2 finished with value: 0.759908170594513 and parameters: {'n_estimators': 813, 'max_depth': 7, 'learning_rate': 0.04988558974552193, 'gamma': 2.2077257737380425, 'lambda': 1.1665309281679368, 'alpha': 1.8688139899379523, 'subsample': 0.6060511767300257, 'colsample_bytree': 0.5777769965733577, 'min_child_weight': 17, 'max_delta_step': 6.916056095222258}. Best is trial 2 with value: 0.759908170594513.
2026-03-16 11:05:52,870 - optuna.study.study - INFO - Trial 3 finished with value: 0.7592620033783147 and parameters: {'n_estimators': 757, 'max_depth': 5, 'learning_rate': 0.1134400858076954, 'gamma': 0.5628281073333108, 'lambda': 1.5722279681152131, 'alpha': 1.0114100614041406, 'subsample': 0.9561811456000261, 'colsample_bytree': 0.626439214396707, 'min_child_weight': 2, 'max_delta_step': 5.449753385961555}. Best is trial 2 with value: 0.759908170594513.
2026-03-16 11:06:02,847 - optuna.study.study - INFO - Trial 4 finished with value: 0.7540214890495975 and parameters: {'n_estimators': 268, 'max_depth': 6, 'learning_rate': 0.03582574314749866, 'gamma': 4.98772683145798, 'lambda': 4.809697614908869, 'alpha': 3.6531024955331244, 'subsample': 0.5210286163234233, 'colsample_bytree': 0.7725438985965287, 'min_child_weight': 2, 'max_delta_step': 0.6816060383603373}. Best is trial 2 with value: 0.759908170594513.
2026-03-16 11:06:19,334 - optuna.study.study - INFO - Trial 5 finished with value: 0.7562954965805567 and parameters: {'n_estimators': 699, 'max_depth': 6, 'learning_rate': 0.05355924123447774, 'gamma': 3.315656510593561, 'lambda': 1.9042171313770642, 'alpha': 3.158986085631448, 'subsample': 0.9781381220581277, 'colsample_bytree': 0.5291785091263086, 'min_child_weight': 10, 'max_delta_step': 2.4588160165374173}. Best is trial 2 with value: 0.759908170594513.
2026-03-16 11:06:33,709 - optuna.study.study - INFO - Trial 6 finished with value: 0.7522452833107365 and parameters: {'n_estimators': 279, 'max_depth': 6, 'learning_rate': 0.18306835532280072, 'gamma': 0.6812176181978413, 'lambda': 0.9049738749420005, 'alpha': 1.0735590810474405, 'subsample': 0.5190389777143936, 'colsample_bytree': 0.7607622246504758, 'min_child_weight': 20, 'max_delta_step': 9.424047025043427}. Best is trial 2 with value: 0.759908170594513.
2026-03-16 11:06:38,037 - optuna.study.study - INFO - Trial 7 finished with value: 0.757373577985012 and parameters: {'n_estimators': 51, 'max_depth': 8, 'learning_rate': 0.19678551481181872, 'gamma': 0.487243866008758, 'lambda': 8.7147974182208, 'alpha': 3.431865133743843, 'subsample': 0.8606085494607196, 'colsample_bytree': 0.726390041117679, 'min_child_weight': 11, 'max_delta_step': 9.838899968589763}. Best is trial 2 with value: 0.759908170594513.
2026-03-16 11:06:46,880 - optuna.study.study - INFO - Trial 8 finished with value: 0.7176923333703833 and parameters: {'n_estimators': 227, 'max_depth': 4, 'learning_rate': 0.007872777310282167, 'gamma': 1.058985521704242, 'lambda': 3.1148094407206695, 'alpha': 4.408478959299435, 'subsample': 0.8219113754984775, 'colsample_bytree': 0.5174443302509051, 'min_child_weight': 9, 'max_delta_step': 6.263535521024432}. Best is trial 2 with value: 0.759908170594513.
2026-03-16 11:06:53,825 - optuna.study.study - INFO - Trial 9 finished with value: 0.7552669749570766 and parameters: {'n_estimators': 243, 'max_depth': 5, 'learning_rate': 0.2512218487419492, 'gamma': 3.516179660286288, 'lambda': 6.107353073256783, 'alpha': 3.8231325932868527, 'subsample': 0.5976501823862597, 'colsample_bytree': 0.5563007086453492, 'min_child_weight': 9, 'max_delta_step': 3.0613276049479285}. Best is trial 2 with value: 0.759908170594513.
2026-03-16 11:07:30,313 - optuna.study.study - INFO - Trial 10 finished with value: 0.7608525204070187 and parameters: {'n_estimators': 984, 'max_depth': 8, 'learning_rate': 0.02671686645651946, 'gamma': 2.107184433910093, 'lambda': 0.9102609253298783, 'alpha': 1.917811764365013, 'subsample': 0.679808701857824, 'colsample_bytree': 0.9810108873525536, 'min_child_weight': 15, 'max_delta_step': 7.166367202437808}. Best is trial 10 with value: 0.7608525204070187.
2026-03-16 11:08:10,828 - optuna.study.study - INFO - Trial 11 finished with value: 0.7610137060860499 and parameters: {'n_estimators': 1000, 'max_depth': 8, 'learning_rate': 0.01851372723739837, 'gamma': 2.2315408982933675, 'lambda': 0.9029383944051262, 'alpha': 1.9166156809264203, 'subsample': 0.6979181144640113, 'colsample_bytree': 0.9564836266870539, 'min_child_weight': 15, 'max_delta_step': 7.187800619117275}. Best is trial 11 with value: 0.7610137060860499.
2026-03-16 11:08:57,055 - optuna.study.study - INFO - Trial 12 finished with value: 0.7611443014167553 and parameters: {'n_estimators': 942, 'max_depth': 8, 'learning_rate': 0.01998722983598815, 'gamma': 1.4836956344582117, 'lambda': 0.6015720832402599, 'alpha': 1.9436312666325222, 'subsample': 0.7004883981985565, 'colsample_bytree': 0.9592615289667993, 'min_child_weight': 16, 'max_delta_step': 8.074617126658373}. Best is trial 12 with value: 0.7611443014167553.
2026-03-16 11:09:47,747 - optuna.study.study - INFO - Trial 13 finished with value: 0.7605548361069329 and parameters: {'n_estimators': 993, 'max_depth': 8, 'learning_rate': 0.017379478519113076, 'gamma': 1.4442502358255631, 'lambda': 0.5150949744198259, 'alpha': 0.11671384569428556, 'subsample': 0.7315407369947862, 'colsample_bytree': 0.9960617231680646, 'min_child_weight': 14, 'max_delta_step': 7.811500569732412}. Best is trial 12 with value: 0.7611443014167553.
2026-03-16 11:10:29,792 - optuna.study.study - INFO - Trial 14 finished with value: 0.7526189676617028 and parameters: {'n_estimators': 554, 'max_depth': 7, 'learning_rate': 0.005312926256875132, 'gamma': 2.7559939396734685, 'lambda': 0.7417724845921116, 'alpha': 1.9858199462615236, 'subsample': 0.7765191273404916, 'colsample_bytree': 0.9009185499133862, 'min_child_weight': 16, 'max_delta_step': 5.263511222763546}. Best is trial 12 with value: 0.7611443014167553.
2026-03-16 11:11:12,659 - optuna.study.study - INFO - Trial 15 finished with value: 0.7603696059261447 and parameters: {'n_estimators': 872, 'max_depth': 7, 'learning_rate': 0.018922872280608884, 'gamma': 1.5025662916787992, 'lambda': 1.254950684348974, 'alpha': 1.1405397247037512, 'subsample': 0.698170684139308, 'colsample_bytree': 0.8873181907811099, 'min_child_weight': 13, 'max_delta_step': 8.20234688109112}. Best is trial 12 with value: 0.7611443014167553.
2026-03-16 11:11:43,621 - optuna.study.study - INFO - Trial 16 finished with value: 0.75887451824415 and parameters: {'n_estimators': 612, 'max_depth': 8, 'learning_rate': 0.010147677971790241, 'gamma': 2.918958859573795, 'lambda': 2.8456528472223326, 'alpha': 2.4300774905015126, 'subsample': 0.7912386442087095, 'colsample_bytree': 0.8946770017858013, 'min_child_weight': 17, 'max_delta_step': 8.400335520320212}. Best is trial 12 with value: 0.7611443014167553.
2026-03-16 11:11:56,989 - optuna.study.study - INFO - Trial 17 finished with value: 0.7530069006518122 and parameters: {'n_estimators': 428, 'max_depth': 3, 'learning_rate': 0.025539442524886373, 'gamma': 1.4998419773044307, 'lambda': 0.6686859749768098, 'alpha': 0.497292891901147, 'subsample': 0.859800408366868, 'colsample_bytree': 0.9405349959800607, 'min_child_weight': 12, 'max_delta_step': 6.310152603660274}. Best is trial 12 with value: 0.7611443014167553.
2026-03-16 11:12:32,003 - optuna.study.study - INFO - Trial 18 finished with value: 0.7602006460050129 and parameters: {'n_estimators': 917, 'max_depth': 7, 'learning_rate': 0.016884505090186276, 'gamma': 2.437348845422945, 'lambda': 1.1753382567986779, 'alpha': 1.517897415549685, 'subsample': 0.6811703897035509, 'colsample_bytree': 0.8415461986672432, 'min_child_weight': 18, 'max_delta_step': 4.683841256762339}. Best is trial 12 with value: 0.7611443014167553.
2026-03-16 11:13:11,552 - optuna.study.study - INFO - Trial 19 finished with value: 0.7565942502593689 and parameters: {'n_estimators': 680, 'max_depth': 8, 'learning_rate': 0.006269660489170234, 'gamma': 4.191142510832818, 'lambda': 0.7300242128099573, 'alpha': 2.427691421420274, 'subsample': 0.7525870885937334, 'colsample_bytree': 0.8360128948800745, 'min_child_weight': 6, 'max_delta_step': 7.435843323188029}. Best is trial 12 with value: 0.7611443014167553.
2026-03-16 11:13:29,418 - optuna.study.study - INFO - Trial 20 finished with value: 0.7323700451851304 and parameters: {'n_estimators': 443, 'max_depth': 7, 'learning_rate': 0.08531510948104573, 'gamma': 1.2390920048789398, 'lambda': 2.545120788427087, 'alpha': 4.606391092530467, 'subsample': 0.9085240989506737, 'colsample_bytree': 0.9432159433736799, 'min_child_weight': 14, 'max_delta_step': 0.0327385853568396}. Best is trial 12 with value: 0.7611443014167553.
2026-03-16 11:14:04,212 - optuna.study.study - INFO - Trial 21 finished with value: 0.7613274652180992 and parameters: {'n_estimators': 996, 'max_depth': 8, 'learning_rate': 0.028361958864125708, 'gamma': 2.1115073409118503, 'lambda': 0.8339961507206956, 'alpha': 1.7934470750314846, 'subsample': 0.6858099042365169, 'colsample_bytree': 0.9995180117760135, 'min_child_weight': 15, 'max_delta_step': 6.352578942891649}. Best is trial 21 with value: 0.7613274652180992.
2026-03-16 11:14:59,996 - optuna.study.study - INFO - Trial 22 finished with value: 0.755715087254693 and parameters: {'n_estimators': 885, 'max_depth': 8, 'learning_rate': 0.031732016015937774, 'gamma': 0.09288686905805887, 'lambda': 0.9315810703182492, 'alpha': 1.5668096324963923, 'subsample': 0.7183680862792056, 'colsample_bytree': 0.9484808296519271, 'min_child_weight': 18, 'max_delta_step': 6.161278487250587}. Best is trial 21 with value: 0.7613274652180992.
2026-03-16 11:15:43,980 - optuna.study.study - INFO - Trial 23 finished with value: 0.7602771012950503 and parameters: {'n_estimators': 813, 'max_depth': 7, 'learning_rate': 0.011422344424565726, 'gamma': 1.885856758926999, 'lambda': 0.6507965641584539, 'alpha': 2.7322760475577192, 'subsample': 0.6495058270663958, 'colsample_bytree': 0.8395273850761271, 'min_child_weight': 15, 'max_delta_step': 8.562022000629861}. Best is trial 21 with value: 0.7613274652180992.
2026-03-16 11:16:20,913 - optuna.study.study - INFO - Trial 24 finished with value: 0.7609230939651294 and parameters: {'n_estimators': 996, 'max_depth': 8, 'learning_rate': 0.02191085782595744, 'gamma': 2.685575634312637, 'lambda': 0.532320713435065, 'alpha': 2.148169871403495, 'subsample': 0.6441119536293434, 'colsample_bytree': 0.9896976833217728, 'min_child_weight': 12, 'max_delta_step': 6.508456620089038}. Best is trial 21 with value: 0.7613274652180992.
2026-03-16 11:16:49,350 - optuna.study.study - INFO - Trial 25 finished with value: 0.7599326709031358 and parameters: {'n_estimators': 926, 'max_depth': 8, 'learning_rate': 0.048276351358779446, 'gamma': 1.8369874204470662, 'lambda': 1.42975421305442, 'alpha': 1.508149602120818, 'subsample': 0.773555485195235, 'colsample_bytree': 0.925171761036902, 'min_child_weight': 19, 'max_delta_step': 7.4866609815154925}. Best is trial 21 with value: 0.7613274652180992.
2026-03-16 11:17:23,157 - optuna.study.study - INFO - Trial 26 finished with value: 0.7597504836753863 and parameters: {'n_estimators': 817, 'max_depth': 7, 'learning_rate': 0.012801726548553284, 'gamma': 3.2130273467435013, 'lambda': 0.9863972447337385, 'alpha': 0.8516646519515314, 'subsample': 0.5785628340205287, 'colsample_bytree': 0.965061327556843, 'min_child_weight': 16, 'max_delta_step': 5.543003878164952}. Best is trial 21 with value: 0.7613274652180992.
2026-03-16 11:17:52,287 - optuna.study.study - INFO - Trial 27 finished with value: 0.7590712206049713 and parameters: {'n_estimators': 927, 'max_depth': 6, 'learning_rate': 0.02987176532764475, 'gamma': 2.400929083340674, 'lambda': 0.7704262203924206, 'alpha': 1.5233988487668044, 'subsample': 0.7170617648392374, 'colsample_bytree': 0.8633952128708547, 'min_child_weight': 13, 'max_delta_step': 4.133436192289833}. Best is trial 21 with value: 0.7613274652180992.
2026-03-16 11:18:39,488 - optuna.study.study - INFO - Trial 28 finished with value: 0.7591328238566865 and parameters: {'n_estimators': 741, 'max_depth': 8, 'learning_rate': 0.008193221178638058, 'gamma': 0.9896436542820843, 'lambda': 3.6930695147104613, 'alpha': 0.5706552870789485, 'subsample': 0.6688442163933659, 'colsample_bytree': 0.7137556399692835, 'min_child_weight': 15, 'max_delta_step': 8.036549875951607}. Best is trial 21 with value: 0.7613274652180992.
2026-03-16 11:19:02,189 - optuna.study.study - INFO - Trial 29 finished with value: 0.753717458625117 and parameters: {'n_estimators': 841, 'max_depth': 3, 'learning_rate': 0.014548429752069273, 'gamma': 1.6871455392992145, 'lambda': 1.9641181282779638, 'alpha': 2.8649558761926714, 'subsample': 0.6252683129480819, 'colsample_bytree': 0.8043778839129032, 'min_child_weight': 7, 'max_delta_step': 9.017524355986355}. Best is trial 21 with value: 0.7613274652180992.
2026-03-16 11:19:25,574 - optuna.study.study - INFO - Trial 30 finished with value: 0.7578131697306247 and parameters: {'n_estimators': 942, 'max_depth': 7, 'learning_rate': 0.042756658312153445, 'gamma': 3.7288751369823885, 'lambda': 1.5473125243250279, 'alpha': 2.232323844601471, 'subsample': 0.7461188937286807, 'colsample_bytree': 0.6808215048201909, 'min_child_weight': 17, 'max_delta_step': 3.0797538022886335}. Best is trial 21 with value: 0.7613274652180992.
2026-03-16 11:19:59,453 - optuna.study.study - INFO - Trial 31 finished with value: 0.7601822884866031 and parameters: {'n_estimators': 974, 'max_depth': 8, 'learning_rate': 0.022335224434717887, 'gamma': 2.8470165428273058, 'lambda': 0.5792800167261256, 'alpha': 2.0213117130244895, 'subsample': 0.6436515311858096, 'colsample_bytree': 0.9905560686302649, 'min_child_weight': 13, 'max_delta_step': 6.541702875675344}. Best is trial 21 with value: 0.7613274652180992.
2026-03-16 11:20:34,969 - optuna.study.study - INFO - Trial 32 finished with value: 0.7597641127709024 and parameters: {'n_estimators': 997, 'max_depth': 8, 'learning_rate': 0.02085259707271042, 'gamma': 2.6424976745096926, 'lambda': 0.5687411407738406, 'alpha': 2.2333468531003984, 'subsample': 0.5535930651279989, 'colsample_bytree': 0.9270810852445709, 'min_child_weight': 12, 'max_delta_step': 5.81721445680465}. Best is trial 21 with value: 0.7613274652180992.
2026-03-16 11:21:02,075 - optuna.study.study - INFO - Trial 33 finished with value: 0.7606124347662265 and parameters: {'n_estimators': 900, 'max_depth': 8, 'learning_rate': 0.07091530609748178, 'gamma': 2.151936000233494, 'lambda': 0.5301929385793425, 'alpha': 2.8697461981105867, 'subsample': 0.6250629524857035, 'colsample_bytree': 0.9974047641479356, 'min_child_weight': 11, 'max_delta_step': 4.651666805515123}. Best is trial 21 with value: 0.7613274652180992.
2026-03-16 11:21:38,078 - optuna.study.study - INFO - Trial 34 finished with value: 0.760544779611149 and parameters: {'n_estimators': 848, 'max_depth': 7, 'learning_rate': 0.014715619719266245, 'gamma': 2.3565132349725224, 'lambda': 0.8003138437634526, 'alpha': 1.785013255452144, 'subsample': 0.6593875946726079, 'colsample_bytree': 0.9613881554144641, 'min_child_weight': 16, 'max_delta_step': 6.760578222217785}. Best is trial 21 with value: 0.7613274652180992.
2026-03-16 11:21:58,971 - optuna.study.study - INFO - Trial 35 finished with value: 0.7586019991717011 and parameters: {'n_estimators': 760, 'max_depth': 8, 'learning_rate': 0.034832462754800564, 'gamma': 3.194344710926459, 'lambda': 1.0913903707491985, 'alpha': 2.5787745755397546, 'subsample': 0.6913530018183207, 'colsample_bytree': 0.8991505405198355, 'min_child_weight': 14, 'max_delta_step': 7.038427454437025}. Best is trial 21 with value: 0.7613274652180992.
2026-03-16 11:22:36,307 - optuna.study.study - INFO - Trial 36 finished with value: 0.7596959238977163 and parameters: {'n_estimators': 948, 'max_depth': 7, 'learning_rate': 0.023685222472485907, 'gamma': 2.060933614400357, 'lambda': 0.6126119228417115, 'alpha': 1.2936953063138676, 'subsample': 0.5965852458732599, 'colsample_bytree': 0.9688972541343548, 'min_child_weight': 19, 'max_delta_step': 8.669730929049457}. Best is trial 21 with value: 0.7613274652180992.
2026-03-16 11:23:00,823 - optuna.study.study - INFO - Trial 37 finished with value: 0.7586699082270275 and parameters: {'n_estimators': 783, 'max_depth': 6, 'learning_rate': 0.040011098595583224, 'gamma': 2.9989043958809787, 'lambda': 0.5082239022053686, 'alpha': 2.1827574849313547, 'subsample': 0.5526304227706826, 'colsample_bytree': 0.9215923203104737, 'min_child_weight': 4, 'max_delta_step': 7.530020511535669}. Best is trial 21 with value: 0.7613274652180992.
2026-03-16 11:23:29,835 - optuna.study.study - INFO - Trial 38 finished with value: 0.7534350598347103 and parameters: {'n_estimators': 1000, 'max_depth': 4, 'learning_rate': 0.009448947937957758, 'gamma': 4.06693825629064, 'lambda': 1.314811833083434, 'alpha': 3.160085624010864, 'subsample': 0.8123334556513643, 'colsample_bytree': 0.870976457262398, 'min_child_weight': 10, 'max_delta_step': 9.252985887363309}. Best is trial 21 with value: 0.7613274652180992.
2026-03-16 11:23:44,726 - optuna.study.study - INFO - Trial 39 finished with value: 0.7569968694390115 and parameters: {'n_estimators': 683, 'max_depth': 8, 'learning_rate': 0.06458533314208961, 'gamma': 4.576340847994077, 'lambda': 0.8370295092146766, 'alpha': 1.753275313945167, 'subsample': 0.7119050082555138, 'colsample_bytree': 0.628196499207315, 'min_child_weight': 12, 'max_delta_step': 5.978540920899617}. Best is trial 21 with value: 0.7613274652180992.
2026-03-16 11:23:55,533 - optuna.study.study - INFO - Trial 40 finished with value: 0.7543162570241776 and parameters: {'n_estimators': 348, 'max_depth': 5, 'learning_rate': 0.015578255759665451, 'gamma': 0.7437066615908723, 'lambda': 1.062213940063705, 'alpha': 1.307122592504374, 'subsample': 0.6208166870430412, 'colsample_bytree': 0.8114779936258315, 'min_child_weight': 9, 'max_delta_step': 9.999236763291973}. Best is trial 21 with value: 0.7613274652180992.
2026-03-16 11:24:19,088 - optuna.study.study - INFO - Trial 41 finished with value: 0.7606979507203414 and parameters: {'n_estimators': 878, 'max_depth': 8, 'learning_rate': 0.02732411722705589, 'gamma': 2.2073214370267262, 'lambda': 0.9133522808433436, 'alpha': 1.8955681850143333, 'subsample': 0.6728226655125049, 'colsample_bytree': 0.9767187320650523, 'min_child_weight': 15, 'max_delta_step': 7.202351067370488}. Best is trial 21 with value: 0.7613274652180992.
2026-03-16 12:28:29,664 - optuna.storages._in_memory - INFO - A new study created in memory with name: no-name-9b71ea5f-7f8a-4ff9-8bec-13bd5f8a4673
2026-03-16 12:28:59,365 - optuna.study.study - INFO - Trial 0 finished with value: 0.7547125697488458 and parameters: {'n_estimators': 475, 'max_depth': 6, 'learning_rate': 0.04355649096468439, 'gamma': 3.9583630396622933, 'lambda': 2.3508111832608463, 'alpha': 2.919438813157746, 'subsample': 0.7175491590324012, 'colsample_bytree': 0.8538363553075641, 'min_child_weight': 8, 'max_delta_step': 0.4469424604035843}. Best is trial 0 with value: 0.7547125697488458.
2026-03-16 12:29:06,988 - optuna.study.study - INFO - Trial 1 finished with value: 0.7470171288606432 and parameters: {'n_estimators': 116, 'max_depth': 6, 'learning_rate': 0.02718858065771361, 'gamma': 2.2985836547030973, 'lambda': 4.309843957284403, 'alpha': 2.7078327015383223, 'subsample': 0.6340389288519033, 'colsample_bytree': 0.6390882744268813, 'min_child_weight': 6, 'max_delta_step': 7.93831207949815}. Best is trial 0 with value: 0.7547125697488458.
2026-03-16 12:29:14,405 - optuna.study.study - INFO - Trial 2 finished with value: 0.7545607779161059 and parameters: {'n_estimators': 109, 'max_depth': 5, 'learning_rate': 0.2671157424076853, 'gamma': 1.357102820930286, 'lambda': 5.655519295683635, 'alpha': 1.68888603105716, 'subsample': 0.998150906767846, 'colsample_bytree': 0.7636151955247812, 'min_child_weight': 12, 'max_delta_step': 0.5457630361983234}. Best is trial 0 with value: 0.7547125697488458.
2026-03-16 12:29:41,713 - optuna.study.study - INFO - Trial 3 finished with value: 0.7483366852723896 and parameters: {'n_estimators': 858, 'max_depth': 4, 'learning_rate': 0.007156715056849333, 'gamma': 1.6189069762962027, 'lambda': 2.281993859395645, 'alpha': 3.522180511238972, 'subsample': 0.8852999550101976, 'colsample_bytree': 0.8523833858239936, 'min_child_weight': 1, 'max_delta_step': 9.18503966610846}. Best is trial 0 with value: 0.7547125697488458.
2026-03-16 12:30:12,051 - optuna.study.study - INFO - Trial 4 finished with value: 0.7527804018352068 and parameters: {'n_estimators': 464, 'max_depth': 4, 'learning_rate': 0.022114651512568306, 'gamma': 4.226314881746933, 'lambda': 1.3939308219841577, 'alpha': 3.376586000687107, 'subsample': 0.8628818934460113, 'colsample_bytree': 0.9550237573607584, 'min_child_weight': 1, 'max_delta_step': 7.666629893101965}. Best is trial 0 with value: 0.7547125697488458.
2026-03-16 12:31:11,076 - optuna.study.study - INFO - Trial 5 finished with value: 0.7458704460709625 and parameters: {'n_estimators': 587, 'max_depth': 7, 'learning_rate': 0.15719345114296024, 'gamma': 0.05096831028921667, 'lambda': 3.004928963457679, 'alpha': 2.6530856121978506, 'subsample': 0.5527687225401277, 'colsample_bytree': 0.5543638402624411, 'min_child_weight': 8, 'max_delta_step': 0.976837611196667}. Best is trial 0 with value: 0.7547125697488458.
