2026-03-16 12:31:55,644 - optuna.study.study - INFO - Trial 6 finished with value: 0.7565323026728513 and parameters: {'n_estimators': 792, 'max_depth': 4, 'learning_rate': 0.11488752076632526, 'gamma': 2.83719423760087, 'lambda': 2.472920880654482, 'alpha': 4.226155850353916, 'subsample': 0.5066529898329806, 'colsample_bytree': 0.9828204341808724, 'min_child_weight': 17, 'max_delta_step': 5.237159531828962}. Best is trial 6 with value: 0.7565323026728513.
2026-03-16 12:32:48,192 - optuna.study.study - INFO - Trial 7 finished with value: 0.7493150640742359 and parameters: {'n_estimators': 842, 'max_depth': 5, 'learning_rate': 0.005850663290452686, 'gamma': 2.5312259830524946, 'lambda': 8.273802574709745, 'alpha': 2.9690327585799663, 'subsample': 0.8738876218864651, 'colsample_bytree': 0.5828310490780813, 'min_child_weight': 16, 'max_delta_step': 9.651391951351865}. Best is trial 6 with value: 0.7565323026728513.
2026-03-16 12:33:23,043 - optuna.study.study - INFO - Trial 8 finished with value: 0.7571685682587014 and parameters: {'n_estimators': 586, 'max_depth': 5, 'learning_rate': 0.18607826194574797, 'gamma': 1.3655050456722773, 'lambda': 8.033455882927809, 'alpha': 1.649707880136454, 'subsample': 0.8035699027982988, 'colsample_bytree': 0.7882514610633147, 'min_child_weight': 18, 'max_delta_step': 3.669731342790107}. Best is trial 8 with value: 0.7571685682587014.
2026-03-16 12:34:10,128 - optuna.study.study - INFO - Trial 9 finished with value: 0.7541347778991225 and parameters: {'n_estimators': 746, 'max_depth': 3, 'learning_rate': 0.021128542653231185, 'gamma': 0.16906768317602516, 'lambda': 2.1837444603759435, 'alpha': 3.5372286553569126, 'subsample': 0.8918282469529157, 'colsample_bytree': 0.9890991487567844, 'min_child_weight': 11, 'max_delta_step': 9.331820170996018}. Best is trial 8 with value: 0.7571685682587014.
2026-03-16 12:34:45,399 - optuna.study.study - INFO - Trial 10 finished with value: 0.7574229317548397 and parameters: {'n_estimators': 313, 'max_depth': 8, 'learning_rate': 0.07348272611288853, 'gamma': 1.0481816883394355, 'lambda': 0.5764512488971482, 'alpha': 0.18845729133613442, 'subsample': 0.7547425740026048, 'colsample_bytree': 0.7051702583944668, 'min_child_weight': 19, 'max_delta_step': 3.2332009400640214}. Best is trial 10 with value: 0.7574229317548397.
2026-03-16 12:35:18,322 - optuna.study.study - INFO - Trial 11 finished with value: 0.7559545107241449 and parameters: {'n_estimators': 310, 'max_depth': 8, 'learning_rate': 0.07909116867511348, 'gamma': 1.0671163035967646, 'lambda': 0.508141631509699, 'alpha': 0.12085081346572846, 'subsample': 0.7682285725627671, 'colsample_bytree': 0.7014015833370122, 'min_child_weight': 20, 'max_delta_step': 3.0808547020529464}. Best is trial 10 with value: 0.7574229317548397.
2026-03-16 12:35:43,327 - optuna.study.study - INFO - Trial 12 finished with value: 0.7564656806622224 and parameters: {'n_estimators': 268, 'max_depth': 8, 'learning_rate': 0.06165395513974517, 'gamma': 0.7431596094363215, 'lambda': 0.650945928468609, 'alpha': 0.9413171972395846, 'subsample': 0.7477158861894017, 'colsample_bytree': 0.7588952860186845, 'min_child_weight': 20, 'max_delta_step': 3.896205720421684}. Best is trial 10 with value: 0.7574229317548397.
2026-03-16 12:36:20,414 - optuna.study.study - INFO - Trial 13 finished with value: 0.7567044374914306 and parameters: {'n_estimators': 633, 'max_depth': 7, 'learning_rate': 0.2000755726167463, 'gamma': 2.035978056802279, 'lambda': 0.9446907466995292, 'alpha': 1.5732427269124492, 'subsample': 0.6731349088936751, 'colsample_bytree': 0.8379742667209134, 'min_child_weight': 15, 'max_delta_step': 2.5864628084580557}. Best is trial 10 with value: 0.7574229317548397.
2026-03-16 12:36:44,390 - optuna.study.study - INFO - Trial 14 finished with value: 0.7555071697187944 and parameters: {'n_estimators': 332, 'max_depth': 7, 'learning_rate': 0.09269229440245376, 'gamma': 3.044938047894166, 'lambda': 8.790167476994496, 'alpha': 0.04334475864137788, 'subsample': 0.8107906426274525, 'colsample_bytree': 0.6824518780762877, 'min_child_weight': 14, 'max_delta_step': 5.494348908885863}. Best is trial 10 with value: 0.7574229317548397.
2026-03-16 12:37:02,630 - optuna.study.study - INFO - Trial 15 finished with value: 0.754911221707043 and parameters: {'n_estimators': 408, 'max_depth': 6, 'learning_rate': 0.29537666470827423, 'gamma': 0.6099541095671287, 'lambda': 1.2763289806876634, 'alpha': 0.8683214759433001, 'subsample': 0.9692688559012969, 'colsample_bytree': 0.5078481488134323, 'min_child_weight': 19, 'max_delta_step': 2.0982728458119313}. Best is trial 10 with value: 0.7574229317548397.
2026-03-16 12:37:45,373 - optuna.study.study - INFO - Trial 16 finished with value: 0.7554759586908893 and parameters: {'n_estimators': 672, 'max_depth': 5, 'learning_rate': 0.1357231633176199, 'gamma': 1.6483590883832302, 'lambda': 4.971594608945115, 'alpha': 1.8545258010868508, 'subsample': 0.6322437964102376, 'colsample_bytree': 0.789890244126209, 'min_child_weight': 18, 'max_delta_step': 4.038378932055459}. Best is trial 10 with value: 0.7574229317548397.
2026-03-16 12:37:58,657 - optuna.study.study - INFO - Trial 17 finished with value: 0.7496020927699968 and parameters: {'n_estimators': 213, 'max_depth': 3, 'learning_rate': 0.049750660650712555, 'gamma': 3.564843551460606, 'lambda': 0.9338301337984489, 'alpha': 0.7289602355879188, 'subsample': 0.8056056339392497, 'colsample_bytree': 0.9002307198173317, 'min_child_weight': 13, 'max_delta_step': 6.197760725944127}. Best is trial 10 with value: 0.7574229317548397.
2026-03-16 12:38:54,773 - optuna.study.study - INFO - Trial 18 finished with value: 0.752612115901316 and parameters: {'n_estimators': 930, 'max_depth': 8, 'learning_rate': 0.012485479300618964, 'gamma': 4.850825020438401, 'lambda': 3.584266315697071, 'alpha': 4.940148020964026, 'subsample': 0.6931478525785677, 'colsample_bytree': 0.6950970212935672, 'min_child_weight': 17, 'max_delta_step': 4.162684199508269}. Best is trial 10 with value: 0.7574229317548397.
2026-03-16 12:39:30,464 - optuna.study.study - INFO - Trial 19 finished with value: 0.7566740924362295 and parameters: {'n_estimators': 530, 'max_depth': 7, 'learning_rate': 0.07213640647026873, 'gamma': 0.7969457762561336, 'lambda': 1.6154234790687885, 'alpha': 1.9169953552103203, 'subsample': 0.8122320737216557, 'colsample_bytree': 0.6342114667486319, 'min_child_weight': 14, 'max_delta_step': 1.873953968920858}. Best is trial 10 with value: 0.7574229317548397.
2026-03-16 12:39:53,723 - optuna.study.study - INFO - Trial 20 finished with value: 0.7574787436793606 and parameters: {'n_estimators': 399, 'max_depth': 6, 'learning_rate': 0.1898267104649964, 'gamma': 1.8372892488559107, 'lambda': 6.430586274113755, 'alpha': 1.3093931229467575, 'subsample': 0.9365477032138014, 'colsample_bytree': 0.8008059188054935, 'min_child_weight': 9, 'max_delta_step': 6.59029791798644}. Best is trial 20 with value: 0.7574787436793606.
2026-03-16 12:40:15,949 - optuna.study.study - INFO - Trial 21 finished with value: 0.7560194655308753 and parameters: {'n_estimators': 373, 'max_depth': 6, 'learning_rate': 0.20337795036696474, 'gamma': 1.9089456044989535, 'lambda': 6.010424091384744, 'alpha': 1.3237250181523474, 'subsample': 0.9437108848792606, 'colsample_bytree': 0.7982366161116671, 'min_child_weight': 9, 'max_delta_step': 6.294886527741455}. Best is trial 20 with value: 0.7574787436793606.
2026-03-16 12:40:24,832 - optuna.study.study - INFO - Trial 22 finished with value: 0.7558298535752553 and parameters: {'n_estimators': 206, 'max_depth': 5, 'learning_rate': 0.11359882845098145, 'gamma': 1.4404873783345176, 'lambda': 6.984405308143626, 'alpha': 0.548461753590326, 'subsample': 0.9249008256010496, 'colsample_bytree': 0.7230431372221748, 'min_child_weight': 10, 'max_delta_step': 6.976576581364307}. Best is trial 20 with value: 0.7574787436793606.
2026-03-16 12:40:52,908 - optuna.study.study - INFO - Trial 23 finished with value: 0.7572046061557914 and parameters: {'n_estimators': 519, 'max_depth': 4, 'learning_rate': 0.18364534189610188, 'gamma': 1.1144535159676536, 'lambda': 9.006427223432448, 'alpha': 2.0885994593831643, 'subsample': 0.8409904794825085, 'colsample_bytree': 0.9178969782194587, 'min_child_weight': 5, 'max_delta_step': 4.621466696149003}. Best is trial 20 with value: 0.7574787436793606.
2026-03-16 12:41:24,780 - optuna.study.study - INFO - Trial 24 finished with value: 0.7568903865285393 and parameters: {'n_estimators': 431, 'max_depth': 4, 'learning_rate': 0.10061404830585377, 'gamma': 1.0254286253688831, 'lambda': 9.84583046095871, 'alpha': 2.359377452314003, 'subsample': 0.8450627277590681, 'colsample_bytree': 0.9077328504946302, 'min_child_weight': 4, 'max_delta_step': 5.276657209014539}. Best is trial 20 with value: 0.7574787436793606.
2026-03-16 12:41:51,091 - optuna.study.study - INFO - Trial 25 finished with value: 0.7552089087169304 and parameters: {'n_estimators': 532, 'max_depth': 3, 'learning_rate': 0.2301459485558201, 'gamma': 2.1194687337689517, 'lambda': 3.7942061094635493, 'alpha': 2.258249624332905, 'subsample': 0.9158409359853528, 'colsample_bytree': 0.9103487364631224, 'min_child_weight': 5, 'max_delta_step': 4.792173469312129}. Best is trial 20 with value: 0.7574787436793606.
2026-03-16 12:42:23,311 - optuna.study.study - INFO - Trial 26 finished with value: 0.7533880930872875 and parameters: {'n_estimators': 205, 'max_depth': 8, 'learning_rate': 0.1437930828917425, 'gamma': 0.4155032284627185, 'lambda': 6.73121718794878, 'alpha': 1.3803692527159015, 'subsample': 0.7545083936240222, 'colsample_bytree': 0.6483682687557262, 'min_child_weight': 3, 'max_delta_step': 5.989389645984771}. Best is trial 20 with value: 0.7574787436793606.
2026-03-16 12:42:32,236 - optuna.study.study - INFO - Trial 27 finished with value: 0.7537659719320963 and parameters: {'n_estimators': 55, 'max_depth': 7, 'learning_rate': 0.06614603761262698, 'gamma': 1.0659734384321333, 'lambda': 0.7278018452545388, 'alpha': 0.3734568710913847, 'subsample': 0.959822099857164, 'colsample_bytree': 0.8283831167952127, 'min_child_weight': 6, 'max_delta_step': 8.110026353093607}. Best is trial 20 with value: 0.7574787436793606.
2026-03-16 12:42:59,465 - optuna.study.study - INFO - Trial 28 finished with value: 0.7543681413977147 and parameters: {'n_estimators': 347, 'max_depth': 4, 'learning_rate': 0.035669856666463017, 'gamma': 2.5308804067964115, 'lambda': 4.872126647137077, 'alpha': 1.1459292408312187, 'subsample': 0.8327939579685851, 'colsample_bytree': 0.9414435221397208, 'min_child_weight': 8, 'max_delta_step': 4.581348485334008}. Best is trial 20 with value: 0.7574787436793606.
2026-03-16 12:43:29,877 - optuna.study.study - INFO - Trial 29 finished with value: 0.7569405242126105 and parameters: {'n_estimators': 484, 'max_depth': 6, 'learning_rate': 0.04490473684158459, 'gamma': 1.799583851567058, 'lambda': 2.8910813952265264, 'alpha': 2.0841076496680113, 'subsample': 0.7171036589704307, 'colsample_bytree': 0.8774553029911759, 'min_child_weight': 7, 'max_delta_step': 3.210141894767505}. Best is trial 20 with value: 0.7574787436793606.
2026-03-16 12:43:50,896 - optuna.study.study - INFO - Trial 30 finished with value: 0.7566073977316169 and parameters: {'n_estimators': 276, 'max_depth': 6, 'learning_rate': 0.16933230419604836, 'gamma': 2.9135212527864787, 'lambda': 1.8654934781987234, 'alpha': 0.3899861091900592, 'subsample': 0.7769752427902027, 'colsample_bytree': 0.7324353889105856, 'min_child_weight': 3, 'max_delta_step': 7.130960618329744}. Best is trial 20 with value: 0.7574787436793606.
2026-03-16 12:44:24,512 - optuna.study.study - INFO - Trial 31 finished with value: 0.7560137877887237 and parameters: {'n_estimators': 571, 'max_depth': 5, 'learning_rate': 0.19484380860506625, 'gamma': 1.2933433473536329, 'lambda': 7.621134466469155, 'alpha': 1.153901483162888, 'subsample': 0.7932661773082577, 'colsample_bytree': 0.8106979740634034, 'min_child_weight': 10, 'max_delta_step': 3.3537690115581738}. Best is trial 20 with value: 0.7574787436793606.
2026-03-16 12:45:27,962 - optuna.study.study - INFO - Trial 32 finished with value: 0.7517126666291705 and parameters: {'n_estimators': 685, 'max_depth': 5, 'learning_rate': 0.13147472871438623, 'gamma': 0.4038268938480024, 'lambda': 6.0865856990215645, 'alpha': 3.0730489278638933, 'subsample': 0.735769574750949, 'colsample_bytree': 0.7762014090925065, 'min_child_weight': 18, 'max_delta_step': 1.982810341630027}. Best is trial 20 with value: 0.7574787436793606.
2026-03-16 12:45:54,720 - optuna.study.study - INFO - Trial 33 finished with value: 0.7566578212903812 and parameters: {'n_estimators': 405, 'max_depth': 4, 'learning_rate': 0.2964332772833898, 'gamma': 1.3049556524386423, 'lambda': 9.902075704691965, 'alpha': 1.5622871214115421, 'subsample': 0.8403938877278012, 'colsample_bytree': 0.8704311420286862, 'min_child_weight': 12, 'max_delta_step': 4.497943561111786}. Best is trial 20 with value: 0.7574787436793606.
2026-03-16 12:46:29,620 - optuna.study.study - INFO - Trial 34 finished with value: 0.7540936861443347 and parameters: {'n_estimators': 470, 'max_depth': 6, 'learning_rate': 0.2275719894275212, 'gamma': 1.5291052041968465, 'lambda': 5.062358579714531, 'alpha': 2.453677706664416, 'subsample': 0.6416960766879014, 'colsample_bytree': 0.6576570283869322, 'min_child_weight': 7, 'max_delta_step': 3.651179683817787}. Best is trial 20 with value: 0.7574787436793606.
2026-03-16 12:47:14,930 - optuna.study.study - INFO - Trial 35 finished with value: 0.24299181027916425 and parameters: {'n_estimators': 602, 'max_depth': 5, 'learning_rate': 0.03347132108507563, 'gamma': 0.9900710510734242, 'lambda': 7.911005197713276, 'alpha': 2.0566351975064796, 'subsample': 0.9137771888605128, 'colsample_bytree': 0.7321657750468419, 'min_child_weight': 16, 'max_delta_step': 0.020262169564183807}. Best is trial 20 with value: 0.7574787436793606.
2026-03-16 12:47:43,247 - optuna.study.study - INFO - Trial 36 finished with value: 0.7542814337789756 and parameters: {'n_estimators': 492, 'max_depth': 4, 'learning_rate': 0.08573233296914798, 'gamma': 2.375452855840966, 'lambda': 4.113354051373713, 'alpha': 1.0492754096256451, 'subsample': 0.9987255302569912, 'colsample_bytree': 0.8156361555619587, 'min_child_weight': 2, 'max_delta_step': 8.46971340136061}. Best is trial 20 with value: 0.7574787436793606.
2026-03-16 12:48:18,431 - optuna.study.study - INFO - Trial 37 finished with value: 0.7556282391201901 and parameters: {'n_estimators': 663, 'max_depth': 3, 'learning_rate': 0.17015391213502545, 'gamma': 1.691511175398821, 'lambda': 5.785740324237242, 'alpha': 1.7278239660656753, 'subsample': 0.863735558782532, 'colsample_bytree': 0.9365616801578209, 'min_child_weight': 19, 'max_delta_step': 1.421223648082086}. Best is trial 20 with value: 0.7574787436793606.
2026-03-16 12:49:03,063 - optuna.study.study - INFO - Trial 38 finished with value: 0.7563511675956099 and parameters: {'n_estimators': 743, 'max_depth': 4, 'learning_rate': 0.05758462894607719, 'gamma': 2.2572071248379144, 'lambda': 3.2066675482369402, 'alpha': 2.72104006657043, 'subsample': 0.7146430899940777, 'colsample_bytree': 0.596786677191949, 'min_child_weight': 5, 'max_delta_step': 2.543137046184617}. Best is trial 20 with value: 0.7574787436793606.
2026-03-16 12:49:38,465 - optuna.study.study - INFO - Trial 39 finished with value: 0.7565970141104422 and parameters: {'n_estimators': 569, 'max_depth': 5, 'learning_rate': 0.11083550550836703, 'gamma': 1.2396642932079351, 'lambda': 1.1494489917029846, 'alpha': 0.6303866699226708, 'subsample': 0.8995356751735799, 'colsample_bytree': 0.7587715955480021, 'min_child_weight': 12, 'max_delta_step': 5.6235001464270296}. Best is trial 20 with value: 0.7574787436793606.
2026-03-16 12:49:59,694 - optuna.study.study - INFO - Trial 40 finished with value: 0.7408779085160306 and parameters: {'n_estimators': 125, 'max_depth': 6, 'learning_rate': 0.015308359050054446, 'gamma': 0.5382418153011006, 'lambda': 8.725666734240747, 'alpha': 1.4983535818703086, 'subsample': 0.7829984643088944, 'colsample_bytree': 0.8491384348500778, 'min_child_weight': 8, 'max_delta_step': 6.977375941857793}. Best is trial 20 with value: 0.7574787436793606.
