2026-03-15 22:38:36,447 - optuna.study.study - INFO - Trial 49 finished with value: 0.7493969937853425 and parameters: {'imbalance_method': 'RandomUnderSampler', 'n_estimators': 890, 'max_depth': 5, 'learning_rate': 0.024715696136319895, 'gamma': 4.140014778420459e-06, 'lambda': 1.0646279965295627e-08, 'alpha': 0.0008799904097239492, 'subsample': 0.7896183213474294, 'colsample_bytree': 0.9471212690245553}. Best is trial 43 with value: 0.7593410154633714.
2026-03-15 22:39:00,545 - optuna.study.study - INFO - Trial 50 finished with value: 0.7593345642954364 and parameters: {'imbalance_method': 'Baseline', 'n_estimators': 375, 'max_depth': 8, 'learning_rate': 0.016964031449790466, 'gamma': 4.770960688150643e-07, 'lambda': 1.8502428991915768e-06, 'alpha': 0.05489041963888824, 'subsample': 0.8943478664929212, 'colsample_bytree': 0.7579095919292771}. Best is trial 43 with value: 0.7593410154633714.
2026-03-15 22:39:13,654 - optuna.study.study - INFO - Trial 51 finished with value: 0.756807383712789 and parameters: {'imbalance_method': 'Baseline', 'n_estimators': 189, 'max_depth': 8, 'learning_rate': 0.01849845444686067, 'gamma': 2.147770154612298e-07, 'lambda': 2.060754446549889e-06, 'alpha': 0.04056430762380811, 'subsample': 0.8938495516796914, 'colsample_bytree': 0.7643315408800527}. Best is trial 43 with value: 0.7593410154633714.
2026-03-15 22:39:30,272 - optuna.study.study - INFO - Trial 52 finished with value: 0.7605245105998363 and parameters: {'imbalance_method': 'Baseline', 'n_estimators': 337, 'max_depth': 7, 'learning_rate': 0.02612645672281865, 'gamma': 1.0696298021438008e-08, 'lambda': 2.9825325842368634e-05, 'alpha': 0.011495784261214207, 'subsample': 0.9204804406822731, 'colsample_bytree': 0.671877873749136}. Best is trial 52 with value: 0.7605245105998363.
2026-03-15 22:39:50,169 - optuna.study.study - INFO - Trial 53 finished with value: 0.7594523932456282 and parameters: {'imbalance_method': 'Baseline', 'n_estimators': 430, 'max_depth': 7, 'learning_rate': 0.027907149498613153, 'gamma': 1.416149401912284e-08, 'lambda': 1.6633693317692643e-05, 'alpha': 0.0028612489023482172, 'subsample': 0.9271305350008099, 'colsample_bytree': 0.6502935101156402}. Best is trial 52 with value: 0.7605245105998363.
2026-03-15 22:40:06,385 - optuna.study.study - INFO - Trial 54 finished with value: 0.7594839199195883 and parameters: {'imbalance_method': 'Baseline', 'n_estimators': 338, 'max_depth': 7, 'learning_rate': 0.0349381847502257, 'gamma': 1.6897650613788106e-08, 'lambda': 2.0565725090490292e-05, 'alpha': 0.05133966331344104, 'subsample': 0.9413468422826892, 'colsample_bytree': 0.6681305878482997}. Best is trial 52 with value: 0.7605245105998363.
2026-03-15 22:40:21,583 - optuna.study.study - INFO - Trial 55 finished with value: 0.7562327728931247 and parameters: {'imbalance_method': 'Baseline', 'n_estimators': 344, 'max_depth': 7, 'learning_rate': 0.07197066188954548, 'gamma': 1.2743416572165845e-08, 'lambda': 2.6252551756479043e-05, 'alpha': 0.001997753927476822, 'subsample': 0.9456099266105975, 'colsample_bytree': 0.6726633142175732}. Best is trial 52 with value: 0.7605245105998363.
2026-03-15 22:40:43,556 - optuna.study.study - INFO - Trial 56 finished with value: 0.758966592381296 and parameters: {'imbalance_method': 'Baseline', 'n_estimators': 384, 'max_depth': 8, 'learning_rate': 0.035645782053253125, 'gamma': 3.723348168295291e-08, 'lambda': 0.00017437878702247303, 'alpha': 0.04900657651841302, 'subsample': 0.9824730226400711, 'colsample_bytree': 0.6410631972426862}. Best is trial 52 with value: 0.7605245105998363.
2026-03-15 22:41:06,337 - optuna.study.study - INFO - Trial 57 finished with value: 0.7591422190625633 and parameters: {'imbalance_method': 'Baseline', 'n_estimators': 394, 'max_depth': 8, 'learning_rate': 0.03437795106197202, 'gamma': 3.691462908065413e-08, 'lambda': 0.0002876364506361107, 'alpha': 0.36477815397034963, 'subsample': 0.9989787831512781, 'colsample_bytree': 0.6517259650702057}. Best is trial 52 with value: 0.7605245105998363.
2026-03-15 22:41:19,505 - optuna.study.study - INFO - Trial 58 finished with value: 0.7590333205747358 and parameters: {'imbalance_method': 'Baseline', 'n_estimators': 295, 'max_depth': 7, 'learning_rate': 0.04730322596871278, 'gamma': 1.110902142246144e-07, 'lambda': 0.0003378979315962222, 'alpha': 0.26662846518052563, 'subsample': 0.9617107126082095, 'colsample_bytree': 0.6060206962767459}. Best is trial 52 with value: 0.7605245105998363.
2026-03-15 22:41:46,308 - optuna.study.study - INFO - Trial 59 finished with value: 0.7598899764620629 and parameters: {'imbalance_method': 'Baseline', 'n_estimators': 461, 'max_depth': 8, 'learning_rate': 0.02771667590609221, 'gamma': 4.3011985117318365e-07, 'lambda': 1.5197354383097963e-05, 'alpha': 0.24435190040620283, 'subsample': 0.996140601664849, 'colsample_bytree': 0.6910027951610571}. Best is trial 52 with value: 0.7605245105998363.
2026-03-15 22:42:23,871 - optuna.study.study - INFO - Trial 60 finished with value: 0.7574744029142754 and parameters: {'imbalance_method': 'Baseline', 'n_estimators': 487, 'max_depth': 9, 'learning_rate': 0.02799547007680898, 'gamma': 5.100557835103864e-07, 'lambda': 1.8589621736340123e-05, 'alpha': 5.532058391105708e-08, 'subsample': 0.9078659846077208, 'colsample_bytree': 0.6929743016233803}. Best is trial 52 with value: 0.7605245105998363.
2026-03-15 22:42:46,587 - optuna.study.study - INFO - Trial 61 finished with value: 0.7575304736092852 and parameters: {'imbalance_method': 'Baseline', 'n_estimators': 406, 'max_depth': 8, 'learning_rate': 0.042294587910686014, 'gamma': 2.7308951501128277e-08, 'lambda': 4.491446440357224e-05, 'alpha': 0.48633261825732677, 'subsample': 0.9997381808023525, 'colsample_bytree': 0.648926987085028}. Best is trial 52 with value: 0.7605245105998363.
2026-03-15 22:43:12,303 - optuna.study.study - INFO - Trial 62 finished with value: 0.7595393223952889 and parameters: {'imbalance_method': 'Baseline', 'n_estimators': 440, 'max_depth': 8, 'learning_rate': 0.03227405853745856, 'gamma': 6.275044661615214e-08, 'lambda': 3.978845327785674e-06, 'alpha': 0.20222784827412532, 'subsample': 0.9360776030576781, 'colsample_bytree': 0.7322207775705429}. Best is trial 52 with value: 0.7605245105998363.
2026-03-15 22:43:34,410 - optuna.study.study - INFO - Trial 63 finished with value: 0.7599735332404832 and parameters: {'imbalance_method': 'Baseline', 'n_estimators': 445, 'max_depth': 7, 'learning_rate': 0.0213633019130717, 'gamma': 8.641293387525835e-08, 'lambda': 1.1434721810557694e-05, 'alpha': 0.15589562764866452, 'subsample': 0.9360509964094251, 'colsample_bytree': 0.7270569160410223}. Best is trial 52 with value: 0.7605245105998363.
2026-03-15 22:44:14,027 - optuna.study.study - INFO - Trial 64 finished with value: 0.754893434214694 and parameters: {'imbalance_method': 'ADASYN', 'n_estimators': 543, 'max_depth': 7, 'learning_rate': 0.021631788103909734, 'gamma': 8.597764291829321e-08, 'lambda': 9.57753881353115e-06, 'alpha': 0.17477045859691012, 'subsample': 0.9297736295553344, 'colsample_bytree': 0.7411459375522491}. Best is trial 52 with value: 0.7605245105998363.
2026-03-15 22:44:30,931 - optuna.study.study - INFO - Trial 65 finished with value: 0.7599654751233699 and parameters: {'imbalance_method': 'Baseline', 'n_estimators': 443, 'max_depth': 6, 'learning_rate': 0.028036280918073787, 'gamma': 1.8019780416445397e-08, 'lambda': 3.610189874283804e-06, 'alpha': 1.1461618762855175, 'subsample': 0.9349857223873921, 'colsample_bytree': 0.6936626787216952}. Best is trial 52 with value: 0.7605245105998363.
2026-03-15 22:44:50,714 - optuna.study.study - INFO - Trial 66 finished with value: 0.7562886231417774 and parameters: {'imbalance_method': 'Baseline', 'n_estimators': 445, 'max_depth': 7, 'learning_rate': 0.058667607648959515, 'gamma': 1.932188525762114e-08, 'lambda': 6.730340521540248e-05, 'alpha': 1.0550366559901356, 'subsample': 0.9413335363059013, 'colsample_bytree': 0.6958490511898076}. Best is trial 52 with value: 0.7605245105998363.
2026-03-15 22:45:02,056 - optuna.study.study - INFO - Trial 67 finished with value: 0.7604041076449853 and parameters: {'imbalance_method': 'Baseline', 'n_estimators': 298, 'max_depth': 6, 'learning_rate': 0.02725674863580841, 'gamma': 6.756603479694003e-08, 'lambda': 1.4187256400651871e-05, 'alpha': 2.888482877082163, 'subsample': 0.9731368242012632, 'colsample_bytree': 0.7254198538252776}. Best is trial 52 with value: 0.7605245105998363.
2026-03-15 22:45:19,901 - optuna.study.study - INFO - Trial 68 finished with value: 0.7602753038628826 and parameters: {'imbalance_method': 'Baseline', 'n_estimators': 490, 'max_depth': 6, 'learning_rate': 0.03139236973407738, 'gamma': 5.601241879389073e-08, 'lambda': 3.8319026643169665e-06, 'alpha': 4.170865645996192, 'subsample': 0.9755314915670691, 'colsample_bytree': 0.7252531991099875}. Best is trial 52 with value: 0.7605245105998363.
2026-03-15 22:45:32,678 - optuna.study.study - INFO - Trial 69 finished with value: 0.7495942599253271 and parameters: {'imbalance_method': 'RandomUnderSampler', 'n_estimators': 489, 'max_depth': 6, 'learning_rate': 0.030202191546689062, 'gamma': 7.263444958827886e-08, 'lambda': 3.3608855165124624e-06, 'alpha': 9.98776440329879, 'subsample': 0.9727606880993767, 'colsample_bytree': 0.7370578763986333}. Best is trial 52 with value: 0.7605245105998363.
2026-03-15 22:45:45,269 - optuna.study.study - INFO - Trial 70 finished with value: 0.7561519138451333 and parameters: {'imbalance_method': 'TomekLinks', 'n_estimators': 298, 'max_depth': 6, 'learning_rate': 0.020696980189666776, 'gamma': 2.0782082241137908e-07, 'lambda': 5.27766958983914e-06, 'alpha': 2.104765710756217, 'subsample': 0.971295745413156, 'colsample_bytree': 0.7275579096276857}. Best is trial 52 with value: 0.7605245105998363.
2026-03-15 22:45:56,748 - optuna.study.study - INFO - Trial 71 finished with value: 0.7600847182518485 and parameters: {'imbalance_method': 'Baseline', 'n_estimators': 300, 'max_depth': 6, 'learning_rate': 0.03230211902107763, 'gamma': 5.554524633366895e-08, 'lambda': 1.2350346304692742e-05, 'alpha': 0.9906392521498694, 'subsample': 0.9461229384526801, 'colsample_bytree': 0.6921740953800646}. Best is trial 52 with value: 0.7605245105998363.
2026-03-15 22:46:18,434 - optuna.study.study - INFO - Trial 72 finished with value: 0.760176855090157 and parameters: {'imbalance_method': 'Baseline', 'n_estimators': 584, 'max_depth': 6, 'learning_rate': 0.026863911632936874, 'gamma': 5.358070294140704e-08, 'lambda': 4.7301170946313427e-05, 'alpha': 3.4557751429937715, 'subsample': 0.9569095797833933, 'colsample_bytree': 0.7027756267212225}. Best is trial 52 with value: 0.7605245105998363.
2026-03-15 22:46:39,451 - optuna.study.study - INFO - Trial 73 finished with value: 0.7610533332344204 and parameters: {'imbalance_method': 'Baseline', 'n_estimators': 575, 'max_depth': 6, 'learning_rate': 0.02546208014690937, 'gamma': 3.746541717846182e-07, 'lambda': 5.758513747267909e-05, 'alpha': 3.5725726163051434, 'subsample': 0.9599266009483745, 'colsample_bytree': 0.689880593207171}. Best is trial 73 with value: 0.7610533332344204.
2026-03-15 22:47:00,768 - optuna.study.study - INFO - Trial 74 finished with value: 0.7583556616284478 and parameters: {'imbalance_method': 'Baseline', 'n_estimators': 593, 'max_depth': 6, 'learning_rate': 0.04491878019741368, 'gamma': 4.8860446816470674e-08, 'lambda': 0.0005251742956575372, 'alpha': 4.265792314186743, 'subsample': 0.9139928991229942, 'colsample_bytree': 0.7105093221679657}. Best is trial 73 with value: 0.7610533332344204.
2026-03-15 22:47:31,115 - optuna.study.study - INFO - Trial 75 finished with value: 0.7200302819730368 and parameters: {'imbalance_method': 'SMOTEENN', 'n_estimators': 510, 'max_depth': 6, 'learning_rate': 0.017972874013256195, 'gamma': 1.472760618243496e-07, 'lambda': 4.603417768091159e-05, 'alpha': 1.0798093779778388, 'subsample': 0.9617272611013338, 'colsample_bytree': 0.6841895172289703}. Best is trial 73 with value: 0.7610533332344204.
2026-03-15 22:47:41,956 - optuna.study.study - INFO - Trial 76 finished with value: 0.7511529698279817 and parameters: {'imbalance_method': 'Baseline', 'n_estimators': 275, 'max_depth': 6, 'learning_rate': 0.20444586970046807, 'gamma': 1.6434235921328684e-06, 'lambda': 0.00012291535223311805, 'alpha': 4.11105927827776, 'subsample': 0.9520716641608702, 'colsample_bytree': 0.7238292944979197}. Best is trial 73 with value: 0.7610533332344204.
2026-03-15 22:47:51,172 - optuna.study.study - INFO - Trial 77 finished with value: 0.7589558467065937 and parameters: {'imbalance_method': 'Baseline', 'n_estimators': 234, 'max_depth': 6, 'learning_rate': 0.026252498291584683, 'gamma': 3.0781763199395176e-07, 'lambda': 9.724123503955706e-06, 'alpha': 6.3395947726646265, 'subsample': 0.9683662057982954, 'colsample_bytree': 0.7130070271138734}. Best is trial 73 with value: 0.7610533332344204.
2026-03-15 22:48:18,977 - optuna.study.study - INFO - Trial 78 finished with value: 0.7522009748989124 and parameters: {'imbalance_method': 'ADASYN', 'n_estimators': 550, 'max_depth': 6, 'learning_rate': 0.03944873312283993, 'gamma': 2.6281549755692658e-08, 'lambda': 5.149875261846158e-05, 'alpha': 2.5099264460167467, 'subsample': 0.9814631360242183, 'colsample_bytree': 0.7733314875237303}. Best is trial 73 with value: 0.7610533332344204.
2026-03-15 22:48:36,871 - optuna.study.study - INFO - Trial 79 finished with value: 0.7607274667790453 and parameters: {'imbalance_method': 'Baseline', 'n_estimators': 573, 'max_depth': 6, 'learning_rate': 0.021170563580979684, 'gamma': 1.0264348397571756e-06, 'lambda': 0.0007119159509854205, 'alpha': 0.6066138177759124, 'subsample': 0.8846235972110915, 'colsample_bytree': 0.7029525942495157}. Best is trial 73 with value: 0.7610533332344204.
2026-03-15 22:48:59,949 - optuna.study.study - INFO - Trial 80 finished with value: 0.7591917689555215 and parameters: {'imbalance_method': 'Baseline', 'n_estimators': 593, 'max_depth': 7, 'learning_rate': 0.02068658482919844, 'gamma': 9.352507090360264e-07, 'lambda': 0.0012923676121481239, 'alpha': 0.6457010069945367, 'subsample': 0.9130085634861799, 'colsample_bytree': 0.6196085486988603}. Best is trial 73 with value: 0.7610533332344204.
2026-03-15 22:49:20,714 - optuna.study.study - INFO - Trial 81 finished with value: 0.7601203327072851 and parameters: {'imbalance_method': 'Baseline', 'n_estimators': 671, 'max_depth': 6, 'learning_rate': 0.029404497976935454, 'gamma': 1.0671468240180262e-08, 'lambda': 3.3553387925342764e-05, 'alpha': 1.0493631976430282, 'subsample': 0.9217415250549603, 'colsample_bytree': 0.7001438237589694}. Best is trial 73 with value: 0.7610533332344204.
2026-03-15 22:49:41,138 - optuna.study.study - INFO - Trial 82 finished with value: 0.7592804708113873 and parameters: {'imbalance_method': 'Baseline', 'n_estimators': 664, 'max_depth': 6, 'learning_rate': 0.031620972880913194, 'gamma': 1.3361770812274278e-07, 'lambda': 0.00013786005212150406, 'alpha': 3.4574332502835974, 'subsample': 0.9540697964881251, 'colsample_bytree': 0.7481891334803887}. Best is trial 73 with value: 0.7610533332344204.
2026-03-15 22:50:09,147 - optuna.study.study - INFO - Trial 83 finished with value: 0.7588965175937504 and parameters: {'imbalance_method': 'Baseline', 'n_estimators': 687, 'max_depth': 7, 'learning_rate': 0.022666410969297526, 'gamma': 1.0441354536593037e-08, 'lambda': 0.0005005854891806782, 'alpha': 1.459692606178834, 'subsample': 0.8849187233878503, 'colsample_bytree': 0.7045911779272656}. Best is trial 73 with value: 0.7610533332344204.
2026-03-15 22:50:27,625 - optuna.study.study - INFO - Trial 84 finished with value: 0.7588458451009193 and parameters: {'imbalance_method': 'Baseline', 'n_estimators': 592, 'max_depth': 6, 'learning_rate': 0.03693810895227928, 'gamma': 4.870279223753356e-08, 'lambda': 8.796147591575074e-05, 'alpha': 6.638349227165048, 'subsample': 0.9187968117977411, 'colsample_bytree': 0.7848703167812456}. Best is trial 73 with value: 0.7610533332344204.
2026-03-15 22:50:52,767 - optuna.study.study - INFO - Trial 85 finished with value: 0.7595987901851412 and parameters: {'imbalance_method': 'RandomOverSampler', 'n_estimators': 624, 'max_depth': 6, 'learning_rate': 0.025534285990516267, 'gamma': 9.090736926747077e-08, 'lambda': 3.029592236213333e-05, 'alpha': 0.7160158237383736, 'subsample': 0.9019138499357909, 'colsample_bytree': 0.6810540130883833}. Best is trial 73 with value: 0.7610533332344204.
2026-03-15 22:51:14,359 - optuna.study.study - INFO - Trial 86 finished with value: 0.7601074757937702 and parameters: {'imbalance_method': 'Baseline', 'n_estimators': 518, 'max_depth': 7, 'learning_rate': 0.013999421633738827, 'gamma': 2.7079179734908918e-08, 'lambda': 9.983645259737155e-06, 'alpha': 2.915563319501479, 'subsample': 0.9828758866462738, 'colsample_bytree': 0.7212437809758784}. Best is trial 73 with value: 0.7610533332344204.
2026-03-15 22:51:28,881 - optuna.study.study - INFO - Trial 87 finished with value: 0.7532211251159399 and parameters: {'imbalance_method': 'TomekLinks', 'n_estimators': 515, 'max_depth': 5, 'learning_rate': 0.01175160660826536, 'gamma': 2.655934889951971e-08, 'lambda': 0.004980768278163481, 'alpha': 2.363947304536202, 'subsample': 0.985811438937436, 'colsample_bytree': 0.6623235575902475}. Best is trial 73 with value: 0.7610533332344204.
2026-03-15 22:51:33,021 - optuna.study.study - INFO - Trial 88 finished with value: 0.7430206796123974 and parameters: {'imbalance_method': 'RandomUnderSampler', 'n_estimators': 203, 'max_depth': 5, 'learning_rate': 0.0134424188953769, 'gamma': 1.0534772747979424e-06, 'lambda': 0.000225605347033033, 'alpha': 6.631098394878133, 'subsample': 0.9701772540799325, 'colsample_bytree': 0.7023192770814815}. Best is trial 73 with value: 0.7610533332344204.
2026-03-15 22:51:39,050 - optuna.study.study - INFO - Trial 89 finished with value: 0.7487385764756321 and parameters: {'imbalance_method': 'Baseline', 'n_estimators': 133, 'max_depth': 7, 'learning_rate': 0.017300212644832644, 'gamma': 2.820137107943551e-07, 'lambda': 0.02093787392418282, 'alpha': 0.4294644628349581, 'subsample': 0.9489299971963672, 'colsample_bytree': 0.6050314332379405}. Best is trial 73 with value: 0.7610533332344204.
2026-03-15 22:52:06,722 - optuna.study.study - INFO - Trial 90 finished with value: 0.7229283922695448 and parameters: {'imbalance_method': 'SMOTEENN', 'n_estimators': 576, 'max_depth': 6, 'learning_rate': 0.030152480032917043, 'gamma': 3.87986938378154e-06, 'lambda': 7.973437500954511e-06, 'alpha': 3.0960120873971486, 'subsample': 0.8831400466605749, 'colsample_bytree': 0.6335504846733581}. Best is trial 73 with value: 0.7610533332344204.
2026-03-15 22:52:20,346 - optuna.study.study - INFO - Trial 91 finished with value: 0.7604970138651996 and parameters: {'imbalance_method': 'Baseline', 'n_estimators': 317, 'max_depth': 7, 'learning_rate': 0.02202722458595236, 'gamma': 4.6164500347513e-08, 'lambda': 3.604857053836326e-05, 'alpha': 1.4545431925416885, 'subsample': 0.9229026519676891, 'colsample_bytree': 0.7234372560519629}. Best is trial 73 with value: 0.7610533332344204.
2026-03-15 22:52:34,037 - optuna.study.study - INFO - Trial 92 finished with value: 0.7600209600384563 and parameters: {'imbalance_method': 'Baseline', 'n_estimators': 316, 'max_depth': 7, 'learning_rate': 0.023141764628417508, 'gamma': 4.230904198378681e-08, 'lambda': 6.694429160108016, 'alpha': 1.5583957365419217, 'subsample': 0.9223843176566137, 'colsample_bytree': 0.7533171867056251}. Best is trial 73 with value: 0.7610533332344204.
2026-03-15 22:52:50,786 - optuna.study.study - INFO - Trial 93 finished with value: 0.7582371485986467 and parameters: {'imbalance_method': 'Baseline', 'n_estimators': 544, 'max_depth': 6, 'learning_rate': 0.05277666706814726, 'gamma': 2.6764970732417904e-08, 'lambda': 4.1984505041067916e-05, 'alpha': 0.8252129745494837, 'subsample': 0.9823109570366378, 'colsample_bytree': 0.7185329235712595}. Best is trial 73 with value: 0.7610533332344204.
2026-03-15 22:53:01,552 - optuna.study.study - INFO - Trial 94 finished with value: 0.7570605006926963 and parameters: {'imbalance_method': 'Baseline', 'n_estimators': 247, 'max_depth': 7, 'learning_rate': 0.01921030258404635, 'gamma': 5.4100988950568205e-08, 'lambda': 6.620049341887018e-05, 'alpha': 5.180392095101238, 'subsample': 0.9577924250261499, 'colsample_bytree': 0.6608792326486542}. Best is trial 73 with value: 0.7610533332344204.
2026-03-15 22:53:12,906 - optuna.study.study - INFO - Trial 95 finished with value: 0.7547911468901699 and parameters: {'imbalance_method': 'SMOTE', 'n_estimators': 271, 'max_depth': 5, 'learning_rate': 0.026043310209498273, 'gamma': 1.5462656848663464e-07, 'lambda': 2.1773251836090084e-05, 'alpha': 7.361959613401723e-06, 'subsample': 0.9729927813006883, 'colsample_bytree': 0.7041584095799246}. Best is trial 73 with value: 0.7610533332344204.
2026-03-15 22:53:25,293 - optuna.study.study - INFO - Trial 96 finished with value: 0.759670764095179 and parameters: {'imbalance_method': 'Baseline', 'n_estimators': 358, 'max_depth': 6, 'learning_rate': 0.037965503486946335, 'gamma': 1.7697358730158105e-08, 'lambda': 2.8984188076295558e-05, 'alpha': 1.6020006269945526, 'subsample': 0.9911173277567618, 'colsample_bytree': 0.6820277601202186}. Best is trial 73 with value: 0.7610533332344204.
2026-03-15 22:53:52,973 - optuna.study.study - INFO - Trial 97 finished with value: 0.760301782787498 and parameters: {'imbalance_method': 'Baseline', 'n_estimators': 655, 'max_depth': 7, 'learning_rate': 0.01368151570893067, 'gamma': 1.0579557161537732e-08, 'lambda': 0.0006643923405251228, 'alpha': 2.9358952752431855, 'subsample': 0.9043331282350725, 'colsample_bytree': 0.7478231686289603}. Best is trial 73 with value: 0.7610533332344204.
