2026-03-16 10:36:29,259 - optuna.study.study - INFO - Trial 77 finished with value: 0.7606454165197967 and parameters: {'n_estimators': 922, 'max_depth': 7, 'learning_rate': 0.009514989269653792, 'gamma': 0.9200114779032644, 'lambda': 0.6747504990020845, 'alpha': 2.0124019308476573, 'subsample': 0.8104858196798822, 'colsample_bytree': 0.9002031644357145, 'min_child_weight': 6, 'max_delta_step': 6.6239174627647515}. Best is trial 54 with value: 0.7611002470930407.
2026-03-16 10:37:12,644 - optuna.study.study - INFO - Trial 78 finished with value: 0.7599998766706145 and parameters: {'n_estimators': 906, 'max_depth': 8, 'learning_rate': 0.009911065197999839, 'gamma': 0.9426037446224256, 'lambda': 0.5738418613100231, 'alpha': 2.0509167624065605, 'subsample': 0.7828426385482918, 'colsample_bytree': 0.7751006534838377, 'min_child_weight': 5, 'max_delta_step': 6.642769976347058}. Best is trial 54 with value: 0.7611002470930407.
2026-03-16 10:37:40,537 - optuna.study.study - INFO - Trial 79 finished with value: 0.7543536989966254 and parameters: {'n_estimators': 636, 'max_depth': 7, 'learning_rate': 0.005011007511250368, 'gamma': 1.1231881600235791, 'lambda': 0.6707620913465403, 'alpha': 2.3753095011561522, 'subsample': 0.8602058470543968, 'colsample_bytree': 0.8977548216036708, 'min_child_weight': 7, 'max_delta_step': 5.828534098310094}. Best is trial 54 with value: 0.7611002470930407.
2026-03-16 10:38:20,957 - optuna.study.study - INFO - Trial 80 finished with value: 0.7608183724916215 and parameters: {'n_estimators': 999, 'max_depth': 8, 'learning_rate': 0.013511598752524124, 'gamma': 1.2924692524465065, 'lambda': 0.5368372271861336, 'alpha': 2.6743675553549955, 'subsample': 0.8377387440484275, 'colsample_bytree': 0.9816565973079523, 'min_child_weight': 4, 'max_delta_step': 7.812567088324199}. Best is trial 54 with value: 0.7611002470930407.
2026-03-16 10:39:19,471 - optuna.study.study - INFO - Trial 81 finished with value: 0.7610050884683778 and parameters: {'n_estimators': 995, 'max_depth': 8, 'learning_rate': 0.013127747445465387, 'gamma': 1.2964491615914118, 'lambda': 0.5276793429690302, 'alpha': 2.5674927584102702, 'subsample': 0.8373651076410835, 'colsample_bytree': 0.985969488149537, 'min_child_weight': 7, 'max_delta_step': 7.7556817749289735}. Best is trial 54 with value: 0.7611002470930407.
2026-03-16 10:40:02,496 - optuna.study.study - INFO - Trial 82 finished with value: 0.760719079723601 and parameters: {'n_estimators': 996, 'max_depth': 8, 'learning_rate': 0.017481152399799926, 'gamma': 1.55599752035937, 'lambda': 0.5283799874120496, 'alpha': 2.6105450786033977, 'subsample': 0.8721803095547742, 'colsample_bytree': 0.9840464697607361, 'min_child_weight': 4, 'max_delta_step': 7.096286540956836}. Best is trial 54 with value: 0.7611002470930407.
2026-03-16 10:40:54,307 - optuna.study.study - INFO - Trial 83 finished with value: 0.7612436187622325 and parameters: {'n_estimators': 940, 'max_depth': 8, 'learning_rate': 0.015286665301217426, 'gamma': 1.277915759721806, 'lambda': 0.5691538583957312, 'alpha': 2.5408658587606516, 'subsample': 0.8727570683514655, 'colsample_bytree': 0.982595005088219, 'min_child_weight': 4, 'max_delta_step': 7.2193824260835235}. Best is trial 83 with value: 0.7612436187622325.
2026-03-16 10:41:46,378 - optuna.study.study - INFO - Trial 84 finished with value: 0.7609435199080506 and parameters: {'n_estimators': 948, 'max_depth': 8, 'learning_rate': 0.015247104349667725, 'gamma': 1.324058371348553, 'lambda': 0.5147971582437818, 'alpha': 3.1173695223098306, 'subsample': 0.8375958150692484, 'colsample_bytree': 0.9837609237914449, 'min_child_weight': 2, 'max_delta_step': 7.870744075662372}. Best is trial 83 with value: 0.7612436187622325.
2026-03-16 10:42:42,795 - optuna.study.study - INFO - Trial 85 finished with value: 0.7612603174160301 and parameters: {'n_estimators': 938, 'max_depth': 8, 'learning_rate': 0.013578567352058857, 'gamma': 1.2869040662740212, 'lambda': 0.5069806337403958, 'alpha': 2.86274938535698, 'subsample': 0.8367525314943006, 'colsample_bytree': 0.9868649837338659, 'min_child_weight': 1, 'max_delta_step': 7.829658190040585}. Best is trial 85 with value: 0.7612603174160301.
2026-03-16 10:43:24,921 - optuna.study.study - INFO - Trial 86 finished with value: 0.7600970585312733 and parameters: {'n_estimators': 933, 'max_depth': 8, 'learning_rate': 0.014990355353710256, 'gamma': 2.050679591588215, 'lambda': 0.5103805324755861, 'alpha': 3.2315713979524956, 'subsample': 0.8886314357040722, 'colsample_bytree': 0.998054153945322, 'min_child_weight': 2, 'max_delta_step': 8.016838451619163}. Best is trial 85 with value: 0.7612603174160301.
2026-03-16 10:44:17,184 - optuna.study.study - INFO - Trial 87 finished with value: 0.761078511280755 and parameters: {'n_estimators': 824, 'max_depth': 8, 'learning_rate': 0.013627084922619468, 'gamma': 1.3506855050210695, 'lambda': 0.5668474793682504, 'alpha': 2.9080532074464336, 'subsample': 0.841116246927293, 'colsample_bytree': 0.9703556190930229, 'min_child_weight': 1, 'max_delta_step': 8.396186449885999}. Best is trial 85 with value: 0.7612603174160301.
2026-03-16 10:44:51,794 - optuna.study.study - INFO - Trial 88 finished with value: 0.7607082964724521 and parameters: {'n_estimators': 896, 'max_depth': 8, 'learning_rate': 0.022462966183923776, 'gamma': 1.3387862369619548, 'lambda': 0.6001738665086391, 'alpha': 3.71248519146324, 'subsample': 0.917860191736835, 'colsample_bytree': 0.9681765163690308, 'min_child_weight': 2, 'max_delta_step': 8.3484340749557}. Best is trial 85 with value: 0.7612603174160301.
2026-03-16 10:45:17,058 - optuna.study.study - INFO - Trial 89 finished with value: 0.7607305577374547 and parameters: {'n_estimators': 818, 'max_depth': 8, 'learning_rate': 0.04480281556474531, 'gamma': 1.7891849712923136, 'lambda': 0.5670588234368438, 'alpha': 2.936120265152135, 'subsample': 0.8598482543705808, 'colsample_bytree': 0.9865017534377242, 'min_child_weight': 1, 'max_delta_step': 8.74407269522751}. Best is trial 85 with value: 0.7612603174160301.
2026-03-16 10:45:39,516 - optuna.study.study - INFO - Trial 90 finished with value: 0.7596053097213584 and parameters: {'n_estimators': 942, 'max_depth': 8, 'learning_rate': 0.18062408127963786, 'gamma': 1.5265204126087046, 'lambda': 0.6299098597940234, 'alpha': 3.180605544370575, 'subsample': 0.84819122657235, 'colsample_bytree': 0.9717695671642904, 'min_child_weight': 3, 'max_delta_step': 7.81181140708586}. Best is trial 85 with value: 0.7612603174160301.
2026-03-16 10:46:34,246 - optuna.study.study - INFO - Trial 91 finished with value: 0.7606997257281071 and parameters: {'n_estimators': 942, 'max_depth': 8, 'learning_rate': 0.013874750829482398, 'gamma': 1.3010643550597376, 'lambda': 0.5507937090730068, 'alpha': 2.749367118345143, 'subsample': 0.8393283716327865, 'colsample_bytree': 0.9509127309690163, 'min_child_weight': 1, 'max_delta_step': 7.738014366944483}. Best is trial 85 with value: 0.7612603174160301.
2026-03-16 10:47:31,225 - optuna.study.study - INFO - Trial 92 finished with value: 0.7609432640470081 and parameters: {'n_estimators': 908, 'max_depth': 8, 'learning_rate': 0.013346457745427325, 'gamma': 1.2045718111678079, 'lambda': 0.5037590686872967, 'alpha': 2.4719859388464425, 'subsample': 0.832087447767818, 'colsample_bytree': 0.9842519079356451, 'min_child_weight': 3, 'max_delta_step': 9.469864090832228}. Best is trial 85 with value: 0.7612603174160301.
2026-03-16 10:48:00,850 - optuna.study.study - INFO - Trial 93 finished with value: 0.7594203165575388 and parameters: {'n_estimators': 415, 'max_depth': 8, 'learning_rate': 0.011747284691414917, 'gamma': 1.656885964329357, 'lambda': 0.5088947029696042, 'alpha': 2.4695892587286354, 'subsample': 0.8843722958024899, 'colsample_bytree': 0.9899979767245908, 'min_child_weight': 3, 'max_delta_step': 8.324919465118295}. Best is trial 85 with value: 0.7612603174160301.
2026-03-16 10:48:50,729 - optuna.study.study - INFO - Trial 94 finished with value: 0.7601597064631805 and parameters: {'n_estimators': 885, 'max_depth': 8, 'learning_rate': 0.017632689480550898, 'gamma': 1.0771260709231307, 'lambda': 0.6061820866065459, 'alpha': 3.4114537279550325, 'subsample': 0.9059945766256232, 'colsample_bytree': 0.9997145532840829, 'min_child_weight': 2, 'max_delta_step': 8.934292763061352}. Best is trial 85 with value: 0.7612603174160301.
2026-03-16 10:49:34,601 - optuna.study.study - INFO - Trial 95 finished with value: 0.7603123528002156 and parameters: {'n_estimators': 725, 'max_depth': 8, 'learning_rate': 0.01580653851444684, 'gamma': 1.4599901055156956, 'lambda': 0.766094503180694, 'alpha': 2.9302774767881212, 'subsample': 0.8203874554372395, 'colsample_bytree': 0.9658554826061332, 'min_child_weight': 1, 'max_delta_step': 9.458264257659529}. Best is trial 85 with value: 0.7612603174160301.
2026-03-16 10:50:34,117 - optuna.study.study - INFO - Trial 96 finished with value: 0.7605935690900593 and parameters: {'n_estimators': 843, 'max_depth': 8, 'learning_rate': 0.010971073328346827, 'gamma': 1.1802881322155412, 'lambda': 0.5041424917844269, 'alpha': 2.546460517461723, 'subsample': 0.8627587062245161, 'colsample_bytree': 0.9507451217902154, 'min_child_weight': 2, 'max_delta_step': 9.471673407713407}. Best is trial 85 with value: 0.7612603174160301.
2026-03-16 10:50:49,102 - optuna.study.study - INFO - Trial 97 finished with value: 0.7582083975182444 and parameters: {'n_estimators': 173, 'max_depth': 8, 'learning_rate': 0.02091711268731922, 'gamma': 0.8365802068273283, 'lambda': 0.5882768695998537, 'alpha': 3.05838144460926, 'subsample': 0.8508304027617297, 'colsample_bytree': 0.9784091499358255, 'min_child_weight': 3, 'max_delta_step': 8.635828107287342}. Best is trial 85 with value: 0.7612603174160301.
2026-03-16 10:51:35,204 - optuna.study.study - INFO - Trial 98 finished with value: 0.7599817606136682 and parameters: {'n_estimators': 768, 'max_depth': 8, 'learning_rate': 0.012687093730414847, 'gamma': 1.8029054277538301, 'lambda': 0.6587510402104827, 'alpha': 2.832482720878864, 'subsample': 0.8282611864865799, 'colsample_bytree': 0.9399122374639524, 'min_child_weight': 1, 'max_delta_step': 9.869395256266722}. Best is trial 85 with value: 0.7612603174160301.
2026-03-16 10:52:19,346 - optuna.study.study - INFO - Trial 99 finished with value: 0.7601481000248601 and parameters: {'n_estimators': 909, 'max_depth': 8, 'learning_rate': 0.0188630365955142, 'gamma': 1.2558364881274933, 'lambda': 0.7152117621441206, 'alpha': 2.4532073270953187, 'subsample': 0.8979147885111372, 'colsample_bytree': 0.9554372069908014, 'min_child_weight': 4, 'max_delta_step': 8.067301982570031}. Best is trial 85 with value: 0.7612603174160301.
2026-03-16 10:53:05,231 - optuna.study.study - INFO - Trial 100 finished with value: 0.7610639147785431 and parameters: {'n_estimators': 821, 'max_depth': 8, 'learning_rate': 0.015216363647235748, 'gamma': 1.3996252526546076, 'lambda': 0.5580373548035285, 'alpha': 2.2247975780807447, 'subsample': 0.8702539764673008, 'colsample_bytree': 0.9880584519037452, 'min_child_weight': 3, 'max_delta_step': 7.157487187223797}. Best is trial 85 with value: 0.7612603174160301.
2026-03-16 10:53:46,823 - optuna.study.study - INFO - Trial 101 finished with value: 0.7603138760112884 and parameters: {'n_estimators': 822, 'max_depth': 8, 'learning_rate': 0.014224420456864182, 'gamma': 1.4364189882622669, 'lambda': 0.5459963832120328, 'alpha': 2.230088347846167, 'subsample': 0.8751711188798189, 'colsample_bytree': 0.9898307214918317, 'min_child_weight': 3, 'max_delta_step': 7.250908064740061}. Best is trial 85 with value: 0.7612603174160301.
2026-03-16 10:54:33,792 - optuna.study.study - INFO - Trial 102 finished with value: 0.7607817142789424 and parameters: {'n_estimators': 867, 'max_depth': 8, 'learning_rate': 0.015172342078708035, 'gamma': 1.060356637593359, 'lambda': 0.6440572225741321, 'alpha': 2.3569433874758476, 'subsample': 0.9529069118975295, 'colsample_bytree': 0.970815760734595, 'min_child_weight': 5, 'max_delta_step': 7.674030888614868}. Best is trial 85 with value: 0.7612603174160301.
2026-03-16 10:55:16,582 - optuna.study.study - INFO - Trial 103 finished with value: 0.7601914310155142 and parameters: {'n_estimators': 685, 'max_depth': 8, 'learning_rate': 0.01017251189313163, 'gamma': 2.1074994788083607, 'lambda': 0.5492960471435906, 'alpha': 3.1645723109781776, 'subsample': 0.9308994605984588, 'colsample_bytree': 0.9835096973640863, 'min_child_weight': 2, 'max_delta_step': 7.12353915631146}. Best is trial 85 with value: 0.7612603174160301.
2026-03-16 10:56:03,781 - optuna.study.study - INFO - Trial 104 finished with value: 0.7606109189369882 and parameters: {'n_estimators': 783, 'max_depth': 8, 'learning_rate': 0.01270491539423837, 'gamma': 1.658849830509969, 'lambda': 0.5009673912530116, 'alpha': 3.619045899101497, 'subsample': 0.8361495844873563, 'colsample_bytree': 0.9634332778171462, 'min_child_weight': 4, 'max_delta_step': 7.586548247181835}. Best is trial 85 with value: 0.7612603174160301.
2026-03-16 10:56:43,034 - optuna.study.study - INFO - Trial 105 finished with value: 0.7594716333330815 and parameters: {'n_estimators': 545, 'max_depth': 8, 'learning_rate': 0.011352292265467521, 'gamma': 1.3932412027706267, 'lambda': 0.6104963637368688, 'alpha': 4.133466569935994, 'subsample': 0.8151694950815457, 'colsample_bytree': 0.9787122381929008, 'min_child_weight': 1, 'max_delta_step': 8.257756535786305}. Best is trial 85 with value: 0.7612603174160301.
2026-03-16 10:57:46,462 - optuna.study.study - INFO - Trial 106 finished with value: 0.7603580629567505 and parameters: {'n_estimators': 921, 'max_depth': 8, 'learning_rate': 0.008158150237960673, 'gamma': 1.2337579593043027, 'lambda': 0.6974107767857054, 'alpha': 2.1140384977763724, 'subsample': 0.8500004864285733, 'colsample_bytree': 0.9455587243972147, 'min_child_weight': 2, 'max_delta_step': 6.837179775201183}. Best is trial 85 with value: 0.7612603174160301.
2026-03-16 10:58:40,355 - optuna.study.study - INFO - Trial 107 finished with value: 0.7605955121737368 and parameters: {'n_estimators': 897, 'max_depth': 8, 'learning_rate': 0.017120594638644807, 'gamma': 0.9256858910400598, 'lambda': 0.5761694369664829, 'alpha': 2.7522584774458796, 'subsample': 0.8272430484645067, 'colsample_bytree': 0.9992792168231334, 'min_child_weight': 3, 'max_delta_step': 6.292994611545316}. Best is trial 85 with value: 0.7612603174160301.
2026-03-16 10:58:56,018 - optuna.study.study - INFO - Trial 108 finished with value: 0.7555945549800794 and parameters: {'n_estimators': 222, 'max_depth': 8, 'learning_rate': 0.013097260905432407, 'gamma': 1.127731423071502, 'lambda': 0.5321235698619753, 'alpha': 2.294575422010327, 'subsample': 0.8701101407466993, 'colsample_bytree': 0.9580492777913326, 'min_child_weight': 3, 'max_delta_step': 8.001209543764217}. Best is trial 85 with value: 0.7612603174160301.
2026-03-16 10:59:16,287 - optuna.study.study - INFO - Trial 109 finished with value: 0.7532624111084498 and parameters: {'n_estimators': 945, 'max_depth': 3, 'learning_rate': 0.0257231282753834, 'gamma': 3.7021997684200723, 'lambda': 0.6277306473287733, 'alpha': 2.6434174974684193, 'subsample': 0.8542725918247178, 'colsample_bytree': 0.6615808540902435, 'min_child_weight': 2, 'max_delta_step': 8.507400468765082}. Best is trial 85 with value: 0.7612603174160301.
2026-03-16 10:59:36,019 - optuna.study._optimize - WARNING - Trial 110 failed with parameters: {'n_estimators': 973, 'max_depth': 8, 'learning_rate': 0.014661462231096527, 'gamma': 0.70552555133513, 'lambda': 0.7564071196745012, 'alpha': 3.0492550385768453, 'subsample': 0.8428534788864027, 'colsample_bytree': 0.9366658750855802, 'min_child_weight': 5, 'max_delta_step': 9.164048559704044} because of the following error: KeyboardInterrupt().
Traceback (most recent call last):
  File [35m"c:\Users\gonzalo.iglesias\AppData\Local\miniconda3\envs\machinelearning2\Lib\site-packages\optuna\study\_optimize.py"[0m, line [35m206[0m, in [35m_run_trial[0m
    value_or_values = func(trial)
  File [35m"C:\Users\gonzalo.iglesias\AppData\Local\Temp\ipykernel_24236\904504640.py"[0m, line [35m49[0m, in [35mobjective[0m
    scores = cross_val_score(
        pipeline,
    ...<3 lines>...
        n_jobs=1
    )
  File [35m"c:\Users\gonzalo.iglesias\AppData\Local\miniconda3\envs\machinelearning2\Lib\site-packages\sklearn\utils\_param_validation.py"[0m, line [35m218[0m, in [35mwrapper[0m
    return func(*args, **kwargs)
  File [35m"c:\Users\gonzalo.iglesias\AppData\Local\miniconda3\envs\machinelearning2\Lib\site-packages\sklearn\model_selection\_validation.py"[0m, line [35m651[0m, in [35mcross_val_score[0m
    cv_results = cross_validate(
        estimator=estimator,
    ...<9 lines>...
        error_score=error_score,
    )
  File [35m"c:\Users\gonzalo.iglesias\AppData\Local\miniconda3\envs\machinelearning2\Lib\site-packages\sklearn\utils\_param_validation.py"[0m, line [35m218[0m, in [35mwrapper[0m
    return func(*args, **kwargs)
  File [35m"c:\Users\gonzalo.iglesias\AppData\Local\miniconda3\envs\machinelearning2\Lib\site-packages\sklearn\model_selection\_validation.py"[0m, line [35m373[0m, in [35mcross_validate[0m
    results = parallel(
        delayed(_fit_and_score)(
    ...<15 lines>...
        for train, test in indices
    )
  File [35m"c:\Users\gonzalo.iglesias\AppData\Local\miniconda3\envs\machinelearning2\Lib\site-packages\sklearn\utils\parallel.py"[0m, line [35m91[0m, in [35m__call__[0m
    return [31msuper().__call__[0m[1;31m(iterable_with_config_and_warning_filters)[0m
           [31m~~~~~~~~~~~~~~~~[0m[1;31m^^^^^^^^^^^^^^^^^^^^^^^^^^^^^^^^^^^^^^^^^^[0m
  File [35m"c:\Users\gonzalo.iglesias\AppData\Local\miniconda3\envs\machinelearning2\Lib\site-packages\joblib\parallel.py"[0m, line [35m1986[0m, in [35m__call__[0m
    return output if self.return_generator else [31mlist[0m[1;31m(output)[0m
                                                [31m~~~~[0m[1;31m^^^^^^^^[0m
  File [35m"c:\Users\gonzalo.iglesias\AppData\Local\miniconda3\envs\machinelearning2\Lib\site-packages\joblib\parallel.py"[0m, line [35m1914[0m, in [35m_get_sequential_output[0m
    res = func(*args, **kwargs)
  File [35m"c:\Users\gonzalo.iglesias\AppData\Local\miniconda3\envs\machinelearning2\Lib\site-packages\sklearn\utils\parallel.py"[0m, line [35m184[0m, in [35m__call__[0m
    return [31mself.function[0m[1;31m(*args, **kwargs)[0m
           [31m~~~~~~~~~~~~~[0m[1;31m^^^^^^^^^^^^^^^^^[0m
  File [35m"c:\Users\gonzalo.iglesias\AppData\Local\miniconda3\envs\machinelearning2\Lib\site-packages\sklearn\model_selection\_validation.py"[0m, line [35m833[0m, in [35m_fit_and_score[0m
    [31mestimator.fit[0m[1;31m(X_train, y_train, **fit_params)[0m
    [31m~~~~~~~~~~~~~[0m[1;31m^^^^^^^^^^^^^^^^^^^^^^^^^^^^^^^^[0m
  File [35m"c:\Users\gonzalo.iglesias\AppData\Local\miniconda3\envs\machinelearning2\Lib\site-packages\sklearn\base.py"[0m, line [35m1336[0m, in [35mwrapper[0m
    return fit_method(estimator, *args, **kwargs)
  File [35m"c:\Users\gonzalo.iglesias\AppData\Local\miniconda3\envs\machinelearning2\Lib\site-packages\imblearn\pipeline.py"[0m, line [35m522[0m, in [35mfit[0m
    [31mself._final_estimator.fit[0m[1;31m(Xt, yt, **last_step_params["fit"])[0m
    [31m~~~~~~~~~~~~~~~~~~~~~~~~~[0m[1;31m^^^^^^^^^^^^^^^^^^^^^^^^^^^^^^^^^^^[0m
  File [35m"c:\Users\gonzalo.iglesias\AppData\Local\miniconda3\envs\machinelearning2\Lib\site-packages\xgboost\core.py"[0m, line [35m751[0m, in [35minner_f[0m
    return func(**kwargs)
  File [35m"c:\Users\gonzalo.iglesias\AppData\Local\miniconda3\envs\machinelearning2\Lib\site-packages\xgboost\sklearn.py"[0m, line [35m1806[0m, in [35mfit[0m
    self._Booster = [31mtrain[0m[1;31m([0m
                    [31m~~~~~[0m[1;31m^[0m
        [1;31mparams,[0m
        [1;31m^^^^^^^[0m
    ...<9 lines>...
        [1;31mcallbacks=self.callbacks,[0m
        [1;31m^^^^^^^^^^^^^^^^^^^^^^^^^[0m
    [1;31m)[0m
    [1;31m^[0m
  File [35m"c:\Users\gonzalo.iglesias\AppData\Local\miniconda3\envs\machinelearning2\Lib\site-packages\xgboost\core.py"[0m, line [35m751[0m, in [35minner_f[0m
    return func(**kwargs)
  File [35m"c:\Users\gonzalo.iglesias\AppData\Local\miniconda3\envs\machinelearning2\Lib\site-packages\xgboost\training.py"[0m, line [35m200[0m, in [35mtrain[0m
    [31mbst.update[0m[1;31m(dtrain, iteration=i, fobj=obj)[0m
    [31m~~~~~~~~~~[0m[1;31m^^^^^^^^^^^^^^^^^^^^^^^^^^^^^^^[0m
  File [35m"c:\Users\gonzalo.iglesias\AppData\Local\miniconda3\envs\machinelearning2\Lib\site-packages\xgboost\core.py"[0m, line [35m2391[0m, in [35mupdate[0m
    [31m_LIB.XGBoosterUpdateOneIter[0m[1;31m([0m
    [31m~~~~~~~~~~~~~~~~~~~~~~~~~~~[0m[1;31m^[0m
        [1;31mself.handle, ctypes.c_int(iteration), dtrain.handle[0m
        [1;31m^^^^^^^^^^^^^^^^^^^^^^^^^^^^^^^^^^^^^^^^^^^^^^^^^^^[0m
    [1;31m)[0m
    [1;31m^[0m
[1;35mKeyboardInterrupt[0m
2026-03-16 10:59:36,025 - optuna.study._optimize - WARNING - Trial 110 failed with value None.
2026-03-16 11:04:54,538 - optuna.storages._in_memory - INFO - A new study created in memory with name: no-name-b6630d85-4cdc-4255-a946-dc3f58ad1b6c
2026-03-16 11:05:02,494 - optuna.study.study - INFO - Trial 0 finished with value: 0.7321785085915776 and parameters: {'n_estimators': 192, 'max_depth': 4, 'learning_rate': 0.012682893970507137, 'gamma': 3.9982340083993395, 'lambda': 1.8510393276651156, 'alpha': 2.767854874673956, 'subsample': 0.6394929799425003, 'colsample_bytree': 0.6294292947322329, 'min_child_weight': 7, 'max_delta_step': 3.9794383599374816}. Best is trial 0 with value: 0.7321785085915776.
