2026-03-16 10:09:16,310 - optuna.study.study - INFO - Trial 30 finished with value: 0.7570559854011979 and parameters: {'n_estimators': 346, 'max_depth': 8, 'learning_rate': 0.009824833078188466, 'gamma': 0.49876525463901533, 'lambda': 1.6042460503185116, 'alpha': 4.876062730929259, 'subsample': 0.956705717400435, 'colsample_bytree': 0.99892932293533, 'min_child_weight': 4, 'max_delta_step': 5.983379033667615}. Best is trial 28 with value: 0.7609731016325244.
2026-03-16 10:09:56,682 - optuna.study.study - INFO - Trial 31 finished with value: 0.7595732960683698 and parameters: {'n_estimators': 579, 'max_depth': 8, 'learning_rate': 0.01703901040497096, 'gamma': 0.8708922524187818, 'lambda': 0.8330045812126387, 'alpha': 0.4639770627193385, 'subsample': 0.9233359609520386, 'colsample_bytree': 0.9873707035982735, 'min_child_weight': 6, 'max_delta_step': 5.342145963467717}. Best is trial 28 with value: 0.7609731016325244.
2026-03-16 10:11:08,298 - optuna.study.study - INFO - Trial 32 finished with value: 0.760097193664508 and parameters: {'n_estimators': 915, 'max_depth': 8, 'learning_rate': 0.00847392478298627, 'gamma': 0.042078880473400804, 'lambda': 1.294455894906597, 'alpha': 0.023221220382254604, 'subsample': 0.8667530196048574, 'colsample_bytree': 0.9418973209635013, 'min_child_weight': 3, 'max_delta_step': 6.924434752362938}. Best is trial 28 with value: 0.7609731016325244.
2026-03-16 10:11:23,425 - optuna.study.study - INFO - Trial 33 finished with value: 0.7535523804693881 and parameters: {'n_estimators': 247, 'max_depth': 8, 'learning_rate': 0.010244111996629343, 'gamma': 0.1084786808554786, 'lambda': 2.1402964340330257, 'alpha': 0.396788301670421, 'subsample': 0.8576317203577367, 'colsample_bytree': 0.9466510237162581, 'min_child_weight': 2, 'max_delta_step': 6.903663681271709}. Best is trial 28 with value: 0.7609731016325244.
2026-03-16 10:11:59,246 - optuna.study.study - INFO - Trial 34 finished with value: 0.7590174928950435 and parameters: {'n_estimators': 830, 'max_depth': 8, 'learning_rate': 0.02868965248410723, 'gamma': 0.48592170015192615, 'lambda': 1.2645527967576884, 'alpha': 0.5315167053552243, 'subsample': 0.9330793162867809, 'colsample_bytree': 0.9491454360324496, 'min_child_weight': 5, 'max_delta_step': 6.8777644698142595}. Best is trial 28 with value: 0.7609731016325244.
2026-03-16 10:12:26,810 - optuna.study.study - INFO - Trial 35 finished with value: 0.759377816128204 and parameters: {'n_estimators': 487, 'max_depth': 8, 'learning_rate': 0.01467900567304352, 'gamma': 0.35822957218096896, 'lambda': 1.635018287529716, 'alpha': 1.1346715801041642, 'subsample': 0.9754785224379279, 'colsample_bytree': 0.9219769125491611, 'min_child_weight': 3, 'max_delta_step': 7.849479999918392}. Best is trial 28 with value: 0.7609731016325244.
2026-03-16 10:13:08,585 - optuna.study.study - INFO - Trial 36 finished with value: 0.760874376116394 and parameters: {'n_estimators': 925, 'max_depth': 8, 'learning_rate': 0.008856116050942399, 'gamma': 1.000671022091527, 'lambda': 1.3714916353719457, 'alpha': 0.024779506104976902, 'subsample': 0.804664390711182, 'colsample_bytree': 0.9724322005971548, 'min_child_weight': 7, 'max_delta_step': 5.273695200017894}. Best is trial 28 with value: 0.7609731016325244.
2026-03-16 10:13:44,950 - optuna.study.study - INFO - Trial 37 finished with value: 0.7590911997976691 and parameters: {'n_estimators': 912, 'max_depth': 7, 'learning_rate': 0.006373542827476038, 'gamma': 1.0845536526313089, 'lambda': 1.307205401970877, 'alpha': 0.04067712001082996, 'subsample': 0.8181456694557586, 'colsample_bytree': 0.8623316191948766, 'min_child_weight': 8, 'max_delta_step': 6.409755858378899}. Best is trial 28 with value: 0.7609731016325244.
2026-03-16 10:14:28,975 - optuna.study.study - INFO - Trial 38 finished with value: 0.760654058189051 and parameters: {'n_estimators': 997, 'max_depth': 8, 'learning_rate': 0.012487127727327962, 'gamma': 0.2906617699445476, 'lambda': 0.9334742981501265, 'alpha': 0.8584383563032333, 'subsample': 0.7685307461515141, 'colsample_bytree': 0.9632112740674845, 'min_child_weight': 11, 'max_delta_step': 5.002109796326949}. Best is trial 28 with value: 0.7609731016325244.
2026-03-16 10:14:53,393 - optuna.study.study - INFO - Trial 39 finished with value: 0.7555572206919923 and parameters: {'n_estimators': 793, 'max_depth': 4, 'learning_rate': 0.01216857223698065, 'gamma': 2.001910097778402, 'lambda': 0.724677847040334, 'alpha': 1.5702347226208393, 'subsample': 0.7637893721942043, 'colsample_bytree': 0.9679332815860144, 'min_child_weight': 11, 'max_delta_step': 5.031956724109541}. Best is trial 28 with value: 0.7609731016325244.
2026-03-16 10:15:27,429 - optuna.study.study - INFO - Trial 40 finished with value: 0.7607553233147087 and parameters: {'n_estimators': 977, 'max_depth': 7, 'learning_rate': 0.016378001079949005, 'gamma': 1.0124053537500841, 'lambda': 0.9414382229020855, 'alpha': 1.8565388764540716, 'subsample': 0.797479575478781, 'colsample_bytree': 0.9097084564316192, 'min_child_weight': 10, 'max_delta_step': 4.345986961452265}. Best is trial 28 with value: 0.7609731016325244.
2026-03-16 10:16:01,413 - optuna.study.study - INFO - Trial 41 finished with value: 0.7599538665870758 and parameters: {'n_estimators': 983, 'max_depth': 7, 'learning_rate': 0.018160707642897168, 'gamma': 0.9863021637315649, 'lambda': 0.9836081332451622, 'alpha': 1.992323849436622, 'subsample': 0.7391541730651842, 'colsample_bytree': 0.9079642760465587, 'min_child_weight': 10, 'max_delta_step': 4.3423192272778826}. Best is trial 28 with value: 0.7609731016325244.
2026-03-16 10:16:33,849 - optuna.study.study - INFO - Trial 42 finished with value: 0.7604154098357475 and parameters: {'n_estimators': 853, 'max_depth': 6, 'learning_rate': 0.011861568735096166, 'gamma': 0.39630829435502907, 'lambda': 0.8111602784718492, 'alpha': 0.7241645849187495, 'subsample': 0.8003014465404211, 'colsample_bytree': 0.919605969997277, 'min_child_weight': 8, 'max_delta_step': 5.168591879620005}. Best is trial 28 with value: 0.7609731016325244.
2026-03-16 10:17:04,752 - optuna.study.study - INFO - Trial 43 finished with value: 0.7599333776412168 and parameters: {'n_estimators': 857, 'max_depth': 6, 'learning_rate': 0.012248326284173954, 'gamma': 0.3107140823441539, 'lambda': 0.6075698181404834, 'alpha': 0.8454804661844169, 'subsample': 0.7866441362113235, 'colsample_bytree': 0.9232739920684043, 'min_child_weight': 8, 'max_delta_step': 5.261376196582714}. Best is trial 28 with value: 0.7609731016325244.
2026-03-16 10:17:31,713 - optuna.study.study - INFO - Trial 44 finished with value: 0.7581555445251604 and parameters: {'n_estimators': 955, 'max_depth': 6, 'learning_rate': 0.034663096911380246, 'gamma': 0.6327544383777725, 'lambda': 0.8533364942667507, 'alpha': 1.2245288794811575, 'subsample': 0.8003492159469145, 'colsample_bytree': 0.9736793902509887, 'min_child_weight': 10, 'max_delta_step': 4.048937121813902}. Best is trial 28 with value: 0.7609731016325244.
2026-03-16 10:18:15,048 - optuna.study.study - INFO - Trial 45 finished with value: 0.7576629225291055 and parameters: {'n_estimators': 987, 'max_depth': 8, 'learning_rate': 0.025020062907621994, 'gamma': 0.3406709215034416, 'lambda': 0.7460625943931729, 'alpha': 1.4116596489242033, 'subsample': 0.7583015501077071, 'colsample_bytree': 0.501661891120288, 'min_child_weight': 7, 'max_delta_step': 6.322262338308157}. Best is trial 28 with value: 0.7609731016325244.
2026-03-16 10:18:39,198 - optuna.study.study - INFO - Trial 46 finished with value: 0.7594097527618175 and parameters: {'n_estimators': 838, 'max_depth': 5, 'learning_rate': 0.014492503403160975, 'gamma': 0.7053312602294859, 'lambda': 0.5741595618716236, 'alpha': 1.8939057419283654, 'subsample': 0.7197639767813551, 'colsample_bytree': 0.8500940933440112, 'min_child_weight': 11, 'max_delta_step': 4.850034137597062}. Best is trial 28 with value: 0.7609731016325244.
2026-03-16 10:19:07,683 - optuna.study.study - INFO - Trial 47 finished with value: 0.7595253011804051 and parameters: {'n_estimators': 997, 'max_depth': 6, 'learning_rate': 0.011689643695217812, 'gamma': 0.9902118626973507, 'lambda': 7.994355948554236, 'alpha': 0.7132455714717547, 'subsample': 0.8408984992041221, 'colsample_bytree': 0.9735164227604427, 'min_child_weight': 8, 'max_delta_step': 5.622629657326612}. Best is trial 28 with value: 0.7609731016325244.
2026-03-16 10:19:42,286 - optuna.study.study - INFO - Trial 48 finished with value: 0.7604248621761056 and parameters: {'n_estimators': 952, 'max_depth': 7, 'learning_rate': 0.0068419672518074065, 'gamma': 0.24346314691346804, 'lambda': 1.9330004464582242, 'alpha': 1.0385429952768153, 'subsample': 0.7294353839306879, 'colsample_bytree': 0.9191423503568071, 'min_child_weight': 12, 'max_delta_step': 7.341970268410564}. Best is trial 28 with value: 0.7609731016325244.
2026-03-16 10:20:23,805 - optuna.study.study - INFO - Trial 49 finished with value: 0.7602166252275798 and parameters: {'n_estimators': 949, 'max_depth': 8, 'learning_rate': 0.006441374425096323, 'gamma': 0.011665423304627831, 'lambda': 1.9265317535749718, 'alpha': 1.0672186604315665, 'subsample': 0.6683215918945129, 'colsample_bytree': 0.8924788647871098, 'min_child_weight': 12, 'max_delta_step': 8.932745655765569}. Best is trial 28 with value: 0.7609731016325244.
2026-03-16 10:20:26,492 - optuna.study.study - INFO - Trial 50 finished with value: 0.3695541483669551 and parameters: {'n_estimators': 60, 'max_depth': 7, 'learning_rate': 0.006501386096551576, 'gamma': 4.97514561469327, 'lambda': 2.5751610882122806, 'alpha': 1.7019434657035684, 'subsample': 0.7207435764169217, 'colsample_bytree': 0.9598799107191432, 'min_child_weight': 13, 'max_delta_step': 7.4429282480551695}. Best is trial 28 with value: 0.7609731016325244.
2026-03-16 10:21:00,727 - optuna.study.study - INFO - Trial 51 finished with value: 0.7603989638158762 and parameters: {'n_estimators': 874, 'max_depth': 7, 'learning_rate': 0.011247507776398772, 'gamma': 0.3005682980686911, 'lambda': 0.9281706544735535, 'alpha': 1.4110538149680218, 'subsample': 0.7643345354089935, 'colsample_bytree': 0.9267621463837078, 'min_child_weight': 9, 'max_delta_step': 5.305830363477884}. Best is trial 28 with value: 0.7609731016325244.
2026-03-16 10:21:32,814 - optuna.study.study - INFO - Trial 52 finished with value: 0.7591476983429737 and parameters: {'n_estimators': 892, 'max_depth': 6, 'learning_rate': 0.007436902353990323, 'gamma': 0.5866975836312514, 'lambda': 1.4450362675874349, 'alpha': 0.2542899993034907, 'subsample': 0.623927053293243, 'colsample_bytree': 0.9998188442171058, 'min_child_weight': 10, 'max_delta_step': 6.461587507232757}. Best is trial 28 with value: 0.7609731016325244.
2026-03-16 10:22:03,065 - optuna.study.study - INFO - Trial 53 finished with value: 0.760358987216666 and parameters: {'n_estimators': 938, 'max_depth': 8, 'learning_rate': 0.01906625420558975, 'gamma': 1.4060678475508208, 'lambda': 0.7305726016960912, 'alpha': 0.9744254872467432, 'subsample': 0.6993708517847296, 'colsample_bytree': 0.9033985374866869, 'min_child_weight': 7, 'max_delta_step': 4.711716719287094}. Best is trial 28 with value: 0.7609731016325244.
2026-03-16 10:22:32,610 - optuna.study.study - INFO - Trial 54 finished with value: 0.7611002470930407 and parameters: {'n_estimators': 779, 'max_depth': 7, 'learning_rate': 0.013807971006799107, 'gamma': 0.22366803032210716, 'lambda': 1.1960544607253791, 'alpha': 0.6680826430948028, 'subsample': 0.7445142620026266, 'colsample_bytree': 0.932621859877618, 'min_child_weight': 11, 'max_delta_step': 5.984529843187066}. Best is trial 54 with value: 0.7611002470930407.
2026-03-16 10:23:08,197 - optuna.study.study - INFO - Trial 55 finished with value: 0.7601263071169776 and parameters: {'n_estimators': 997, 'max_depth': 7, 'learning_rate': 0.014300078428027723, 'gamma': 0.2047222841221668, 'lambda': 1.8499188132035886, 'alpha': 0.2597553480687581, 'subsample': 0.6994540770237514, 'colsample_bytree': 0.9419664211584223, 'min_child_weight': 12, 'max_delta_step': 7.414720503218299}. Best is trial 54 with value: 0.7611002470930407.
2026-03-16 10:23:36,477 - optuna.study.study - INFO - Trial 56 finished with value: 0.7560024618479657 and parameters: {'n_estimators': 758, 'max_depth': 7, 'learning_rate': 0.005625788000268014, 'gamma': 0.807666396901911, 'lambda': 1.2567252717362798, 'alpha': 4.550877800853614, 'subsample': 0.7414914422184311, 'colsample_bytree': 0.9758172124490437, 'min_child_weight': 11, 'max_delta_step': 5.944256298281454}. Best is trial 54 with value: 0.7611002470930407.
2026-03-16 10:23:54,385 - optuna.study.study - INFO - Trial 57 finished with value: 0.7585077904655794 and parameters: {'n_estimators': 797, 'max_depth': 8, 'learning_rate': 0.06643599256324875, 'gamma': 1.1973219773541308, 'lambda': 1.4576931730234797, 'alpha': 0.8121127869121614, 'subsample': 0.7781809861043151, 'colsample_bytree': 0.9553086851470425, 'min_child_weight': 13, 'max_delta_step': 4.000481544075828}. Best is trial 54 with value: 0.7611002470930407.
2026-03-16 10:24:17,833 - optuna.study.study - INFO - Trial 58 finished with value: 0.7596545477377766 and parameters: {'n_estimators': 709, 'max_depth': 7, 'learning_rate': 0.026205893851101753, 'gamma': 1.0104252447106097, 'lambda': 1.1730661456428941, 'alpha': 1.2771328226476641, 'subsample': 0.7248522966616212, 'colsample_bytree': 0.9336573772484361, 'min_child_weight': 14, 'max_delta_step': 9.149584644823912}. Best is trial 54 with value: 0.7611002470930407.
2026-03-16 10:24:54,119 - optuna.study.study - INFO - Trial 59 finished with value: 0.7600386216354368 and parameters: {'n_estimators': 892, 'max_depth': 8, 'learning_rate': 0.008306913846523614, 'gamma': 2.65558469503082, 'lambda': 2.469099183371499, 'alpha': 2.198125417633196, 'subsample': 0.5323863791360779, 'colsample_bytree': 0.8821422555502361, 'min_child_weight': 10, 'max_delta_step': 3.4774840986531386}. Best is trial 54 with value: 0.7611002470930407.
2026-03-16 10:25:37,853 - optuna.study.study - INFO - Trial 60 finished with value: 0.7601056054711065 and parameters: {'n_estimators': 958, 'max_depth': 7, 'learning_rate': 0.015953436531727146, 'gamma': 1.4597723184494222, 'lambda': 3.3198857299444793, 'alpha': 0.6076101196877693, 'subsample': 0.8474490837124564, 'colsample_bytree': 0.8442964722384146, 'min_child_weight': 11, 'max_delta_step': 6.632582090645503}. Best is trial 54 with value: 0.7611002470930407.
2026-03-16 10:26:20,802 - optuna.study.study - INFO - Trial 61 finished with value: 0.7601566726150919 and parameters: {'n_estimators': 833, 'max_depth': 6, 'learning_rate': 0.01050934222012264, 'gamma': 0.469848838655128, 'lambda': 0.9949904042337562, 'alpha': 0.6678142821351424, 'subsample': 0.7976042373897346, 'colsample_bytree': 0.9149964403145158, 'min_child_weight': 9, 'max_delta_step': 4.461992576921894}. Best is trial 54 with value: 0.7611002470930407.
2026-03-16 10:26:55,004 - optuna.study.study - INFO - Trial 62 finished with value: 0.7573934030916764 and parameters: {'n_estimators': 883, 'max_depth': 4, 'learning_rate': 0.013311022783870568, 'gamma': 0.25464949765976896, 'lambda': 6.678132002194383, 'alpha': 0.9135331536958073, 'subsample': 0.808859285115659, 'colsample_bytree': 0.9617381738694394, 'min_child_weight': 12, 'max_delta_step': 5.5517894386219035}. Best is trial 54 with value: 0.7611002470930407.
2026-03-16 10:27:53,347 - optuna.study.study - INFO - Trial 63 finished with value: 0.7602963716999641 and parameters: {'n_estimators': 933, 'max_depth': 7, 'learning_rate': 0.007191520188501769, 'gamma': 0.7874915887003332, 'lambda': 0.7873612885869973, 'alpha': 0.20004863587391744, 'subsample': 0.7487959089907649, 'colsample_bytree': 0.904927808897355, 'min_child_weight': 7, 'max_delta_step': 6.063259417572827}. Best is trial 54 with value: 0.7611002470930407.
2026-03-16 10:28:29,670 - optuna.study.study - INFO - Trial 64 finished with value: 0.759254081233138 and parameters: {'n_estimators': 853, 'max_depth': 5, 'learning_rate': 0.022593600269206492, 'gamma': 0.5107493614719913, 'lambda': 1.1578060755927433, 'alpha': 1.0552364159538143, 'subsample': 0.7763342492346468, 'colsample_bytree': 0.5253201523589769, 'min_child_weight': 9, 'max_delta_step': 5.074243947376667}. Best is trial 54 with value: 0.7611002470930407.
2026-03-16 10:29:19,862 - optuna.study.study - INFO - Trial 65 finished with value: 0.759853773592997 and parameters: {'n_estimators': 782, 'max_depth': 8, 'learning_rate': 0.009292936671533728, 'gamma': 0.19668459620726336, 'lambda': 0.9228021570161714, 'alpha': 0.3611045935441676, 'subsample': 0.8221797801072488, 'colsample_bytree': 0.9807440692014231, 'min_child_weight': 8, 'max_delta_step': 7.489897379468783}. Best is trial 54 with value: 0.7611002470930407.
2026-03-16 10:29:52,088 - optuna.study.study - INFO - Trial 66 finished with value: 0.7574625585552335 and parameters: {'n_estimators': 965, 'max_depth': 6, 'learning_rate': 0.005714858564289524, 'gamma': 0.7230648757449836, 'lambda': 1.419727282219262, 'alpha': 0.7063533930913597, 'subsample': 0.7330389053641799, 'colsample_bytree': 0.9304511240825076, 'min_child_weight': 13, 'max_delta_step': 5.724165063686786}. Best is trial 54 with value: 0.7611002470930407.
2026-03-16 10:30:25,318 - optuna.study.study - INFO - Trial 67 finished with value: 0.7603278389572946 and parameters: {'n_estimators': 907, 'max_depth': 7, 'learning_rate': 0.01096636740718964, 'gamma': 1.1846363759533753, 'lambda': 0.6791186117361748, 'alpha': 1.6385043914704553, 'subsample': 0.7091217061818633, 'colsample_bytree': 0.9580038945113756, 'min_child_weight': 6, 'max_delta_step': 4.7102632960687885}. Best is trial 54 with value: 0.7611002470930407.
2026-03-16 10:30:59,752 - optuna.study.study - INFO - Trial 68 finished with value: 0.7593495829936382 and parameters: {'n_estimators': 811, 'max_depth': 8, 'learning_rate': 0.01976629524632022, 'gamma': 0.4470130816883291, 'lambda': 1.7573639427322243, 'alpha': 2.822187031407449, 'subsample': 0.7647259364607655, 'colsample_bytree': 0.9928483381287243, 'min_child_weight': 10, 'max_delta_step': 5.1968009985918595}. Best is trial 54 with value: 0.7611002470930407.
2026-03-16 10:31:32,850 - optuna.study.study - INFO - Trial 69 finished with value: 0.7595733522158635 and parameters: {'n_estimators': 927, 'max_depth': 7, 'learning_rate': 0.016049685787292798, 'gamma': 0.025083390408369793, 'lambda': 1.054824036515546, 'alpha': 0.5231399818602039, 'subsample': 0.6714816916912937, 'colsample_bytree': 0.8876687909872291, 'min_child_weight': 12, 'max_delta_step': 8.522162200325731}. Best is trial 54 with value: 0.7611002470930407.
2026-03-16 10:31:57,168 - optuna.study.study - INFO - Trial 70 finished with value: 0.7600131299274827 and parameters: {'n_estimators': 861, 'max_depth': 8, 'learning_rate': 0.012789854327110321, 'gamma': 1.9067487525170135, 'lambda': 9.704801754737094, 'alpha': 0.1401545083586495, 'subsample': 0.831912770732816, 'colsample_bytree': 0.7255795065599916, 'min_child_weight': 11, 'max_delta_step': 3.7933181086277608}. Best is trial 54 with value: 0.7611002470930407.
2026-03-16 10:32:31,315 - optuna.study.study - INFO - Trial 71 finished with value: 0.7598303564350027 and parameters: {'n_estimators': 874, 'max_depth': 7, 'learning_rate': 0.010477586354471293, 'gamma': 0.3298573034838226, 'lambda': 0.9071181552056148, 'alpha': 1.3403476174383522, 'subsample': 0.7588070059407738, 'colsample_bytree': 0.9318881845066064, 'min_child_weight': 9, 'max_delta_step': 5.400873143518275}. Best is trial 54 with value: 0.7611002470930407.
2026-03-16 10:33:09,050 - optuna.study.study - INFO - Trial 72 finished with value: 0.7607595912201411 and parameters: {'n_estimators': 964, 'max_depth': 7, 'learning_rate': 0.008837134815486836, 'gamma': 0.22181933332703016, 'lambda': 0.8645172130541315, 'alpha': 1.4914778781818117, 'subsample': 0.7925943598257407, 'colsample_bytree': 0.9211920860657461, 'min_child_weight': 8, 'max_delta_step': 5.895554580751751}. Best is trial 54 with value: 0.7611002470930407.
2026-03-16 10:33:50,153 - optuna.study.study - INFO - Trial 73 finished with value: 0.7605708275944844 and parameters: {'n_estimators': 968, 'max_depth': 7, 'learning_rate': 0.008865501824481764, 'gamma': 0.14655946604098954, 'lambda': 0.8364321294405122, 'alpha': 1.5342340691725407, 'subsample': 0.8084411829639004, 'colsample_bytree': 0.911599087522708, 'min_child_weight': 6, 'max_delta_step': 6.179663980111773}. Best is trial 54 with value: 0.7611002470930407.
2026-03-16 10:34:28,546 - optuna.study.study - INFO - Trial 74 finished with value: 0.7603689646158381 and parameters: {'n_estimators': 981, 'max_depth': 7, 'learning_rate': 0.008623423600881263, 'gamma': 0.16033213380059333, 'lambda': 1.169964583987207, 'alpha': 1.7793145065292608, 'subsample': 0.8788213501933027, 'colsample_bytree': 0.8641053525131754, 'min_child_weight': 6, 'max_delta_step': 5.979126285256688}. Best is trial 54 with value: 0.7611002470930407.
2026-03-16 10:35:14,770 - optuna.study.study - INFO - Trial 75 finished with value: 0.7601068614030879 and parameters: {'n_estimators': 968, 'max_depth': 8, 'learning_rate': 0.007694906244371278, 'gamma': 0.6537358749104298, 'lambda': 1.0429467791306184, 'alpha': 1.5865313815142779, 'subsample': 0.9074340802960417, 'colsample_bytree': 0.9412849148358566, 'min_child_weight': 5, 'max_delta_step': 7.203310705556092}. Best is trial 54 with value: 0.7611002470930407.
2026-03-16 10:35:53,124 - optuna.study.study - INFO - Trial 76 finished with value: 0.7610148049676274 and parameters: {'n_estimators': 999, 'max_depth': 7, 'learning_rate': 0.009498546579779839, 'gamma': 0.9038292672790529, 'lambda': 0.8394570278787239, 'alpha': 1.9983088855277236, 'subsample': 0.8125105476053689, 'colsample_bytree': 0.9037173800873771, 'min_child_weight': 6, 'max_delta_step': 6.249440241449086}. Best is trial 54 with value: 0.7611002470930407.
