2026-03-15 22:54:22,449 - optuna.study.study - INFO - Trial 98 finished with value: 0.7606689638823602 and parameters: {'imbalance_method': 'Baseline', 'n_estimators': 676, 'max_depth': 7, 'learning_rate': 0.014214853192229962, 'gamma': 1.0995978247233647e-08, 'lambda': 0.0006125728434861913, 'alpha': 9.721314372574716, 'subsample': 0.8533951918211767, 'colsample_bytree': 0.7399859382557652}. Best is trial 73 with value: 0.7610533332344204.
2026-03-15 22:54:51,947 - optuna.study.study - INFO - Trial 99 finished with value: 0.7603874007758149 and parameters: {'imbalance_method': 'Baseline', 'n_estimators': 673, 'max_depth': 7, 'learning_rate': 0.009780889287819035, 'gamma': 1.6249647928734943e-08, 'lambda': 0.0008636109673824231, 'alpha': 8.385214201619913, 'subsample': 0.8730003146939749, 'colsample_bytree': 0.767227771876053}. Best is trial 73 with value: 0.7610533332344204.
2026-03-15 22:55:22,303 - optuna.study.study - INFO - Trial 100 finished with value: 0.7604840907183398 and parameters: {'imbalance_method': 'Baseline', 'n_estimators': 724, 'max_depth': 7, 'learning_rate': 0.009558723896686732, 'gamma': 3.3442041530320995e-08, 'lambda': 0.0014301735180103994, 'alpha': 8.882405489963077, 'subsample': 0.8511940274182687, 'colsample_bytree': 0.7792713602859946}. Best is trial 73 with value: 0.7610533332344204.
2026-03-15 22:55:53,313 - optuna.study.study - INFO - Trial 101 finished with value: 0.7602605488794496 and parameters: {'imbalance_method': 'Baseline', 'n_estimators': 722, 'max_depth': 7, 'learning_rate': 0.009525950838391566, 'gamma': 3.477627458827628e-08, 'lambda': 0.0009031766989558435, 'alpha': 9.368594130384759, 'subsample': 0.8263818142294844, 'colsample_bytree': 0.8191048683365515}. Best is trial 73 with value: 0.7610533332344204.
2026-03-15 22:56:24,599 - optuna.study.study - INFO - Trial 102 finished with value: 0.759895917226912 and parameters: {'imbalance_method': 'Baseline', 'n_estimators': 733, 'max_depth': 7, 'learning_rate': 0.009918924102139522, 'gamma': 1.832512357729288e-08, 'lambda': 0.0018153137594356836, 'alpha': 5.3635226859012946, 'subsample': 0.8437917809270825, 'colsample_bytree': 0.8280573178426582}. Best is trial 73 with value: 0.7610533332344204.
2026-03-15 22:56:54,390 - optuna.study.study - INFO - Trial 103 finished with value: 0.7596191029020076 and parameters: {'imbalance_method': 'Baseline', 'n_estimators': 694, 'max_depth': 7, 'learning_rate': 0.00725475099426167, 'gamma': 3.498420936851601e-08, 'lambda': 0.0007756476585707805, 'alpha': 9.545321088577541, 'subsample': 0.815484550027039, 'colsample_bytree': 0.7685714511410632}. Best is trial 73 with value: 0.7610533332344204.
2026-03-15 22:57:22,438 - optuna.study.study - INFO - Trial 104 finished with value: 0.7603015158397723 and parameters: {'imbalance_method': 'Baseline', 'n_estimators': 639, 'max_depth': 7, 'learning_rate': 0.009743912992039918, 'gamma': 1.0127329320442648e-08, 'lambda': 0.0018974137306662167, 'alpha': 7.480505224920301, 'subsample': 0.824450118163508, 'colsample_bytree': 0.7836471322592163}. Best is trial 73 with value: 0.7610533332344204.
2026-03-15 22:58:18,729 - optuna.study.study - INFO - Trial 105 finished with value: 0.7549046312301066 and parameters: {'imbalance_method': 'ADASYN', 'n_estimators': 615, 'max_depth': 8, 'learning_rate': 0.007803221256622368, 'gamma': 1.3333193700426041e-08, 'lambda': 0.0019373143975994456, 'alpha': 6.280904427403999, 'subsample': 0.8480245577653617, 'colsample_bytree': 0.7894158644283287}. Best is trial 73 with value: 0.7610533332344204.
2026-03-15 22:58:49,106 - optuna.study.study - INFO - Trial 106 finished with value: 0.7575347187617426 and parameters: {'imbalance_method': 'Baseline', 'n_estimators': 687, 'max_depth': 7, 'learning_rate': 0.005895062543622853, 'gamma': 1.0612433437570967e-08, 'lambda': 0.007130475957418686, 'alpha': 2.0670722171408755, 'subsample': 0.8767786325381799, 'colsample_bytree': 0.8068616554788377}. Best is trial 73 with value: 0.7610533332344204.
2026-03-15 22:59:25,349 - optuna.study.study - INFO - Trial 107 finished with value: 0.7589074999171181 and parameters: {'imbalance_method': 'RandomOverSampler', 'n_estimators': 642, 'max_depth': 7, 'learning_rate': 0.011359459444586835, 'gamma': 2.0048425616589503e-08, 'lambda': 0.0026686110059161113, 'alpha': 4.53567011040955, 'subsample': 0.8568692660685052, 'colsample_bytree': 0.7476978635072798}. Best is trial 73 with value: 0.7610533332344204.
2026-03-15 23:00:06,082 - optuna.study.study - INFO - Trial 108 finished with value: 0.7600734888068413 and parameters: {'imbalance_method': 'Baseline', 'n_estimators': 742, 'max_depth': 8, 'learning_rate': 0.008860075024589787, 'gamma': 6.533358087575264e-06, 'lambda': 0.0005039283385777643, 'alpha': 7.077730969603594, 'subsample': 0.8989284874741743, 'colsample_bytree': 0.7778360425518492}. Best is trial 73 with value: 0.7610533332344204.
2026-03-15 23:01:42,847 - optuna.study.study - INFO - Trial 109 finished with value: 0.75644538575121 and parameters: {'imbalance_method': 'Baseline', 'n_estimators': 647, 'max_depth': 12, 'learning_rate': 0.012391795069302238, 'gamma': 1.0446554914678751e-07, 'lambda': 0.0009155160249830873, 'alpha': 2.8783451225142023, 'subsample': 0.8725431795609565, 'colsample_bytree': 0.7612271907067046}. Best is trial 73 with value: 0.7610533332344204.
2026-03-15 23:02:31,044 - optuna.study.study - INFO - Trial 110 finished with value: 0.7584869772451478 and parameters: {'imbalance_method': 'SMOTETomek', 'n_estimators': 616, 'max_depth': 7, 'learning_rate': 0.010273397658126479, 'gamma': 7.129397117348518e-08, 'lambda': 0.0035290770240234315, 'alpha': 1.8586683289442316, 'subsample': 0.829134354931537, 'colsample_bytree': 0.806732319716497}. Best is trial 73 with value: 0.7610533332344204.
2026-03-15 23:03:01,938 - optuna.study.study - INFO - Trial 111 finished with value: 0.7605324624542905 and parameters: {'imbalance_method': 'Baseline', 'n_estimators': 708, 'max_depth': 7, 'learning_rate': 0.009594978969331232, 'gamma': 3.7380763016279546e-08, 'lambda': 0.014374520445052356, 'alpha': 9.230529205086045, 'subsample': 0.8239215394517112, 'colsample_bytree': 0.8501238327793551}. Best is trial 73 with value: 0.7610533332344204.
2026-03-15 23:03:33,913 - optuna.study.study - INFO - Trial 112 finished with value: 0.7592056823123055 and parameters: {'imbalance_method': 'Baseline', 'n_estimators': 704, 'max_depth': 7, 'learning_rate': 0.008039967811519513, 'gamma': 2.1758298929908442e-08, 'lambda': 0.08187957106812863, 'alpha': 0.5371178019389811, 'subsample': 0.849291538468153, 'colsample_bytree': 0.843685263065676}. Best is trial 73 with value: 0.7610533332344204.
2026-03-15 23:04:05,830 - optuna.study.study - INFO - Trial 113 finished with value: 0.7600157207843591 and parameters: {'imbalance_method': 'Baseline', 'n_estimators': 766, 'max_depth': 7, 'learning_rate': 0.01433056363246507, 'gamma': 1.4741157069255788e-08, 'lambda': 0.009659722772254615, 'alpha': 4.535131616548133, 'subsample': 0.8652951146264415, 'colsample_bytree': 0.7445765403329802}. Best is trial 73 with value: 0.7610533332344204.
2026-03-15 23:04:56,700 - optuna.study.study - INFO - Trial 114 finished with value: 0.7595812990711354 and parameters: {'imbalance_method': 'Baseline', 'n_estimators': 803, 'max_depth': 8, 'learning_rate': 0.007408224555845413, 'gamma': 3.493571640522555e-08, 'lambda': 0.02374462170337086, 'alpha': 9.932788354351446, 'subsample': 0.8120592040272164, 'colsample_bytree': 0.7358750871167139}. Best is trial 73 with value: 0.7610533332344204.
2026-03-15 23:05:25,739 - optuna.study.study - INFO - Trial 115 finished with value: 0.760799508393004 and parameters: {'imbalance_method': 'Baseline', 'n_estimators': 676, 'max_depth': 7, 'learning_rate': 0.009287405962414046, 'gamma': 1.0350229124587552e-08, 'lambda': 0.00015336936850859028, 'alpha': 3.4777745997007967, 'subsample': 0.8228817465978547, 'colsample_bytree': 0.7584082165488882}. Best is trial 73 with value: 0.7610533332344204.
2026-03-15 23:05:55,340 - optuna.study.study - INFO - Trial 116 finished with value: 0.7580070409704506 and parameters: {'imbalance_method': 'Baseline', 'n_estimators': 677, 'max_depth': 7, 'learning_rate': 0.0061303555308040445, 'gamma': 1.0416480112678878e-08, 'lambda': 0.00023237278884160825, 'alpha': 1.4924527577184588, 'subsample': 0.7958945201959162, 'colsample_bytree': 0.7568347464282723}. Best is trial 73 with value: 0.7610533332344204.
2026-03-15 23:06:23,071 - optuna.study.study - INFO - Trial 117 finished with value: 0.7478876242972611 and parameters: {'imbalance_method': 'RandomUnderSampler', 'n_estimators': 710, 'max_depth': 8, 'learning_rate': 0.016429834268819023, 'gamma': 1.4902745729115263e-08, 'lambda': 0.0013974063668042473, 'alpha': 2.941782328306465, 'subsample': 0.7762357169619349, 'colsample_bytree': 0.7952829720827668}. Best is trial 73 with value: 0.7610533332344204.
2026-03-15 23:06:51,148 - optuna.study.study - INFO - Trial 118 finished with value: 0.7597287154875835 and parameters: {'imbalance_method': 'Baseline', 'n_estimators': 655, 'max_depth': 7, 'learning_rate': 0.009276593717421181, 'gamma': 2.3257684979540665e-08, 'lambda': 0.00033395265548577595, 'alpha': 7.162691016555637, 'subsample': 0.8880281881806192, 'colsample_bytree': 0.7704518207691032}. Best is trial 73 with value: 0.7610533332344204.
2026-03-15 23:07:29,870 - optuna.study.study - INFO - Trial 119 finished with value: 0.7225350703588127 and parameters: {'imbalance_method': 'SMOTEENN', 'n_estimators': 635, 'max_depth': 7, 'learning_rate': 0.012700057088166902, 'gamma': 3.5048686881373394e-08, 'lambda': 0.00014752101662889608, 'alpha': 2.3931056146236327, 'subsample': 0.8208661318700642, 'colsample_bytree': 0.814126920049448}. Best is trial 73 with value: 0.7610533332344204.
2026-03-15 23:08:03,925 - optuna.study.study - INFO - Trial 120 finished with value: 0.7573041990878275 and parameters: {'imbalance_method': 'TomekLinks', 'n_estimators': 606, 'max_depth': 8, 'learning_rate': 0.01093016129464676, 'gamma': 2.0017137932711907e-07, 'lambda': 0.0005235751476649274, 'alpha': 4.850859418212369, 'subsample': 0.8347297714994979, 'colsample_bytree': 0.7341134440226428}. Best is trial 73 with value: 0.7610533332344204.
2026-03-15 23:08:36,180 - optuna.study.study - INFO - Trial 121 finished with value: 0.7598699039065692 and parameters: {'imbalance_method': 'Baseline', 'n_estimators': 746, 'max_depth': 7, 'learning_rate': 0.008451903357245764, 'gamma': 1.0415853972352866e-08, 'lambda': 0.355576616190954, 'alpha': 4.11744399627919, 'subsample': 0.8064968923034094, 'colsample_bytree': 0.7842636378995683}. Best is trial 73 with value: 0.7610533332344204.
2026-03-15 23:08:59,942 - optuna.study.study - INFO - Trial 122 finished with value: 0.7594787399364239 and parameters: {'imbalance_method': 'Baseline', 'n_estimators': 561, 'max_depth': 7, 'learning_rate': 0.011491126658096892, 'gamma': 1.5526384373952866e-08, 'lambda': 0.002532620976723978, 'alpha': 9.787411869541643, 'subsample': 0.8625723304941217, 'colsample_bytree': 0.7155361208017393}. Best is trial 73 with value: 0.7610533332344204.
2026-03-15 23:09:23,096 - optuna.study.study - INFO - Trial 123 finished with value: 0.7561449510249604 and parameters: {'imbalance_method': 'Baseline', 'n_estimators': 667, 'max_depth': 6, 'learning_rate': 0.00696686146104204, 'gamma': 6.309672581825059e-08, 'lambda': 0.004600841290002778, 'alpha': 1.4059881976855517, 'subsample': 0.9058532613635013, 'colsample_bytree': 0.7498825885421714}. Best is trial 73 with value: 0.7610533332344204.
2026-03-15 23:10:08,510 - optuna.study.study - INFO - Trial 124 finished with value: 0.7593409246774453 and parameters: {'imbalance_method': 'SMOTE', 'n_estimators': 703, 'max_depth': 7, 'learning_rate': 0.010411999805710214, 'gamma': 1.1196015058213047e-07, 'lambda': 0.0011374699461623179, 'alpha': 6.2578554163381845, 'subsample': 0.8730315088676716, 'colsample_bytree': 0.8447719986109808}. Best is trial 73 with value: 0.7610533332344204.
2026-03-15 23:10:29,495 - optuna.study.study - INFO - Trial 125 finished with value: 0.7588025262662489 and parameters: {'imbalance_method': 'Baseline', 'n_estimators': 634, 'max_depth': 6, 'learning_rate': 0.009388276603882216, 'gamma': 2.3743627431128793e-08, 'lambda': 0.0007777959789997843, 'alpha': 3.039108425187034, 'subsample': 0.8547240738467531, 'colsample_bytree': 0.7644682690369736}. Best is trial 73 with value: 0.7610533332344204.
2026-03-15 23:10:45,265 - optuna.study.study - INFO - Trial 126 finished with value: 0.7594703414802689 and parameters: {'imbalance_method': 'Baseline', 'n_estimators': 371, 'max_depth': 7, 'learning_rate': 0.019955094789289796, 'gamma': 4.6620639471106535e-08, 'lambda': 0.014074931266612167, 'alpha': 0.7293662954493559, 'subsample': 0.8437435503118353, 'colsample_bytree': 0.7213795500982929}. Best is trial 73 with value: 0.7610533332344204.
2026-03-15 23:10:56,783 - optuna.study.study - INFO - Trial 127 finished with value: 0.75000442291863 and parameters: {'imbalance_method': 'Baseline', 'n_estimators': 323, 'max_depth': 6, 'learning_rate': 0.008808695553362238, 'gamma': 7.445987200118089e-08, 'lambda': 0.00010688020733254505, 'alpha': 3.670692808294681, 'subsample': 0.8900043773809543, 'colsample_bytree': 0.7406072222136295}. Best is trial 73 with value: 0.7610533332344204.
2026-03-15 23:11:31,730 - optuna.study.study - INFO - Trial 128 finished with value: 0.7607101542586765 and parameters: {'imbalance_method': 'Baseline', 'n_estimators': 654, 'max_depth': 8, 'learning_rate': 0.012008540635944169, 'gamma': 3.868148067420239e-07, 'lambda': 0.0003478680941493684, 'alpha': 0.39361494826208987, 'subsample': 0.756147643671901, 'colsample_bytree': 0.7766387929808873}. Best is trial 73 with value: 0.7610533332344204.
2026-03-15 23:12:09,568 - optuna.study.study - INFO - Trial 129 finished with value: 0.7593645586069032 and parameters: {'imbalance_method': 'Baseline', 'n_estimators': 679, 'max_depth': 8, 'learning_rate': 0.013795518692141476, 'gamma': 3.0867619748782407e-07, 'lambda': 0.0003911804350034701, 'alpha': 1.7361610154272262, 'subsample': 0.6542855171717882, 'colsample_bytree': 0.8735607411711214}. Best is trial 73 with value: 0.7610533332344204.
2026-03-15 23:12:57,350 - optuna.study.study - INFO - Trial 130 finished with value: 0.760273357740345 and parameters: {'imbalance_method': 'Baseline', 'n_estimators': 659, 'max_depth': 9, 'learning_rate': 0.01202533228138365, 'gamma': 1.7000880421539256e-08, 'lambda': 0.0002494105708659612, 'alpha': 0.40760641942253, 'subsample': 0.6889581267060274, 'colsample_bytree': 0.7977930074821462}. Best is trial 73 with value: 0.7610533332344204.
2026-03-15 23:13:30,987 - optuna.study.study - INFO - Trial 131 finished with value: 0.7595674710665064 and parameters: {'imbalance_method': 'Baseline', 'n_estimators': 576, 'max_depth': 8, 'learning_rate': 0.010183817895094234, 'gamma': 2.069267892850701e-06, 'lambda': 0.0001682612225173473, 'alpha': 6.30469111411434, 'subsample': 0.7546531373416386, 'colsample_bytree': 0.7786572874902535}. Best is trial 73 with value: 0.7610533332344204.
2026-03-15 23:14:00,678 - optuna.study.study - INFO - Trial 132 finished with value: 0.7605255326928829 and parameters: {'imbalance_method': 'Baseline', 'n_estimators': 713, 'max_depth': 7, 'learning_rate': 0.014847498744213771, 'gamma': 6.962220222005751e-07, 'lambda': 0.0007598674244843954, 'alpha': 1.007449300575816, 'subsample': 0.7860215580167447, 'colsample_bytree': 0.751853518538093}. Best is trial 73 with value: 0.7610533332344204.
2026-03-15 23:14:30,461 - optuna.study.study - INFO - Trial 133 finished with value: 0.7605546216931475 and parameters: {'imbalance_method': 'Baseline', 'n_estimators': 717, 'max_depth': 7, 'learning_rate': 0.01625889176561051, 'gamma': 6.81388781623618e-07, 'lambda': 0.0006459204668098315, 'alpha': 0.9137675152274632, 'subsample': 0.7776859350258044, 'colsample_bytree': 0.7530227039463193}. Best is trial 73 with value: 0.7610533332344204.
2026-03-15 23:15:01,731 - optuna.study.study - INFO - Trial 134 finished with value: 0.7608686554063177 and parameters: {'imbalance_method': 'Baseline', 'n_estimators': 766, 'max_depth': 7, 'learning_rate': 0.01654945921740939, 'gamma': 4.6374051891193973e-07, 'lambda': 0.000438390554794597, 'alpha': 0.8702635976840729, 'subsample': 0.7869313531340822, 'colsample_bytree': 0.7576929399370196}. Best is trial 73 with value: 0.7610533332344204.
2026-03-15 23:15:42,874 - optuna.study.study - INFO - Trial 135 finished with value: 0.7591966530830327 and parameters: {'imbalance_method': 'Baseline', 'n_estimators': 777, 'max_depth': 8, 'learning_rate': 0.017934850934004033, 'gamma': 8.13318402227878e-07, 'lambda': 8.12811074697678e-05, 'alpha': 0.31749571524463466, 'subsample': 0.7808803882011953, 'colsample_bytree': 0.7639718746877275}. Best is trial 73 with value: 0.7610533332344204.
2026-03-15 23:16:16,426 - optuna.study.study - INFO - Trial 136 finished with value: 0.759553461964794 and parameters: {'imbalance_method': 'Baseline', 'n_estimators': 809, 'max_depth': 7, 'learning_rate': 0.016932184163460918, 'gamma': 1.177107900121168e-06, 'lambda': 0.00042507703227768936, 'alpha': 0.8819635668248741, 'subsample': 0.7625876302335968, 'colsample_bytree': 0.7569640259473764}. Best is trial 73 with value: 0.7610533332344204.
2026-03-15 23:17:03,186 - optuna.study.study - INFO - Trial 137 finished with value: 0.7551249841554092 and parameters: {'imbalance_method': 'ADASYN', 'n_estimators': 759, 'max_depth': 7, 'learning_rate': 0.015413690325389346, 'gamma': 6.276562580763765e-07, 'lambda': 0.00020686067263914963, 'alpha': 0.08965167532016409, 'subsample': 0.7412625483185102, 'colsample_bytree': 0.5266848499646761}. Best is trial 73 with value: 0.7610533332344204.
2026-03-15 23:17:34,288 - optuna.study.study - INFO - Trial 138 finished with value: 0.7593599408946851 and parameters: {'imbalance_method': 'Baseline', 'n_estimators': 734, 'max_depth': 7, 'learning_rate': 0.02161550822105779, 'gamma': 4.3112011262047556e-07, 'lambda': 0.0003589404574233691, 'alpha': 0.4892064689252979, 'subsample': 0.7848736551627323, 'colsample_bytree': 0.7380619939836627}. Best is trial 73 with value: 0.7610533332344204.
2026-03-15 23:18:11,863 - optuna.study.study - INFO - Trial 139 finished with value: 0.7585761500194295 and parameters: {'imbalance_method': 'Baseline', 'n_estimators': 715, 'max_depth': 8, 'learning_rate': 0.014994527049337089, 'gamma': 2.694395810386593e-06, 'lambda': 0.0011872482491426034, 'alpha': 1.15174232537285, 'subsample': 0.7996414512202208, 'colsample_bytree': 0.773151848827852}. Best is trial 73 with value: 0.7610533332344204.
2026-03-15 23:18:48,441 - optuna.study.study - INFO - Trial 140 finished with value: 0.7595063998641844 and parameters: {'imbalance_method': 'RandomOverSampler', 'n_estimators': 698, 'max_depth': 7, 'learning_rate': 0.02421174286908477, 'gamma': 6.743889209264201e-07, 'lambda': 0.000647717926491528, 'alpha': 0.1677373465247283, 'subsample': 0.7565773712988964, 'colsample_bytree': 0.7104503260747439}. Best is trial 73 with value: 0.7610533332344204.
2026-03-15 23:19:18,838 - optuna.study.study - INFO - Trial 141 finished with value: 0.759253531009405 and parameters: {'imbalance_method': 'Baseline', 'n_estimators': 729, 'max_depth': 7, 'learning_rate': 0.012771592042555256, 'gamma': 3.544880916191543e-07, 'lambda': 0.0006129593224912466, 'alpha': 0.2781714541510558, 'subsample': 0.8057588618376033, 'colsample_bytree': 0.7488939699147977}. Best is trial 73 with value: 0.7610533332344204.
2026-03-15 23:19:49,944 - optuna.study.study - INFO - Trial 142 finished with value: 0.7606664828027214 and parameters: {'imbalance_method': 'Baseline', 'n_estimators': 748, 'max_depth': 7, 'learning_rate': 0.016315598154541734, 'gamma': 2.3436245183055417e-07, 'lambda': 0.0002708823679244617, 'alpha': 0.6620173435224733, 'subsample': 0.7761930193694488, 'colsample_bytree': 0.7298396577720503}. Best is trial 73 with value: 0.7610533332344204.
2026-03-15 23:20:21,722 - optuna.study.study - INFO - Trial 143 finished with value: 0.7592663255002025 and parameters: {'imbalance_method': 'Baseline', 'n_estimators': 783, 'max_depth': 7, 'learning_rate': 0.01911562906323762, 'gamma': 2.826027001025716e-07, 'lambda': 6.574600804290536e-05, 'alpha': 0.7273722761403338, 'subsample': 0.7742436353066668, 'colsample_bytree': 0.7274707868914896}. Best is trial 73 with value: 0.7610533332344204.
2026-03-15 23:20:51,973 - optuna.study.study - INFO - Trial 144 finished with value: 0.7590898393793325 and parameters: {'imbalance_method': 'Baseline', 'n_estimators': 753, 'max_depth': 7, 'learning_rate': 0.01633349680218766, 'gamma': 1.3014522064576367e-06, 'lambda': 0.0001221113751780695, 'alpha': 0.0005568670554754911, 'subsample': 0.7669735663710107, 'colsample_bytree': 0.6732839539944556}. Best is trial 73 with value: 0.7610533332344204.
2026-03-15 23:21:21,149 - optuna.study.study - INFO - Trial 145 finished with value: 0.7587456604643606 and parameters: {'imbalance_method': 'Baseline', 'n_estimators': 724, 'max_depth': 7, 'learning_rate': 0.01814410856713623, 'gamma': 1.9633879663290802e-07, 'lambda': 0.00019758246597218978, 'alpha': 1.983603391164378, 'subsample': 0.7161751119310317, 'colsample_bytree': 0.6837240655632661}. Best is trial 73 with value: 0.7610533332344204.
2026-03-15 23:21:58,116 - optuna.study.study - INFO - Trial 146 finished with value: 0.758058401430988 and parameters: {'imbalance_method': 'Baseline', 'n_estimators': 685, 'max_depth': 8, 'learning_rate': 0.022288260823083418, 'gamma': 5.775973500992041e-07, 'lambda': 0.0003429829503344874, 'alpha': 0.018270414655441363, 'subsample': 0.7462812732750552, 'colsample_bytree': 0.7312633029359132}. Best is trial 73 with value: 0.7610533332344204.
