2026-03-16 09:57:54,702 - optuna.study.study - INFO - Trial 0 finished with value: 0.7547039929200411 and parameters: {'n_estimators': 313, 'max_depth': 8, 'learning_rate': 0.03546625110828946, 'gamma': 4.499152613447604, 'lambda': 2.1148596394350414, 'alpha': 0.7945366675379822, 'subsample': 0.8358960690741711, 'colsample_bytree': 0.5188108508155395, 'min_child_weight': 4, 'max_delta_step': 2.123288424239221}. Best is trial 0 with value: 0.7547039929200411.
2026-03-16 09:57:57,845 - optuna.study._optimize - WARNING - Trial 1 failed with parameters: {'n_estimators': 216, 'max_depth': 8, 'learning_rate': 0.08001374639012258, 'gamma': 2.778527289302132, 'lambda': 0.9688702049064536, 'alpha': 1.187941997361179, 'subsample': 0.9162157545730636, 'colsample_bytree': 0.8293045970040196, 'min_child_weight': 10, 'max_delta_step': 5.773518116129268} because of the following error: KeyboardInterrupt().
Traceback (most recent call last):
  File [35m"c:\Users\gonzalo.iglesias\AppData\Local\miniconda3\envs\machinelearning2\Lib\site-packages\optuna\study\_optimize.py"[0m, line [35m206[0m, in [35m_run_trial[0m
    value_or_values = func(trial)
  File [35m"C:\Users\gonzalo.iglesias\AppData\Local\Temp\ipykernel_24236\1632453126.py"[0m, line [35m51[0m, in [35mobjective[0m
    scores = cross_val_score(
        pipeline,
    ...<3 lines>...
        n_jobs=1
    )
  File [35m"c:\Users\gonzalo.iglesias\AppData\Local\miniconda3\envs\machinelearning2\Lib\site-packages\sklearn\utils\_param_validation.py"[0m, line [35m218[0m, in [35mwrapper[0m
    return func(*args, **kwargs)
  File [35m"c:\Users\gonzalo.iglesias\AppData\Local\miniconda3\envs\machinelearning2\Lib\site-packages\sklearn\model_selection\_validation.py"[0m, line [35m651[0m, in [35mcross_val_score[0m
    cv_results = cross_validate(
        estimator=estimator,
    ...<9 lines>...
        error_score=error_score,
    )
  File [35m"c:\Users\gonzalo.iglesias\AppData\Local\miniconda3\envs\machinelearning2\Lib\site-packages\sklearn\utils\_param_validation.py"[0m, line [35m218[0m, in [35mwrapper[0m
    return func(*args, **kwargs)
  File [35m"c:\Users\gonzalo.iglesias\AppData\Local\miniconda3\envs\machinelearning2\Lib\site-packages\sklearn\model_selection\_validation.py"[0m, line [35m373[0m, in [35mcross_validate[0m
    results = parallel(
        delayed(_fit_and_score)(
    ...<15 lines>...
        for train, test in indices
    )
  File [35m"c:\Users\gonzalo.iglesias\AppData\Local\miniconda3\envs\machinelearning2\Lib\site-packages\sklearn\utils\parallel.py"[0m, line [35m91[0m, in [35m__call__[0m
    return [31msuper().__call__[0m[1;31m(iterable_with_config_and_warning_filters)[0m
           [31m~~~~~~~~~~~~~~~~[0m[1;31m^^^^^^^^^^^^^^^^^^^^^^^^^^^^^^^^^^^^^^^^^^[0m
  File [35m"c:\Users\gonzalo.iglesias\AppData\Local\miniconda3\envs\machinelearning2\Lib\site-packages\joblib\parallel.py"[0m, line [35m1986[0m, in [35m__call__[0m
    return output if self.return_generator else [31mlist[0m[1;31m(output)[0m
                                                [31m~~~~[0m[1;31m^^^^^^^^[0m
  File [35m"c:\Users\gonzalo.iglesias\AppData\Local\miniconda3\envs\machinelearning2\Lib\site-packages\joblib\parallel.py"[0m, line [35m1914[0m, in [35m_get_sequential_output[0m
    res = func(*args, **kwargs)
  File [35m"c:\Users\gonzalo.iglesias\AppData\Local\miniconda3\envs\machinelearning2\Lib\site-packages\sklearn\utils\parallel.py"[0m, line [35m184[0m, in [35m__call__[0m
    return [31mself.function[0m[1;31m(*args, **kwargs)[0m
           [31m~~~~~~~~~~~~~[0m[1;31m^^^^^^^^^^^^^^^^^[0m
  File [35m"c:\Users\gonzalo.iglesias\AppData\Local\miniconda3\envs\machinelearning2\Lib\site-packages\sklearn\model_selection\_validation.py"[0m, line [35m833[0m, in [35m_fit_and_score[0m
    [31mestimator.fit[0m[1;31m(X_train, y_train, **fit_params)[0m
    [31m~~~~~~~~~~~~~[0m[1;31m^^^^^^^^^^^^^^^^^^^^^^^^^^^^^^^^[0m
  File [35m"c:\Users\gonzalo.iglesias\AppData\Local\miniconda3\envs\machinelearning2\Lib\site-packages\sklearn\base.py"[0m, line [35m1336[0m, in [35mwrapper[0m
    return fit_method(estimator, *args, **kwargs)
  File [35m"c:\Users\gonzalo.iglesias\AppData\Local\miniconda3\envs\machinelearning2\Lib\site-packages\imblearn\pipeline.py"[0m, line [35m522[0m, in [35mfit[0m
    [31mself._final_estimator.fit[0m[1;31m(Xt, yt, **last_step_params["fit"])[0m
    [31m~~~~~~~~~~~~~~~~~~~~~~~~~[0m[1;31m^^^^^^^^^^^^^^^^^^^^^^^^^^^^^^^^^^^[0m
  File [35m"c:\Users\gonzalo.iglesias\AppData\Local\miniconda3\envs\machinelearning2\Lib\site-packages\xgboost\core.py"[0m, line [35m751[0m, in [35minner_f[0m
    return func(**kwargs)
  File [35m"c:\Users\gonzalo.iglesias\AppData\Local\miniconda3\envs\machinelearning2\Lib\site-packages\xgboost\sklearn.py"[0m, line [35m1806[0m, in [35mfit[0m
    self._Booster = [31mtrain[0m[1;31m([0m
                    [31m~~~~~[0m[1;31m^[0m
        [1;31mparams,[0m
        [1;31m^^^^^^^[0m
    ...<9 lines>...
        [1;31mcallbacks=self.callbacks,[0m
        [1;31m^^^^^^^^^^^^^^^^^^^^^^^^^[0m
    [1;31m)[0m
    [1;31m^[0m
  File [35m"c:\Users\gonzalo.iglesias\AppData\Local\miniconda3\envs\machinelearning2\Lib\site-packages\xgboost\core.py"[0m, line [35m751[0m, in [35minner_f[0m
    return func(**kwargs)
  File [35m"c:\Users\gonzalo.iglesias\AppData\Local\miniconda3\envs\machinelearning2\Lib\site-packages\xgboost\training.py"[0m, line [35m200[0m, in [35mtrain[0m
    [31mbst.update[0m[1;31m(dtrain, iteration=i, fobj=obj)[0m
    [31m~~~~~~~~~~[0m[1;31m^^^^^^^^^^^^^^^^^^^^^^^^^^^^^^^[0m
  File [35m"c:\Users\gonzalo.iglesias\AppData\Local\miniconda3\envs\machinelearning2\Lib\site-packages\xgboost\core.py"[0m, line [35m2391[0m, in [35mupdate[0m
    [31m_LIB.XGBoosterUpdateOneIter[0m[1;31m([0m
    [31m~~~~~~~~~~~~~~~~~~~~~~~~~~~[0m[1;31m^[0m
        [1;31mself.handle, ctypes.c_int(iteration), dtrain.handle[0m
        [1;31m^^^^^^^^^^^^^^^^^^^^^^^^^^^^^^^^^^^^^^^^^^^^^^^^^^^[0m
    [1;31m)[0m
    [1;31m^[0m
[1;35mKeyboardInterrupt[0m
2026-03-16 09:57:57,911 - optuna.study._optimize - WARNING - Trial 1 failed with value None.
2026-03-16 09:58:41,860 - optuna.storages._in_memory - INFO - A new study created in memory with name: Optimizacion_XGB_Balanceo
2026-03-16 09:58:41,869 - optuna.study._optimize - WARNING - Trial 0 failed with parameters: {'n_estimators': 528, 'max_depth': 3, 'learning_rate': 0.28549915641269236, 'gamma': 3.4886937480701166, 'lambda': 7.672046655881545, 'alpha': 0.5113964591619913, 'subsample': 0.9156530806322047, 'colsample_bytree': 0.5345585158942694, 'min_child_weight': 13, 'max_delta_step': 2.684964664744607} because of the following error: NameError("name 'param_scale_pos_weight' is not defined").
Traceback (most recent call last):
  File [35m"c:\Users\gonzalo.iglesias\AppData\Local\miniconda3\envs\machinelearning2\Lib\site-packages\optuna\study\_optimize.py"[0m, line [35m206[0m, in [35m_run_trial[0m
    value_or_values = func(trial)
  File [35m"C:\Users\gonzalo.iglesias\AppData\Local\Temp\ipykernel_24236\2130978627.py"[0m, line [35m30[0m, in [35mobjective[0m
    scale_pos_weight = [1;31mparam_scale_pos_weight[0m,
                       [1;31m^^^^^^^^^^^^^^^^^^^^^^[0m
[1;35mNameError[0m: [35mname 'param_scale_pos_weight' is not defined[0m
2026-03-16 09:58:41,876 - optuna.study._optimize - WARNING - Trial 0 failed with value None.
2026-03-16 09:58:57,663 - optuna.storages._in_memory - INFO - A new study created in memory with name: Optimizacion_XGB_Balanceo
2026-03-16 09:59:06,035 - optuna.study.study - INFO - Trial 0 finished with value: 0.7284248880455091 and parameters: {'n_estimators': 156, 'max_depth': 7, 'learning_rate': 0.04968610962018193, 'gamma': 0.41741909595215676, 'lambda': 0.8721963105561349, 'alpha': 4.787141096633314, 'subsample': 0.5108765391673136, 'colsample_bytree': 0.5394774116370682, 'min_child_weight': 4, 'max_delta_step': 0.14730245568096545}. Best is trial 0 with value: 0.7284248880455091.
2026-03-16 09:59:10,216 - optuna.study.study - INFO - Trial 1 finished with value: 0.7511040049490049 and parameters: {'n_estimators': 138, 'max_depth': 6, 'learning_rate': 0.0337514873063386, 'gamma': 1.9252082699945845, 'lambda': 5.15259713334667, 'alpha': 3.9241128060713777, 'subsample': 0.9647928175413111, 'colsample_bytree': 0.5759458593490885, 'min_child_weight': 7, 'max_delta_step': 9.799682556513968}. Best is trial 1 with value: 0.7511040049490049.
2026-03-16 09:59:14,170 - optuna.study.study - INFO - Trial 2 finished with value: 0.7565093575093645 and parameters: {'n_estimators': 180, 'max_depth': 6, 'learning_rate': 0.20492827120685547, 'gamma': 2.431453026524669, 'lambda': 1.3339149943244972, 'alpha': 0.24163339513364912, 'subsample': 0.5916183949927948, 'colsample_bytree': 0.5038505594868461, 'min_child_weight': 9, 'max_delta_step': 8.335535122326142}. Best is trial 2 with value: 0.7565093575093645.
2026-03-16 09:59:36,317 - optuna.study.study - INFO - Trial 3 finished with value: 0.7592060758331217 and parameters: {'n_estimators': 964, 'max_depth': 7, 'learning_rate': 0.04560657931386468, 'gamma': 2.264511119479842, 'lambda': 0.5221222404615338, 'alpha': 2.9991740895397645, 'subsample': 0.502741400738905, 'colsample_bytree': 0.6568717952818816, 'min_child_weight': 19, 'max_delta_step': 2.6412475384649348}. Best is trial 3 with value: 0.7592060758331217.
2026-03-16 09:59:59,848 - optuna.study.study - INFO - Trial 4 finished with value: 0.7589556414534252 and parameters: {'n_estimators': 848, 'max_depth': 7, 'learning_rate': 0.009935783847170287, 'gamma': 2.5086200344583847, 'lambda': 1.152949628871969, 'alpha': 1.2446194447567875, 'subsample': 0.9982310983439999, 'colsample_bytree': 0.7479231724702611, 'min_child_weight': 16, 'max_delta_step': 9.896149350333092}. Best is trial 3 with value: 0.7592060758331217.
2026-03-16 10:00:18,516 - optuna.study.study - INFO - Trial 5 finished with value: 0.7589273128041238 and parameters: {'n_estimators': 661, 'max_depth': 6, 'learning_rate': 0.012132448297162729, 'gamma': 2.2598151778302302, 'lambda': 2.9406439070197403, 'alpha': 4.3176980280528, 'subsample': 0.8408080323161358, 'colsample_bytree': 0.8889088564040228, 'min_child_weight': 12, 'max_delta_step': 6.184121061264544}. Best is trial 3 with value: 0.7592060758331217.
2026-03-16 10:00:37,783 - optuna.study.study - INFO - Trial 6 finished with value: 0.7354104440533197 and parameters: {'n_estimators': 880, 'max_depth': 4, 'learning_rate': 0.06704905210437777, 'gamma': 1.886338487947381, 'lambda': 1.849296828080305, 'alpha': 1.681313497195997, 'subsample': 0.5441531357466434, 'colsample_bytree': 0.7476372653254182, 'min_child_weight': 9, 'max_delta_step': 0.02569478494426458}. Best is trial 3 with value: 0.7592060758331217.
2026-03-16 10:00:50,348 - optuna.study.study - INFO - Trial 7 finished with value: 0.7581035778817252 and parameters: {'n_estimators': 811, 'max_depth': 6, 'learning_rate': 0.15407346323868523, 'gamma': 2.2172609704548085, 'lambda': 7.810525416876875, 'alpha': 1.8171962610581904, 'subsample': 0.8542281688415059, 'colsample_bytree': 0.6201621839840279, 'min_child_weight': 9, 'max_delta_step': 2.2771035422965125}. Best is trial 3 with value: 0.7592060758331217.
2026-03-16 10:01:00,391 - optuna.study.study - INFO - Trial 8 finished with value: 0.7584014188773981 and parameters: {'n_estimators': 484, 'max_depth': 5, 'learning_rate': 0.07558381457386594, 'gamma': 2.386048989322103, 'lambda': 2.0375345810545378, 'alpha': 2.1142235648886505, 'subsample': 0.7208529092744944, 'colsample_bytree': 0.7507463759227504, 'min_child_weight': 20, 'max_delta_step': 3.805606041299021}. Best is trial 3 with value: 0.7592060758331217.
2026-03-16 10:01:04,720 - optuna.study.study - INFO - Trial 9 finished with value: 0.6854455369160165 and parameters: {'n_estimators': 103, 'max_depth': 7, 'learning_rate': 0.006946747235690554, 'gamma': 0.78409398583214, 'lambda': 0.8184153831341138, 'alpha': 3.868245135423796, 'subsample': 0.6549561729601723, 'colsample_bytree': 0.7505967754143963, 'min_child_weight': 19, 'max_delta_step': 4.562273806272109}. Best is trial 3 with value: 0.7592060758331217.
2026-03-16 10:01:25,395 - optuna.study.study - INFO - Trial 10 finished with value: 0.7583748873396404 and parameters: {'n_estimators': 997, 'max_depth': 8, 'learning_rate': 0.02245540024741741, 'gamma': 4.4613485769526395, 'lambda': 0.5009419446898815, 'alpha': 3.045546263236563, 'subsample': 0.6482259561543602, 'colsample_bytree': 0.9468909936990282, 'min_child_weight': 15, 'max_delta_step': 2.344858492706933}. Best is trial 3 with value: 0.7592060758331217.
2026-03-16 10:01:47,773 - optuna.study.study - INFO - Trial 11 finished with value: 0.7578979296382243 and parameters: {'n_estimators': 662, 'max_depth': 8, 'learning_rate': 0.011670730074494512, 'gamma': 3.703324501212258, 'lambda': 0.5255810192895861, 'alpha': 0.7333596079610403, 'subsample': 0.9443286435333946, 'colsample_bytree': 0.6603790730269075, 'min_child_weight': 16, 'max_delta_step': 6.897798979487197}. Best is trial 3 with value: 0.7592060758331217.
2026-03-16 10:02:08,271 - optuna.study.study - INFO - Trial 12 finished with value: 0.7406787086991823 and parameters: {'n_estimators': 975, 'max_depth': 3, 'learning_rate': 0.005380982762379931, 'gamma': 3.4854496002712265, 'lambda': 1.00324571929159, 'alpha': 2.9960612073472253, 'subsample': 0.8070182754521482, 'colsample_bytree': 0.8308798293701933, 'min_child_weight': 16, 'max_delta_step': 2.893820412513191}. Best is trial 3 with value: 0.7592060758331217.
2026-03-16 10:02:24,285 - optuna.study.study - INFO - Trial 13 finished with value: 0.7580468466300706 and parameters: {'n_estimators': 769, 'max_depth': 7, 'learning_rate': 0.02179181671969542, 'gamma': 3.2811953542675556, 'lambda': 0.7412462902085621, 'alpha': 0.9538592856035548, 'subsample': 0.9973274738473105, 'colsample_bytree': 0.6831993195613796, 'min_child_weight': 13, 'max_delta_step': 9.785977873626496}. Best is trial 3 with value: 0.7592060758331217.
2026-03-16 10:02:35,966 - optuna.study.study - INFO - Trial 14 finished with value: 0.7582732055213354 and parameters: {'n_estimators': 427, 'max_depth': 8, 'learning_rate': 0.10383614476078962, 'gamma': 1.2895311182869689, 'lambda': 1.449876010002452, 'alpha': 2.7039648070941316, 'subsample': 0.7401253290250719, 'colsample_bytree': 0.8206033037470664, 'min_child_weight': 18, 'max_delta_step': 5.779246863325571}. Best is trial 3 with value: 0.7592060758331217.
2026-03-16 10:02:48,697 - optuna.study.study - INFO - Trial 15 finished with value: 0.7574141892621254 and parameters: {'n_estimators': 629, 'max_depth': 5, 'learning_rate': 0.029822843971420862, 'gamma': 2.8905819679062237, 'lambda': 3.5552380766915905, 'alpha': 1.452758102499195, 'subsample': 0.9172755267437414, 'colsample_bytree': 0.7019326095212453, 'min_child_weight': 14, 'max_delta_step': 8.161657824572421}. Best is trial 3 with value: 0.7592060758331217.
2026-03-16 10:03:18,359 - optuna.study.study - INFO - Trial 16 finished with value: 0.7591379764211292 and parameters: {'n_estimators': 880, 'max_depth': 7, 'learning_rate': 0.013635705754327829, 'gamma': 1.3673496775626095, 'lambda': 1.332470036565115, 'alpha': 2.3796069844727454, 'subsample': 0.6818575424003375, 'colsample_bytree': 0.6212972525545357, 'min_child_weight': 18, 'max_delta_step': 1.0656887072054833}. Best is trial 3 with value: 0.7592060758331217.
2026-03-16 10:03:34,003 - optuna.study.study - INFO - Trial 17 finished with value: 0.7563263572144714 and parameters: {'n_estimators': 327, 'max_depth': 7, 'learning_rate': 0.016294344783919744, 'gamma': 1.2893788766413026, 'lambda': 2.9123987929035735, 'alpha': 3.4963507949082087, 'subsample': 0.6423698674193821, 'colsample_bytree': 0.6015856995959162, 'min_child_weight': 1, 'max_delta_step': 1.5446534649354757}. Best is trial 3 with value: 0.7592060758331217.
2026-03-16 10:04:01,273 - optuna.study.study - INFO - Trial 18 finished with value: 0.7569284636563539 and parameters: {'n_estimators': 916, 'max_depth': 8, 'learning_rate': 0.04492526499715501, 'gamma': 1.1695493453637753, 'lambda': 0.6551906879926326, 'alpha': 2.288762989947964, 'subsample': 0.5882833018393154, 'colsample_bytree': 0.6363551218799077, 'min_child_weight': 18, 'max_delta_step': 1.3482129224437247}. Best is trial 3 with value: 0.7592060758331217.
2026-03-16 10:04:15,923 - optuna.study.study - INFO - Trial 19 finished with value: 0.753603120916481 and parameters: {'n_estimators': 737, 'max_depth': 5, 'learning_rate': 0.0206590080364513, 'gamma': 4.314304535016966, 'lambda': 4.470807865116465, 'alpha': 3.327663753670077, 'subsample': 0.6990270574633087, 'colsample_bytree': 0.5618782873327277, 'min_child_weight': 20, 'max_delta_step': 3.683780029484595}. Best is trial 3 with value: 0.7592060758331217.
2026-03-16 10:04:26,634 - optuna.study.study - INFO - Trial 20 finished with value: 0.7587863789757594 and parameters: {'n_estimators': 570, 'max_depth': 3, 'learning_rate': 0.1140410318779311, 'gamma': 0.11183098887347942, 'lambda': 1.6567412750574295, 'alpha': 2.5905854884757895, 'subsample': 0.789374943071472, 'colsample_bytree': 0.7089320036838104, 'min_child_weight': 12, 'max_delta_step': 0.9508003994980356}. Best is trial 3 with value: 0.7592060758331217.
2026-03-16 10:04:54,228 - optuna.study.study - INFO - Trial 21 finished with value: 0.7592942849667818 and parameters: {'n_estimators': 866, 'max_depth': 7, 'learning_rate': 0.007883985384150636, 'gamma': 1.7431542672564078, 'lambda': 1.0830779313584358, 'alpha': 1.1755777266638405, 'subsample': 0.9006666577807971, 'colsample_bytree': 0.8026971602717238, 'min_child_weight': 17, 'max_delta_step': 3.1432666310780277}. Best is trial 21 with value: 0.7592942849667818.
2026-03-16 10:05:23,892 - optuna.study.study - INFO - Trial 22 finished with value: 0.7598006233774228 and parameters: {'n_estimators': 926, 'max_depth': 7, 'learning_rate': 0.008504202009200915, 'gamma': 1.5740881850710666, 'lambda': 1.0954782798669922, 'alpha': 0.05046920048554715, 'subsample': 0.8941210147985581, 'colsample_bytree': 0.8031477533609427, 'min_child_weight': 18, 'max_delta_step': 3.153084467630708}. Best is trial 22 with value: 0.7598006233774228.
2026-03-16 10:05:51,598 - optuna.study.study - INFO - Trial 23 finished with value: 0.758375075463627 and parameters: {'n_estimators': 955, 'max_depth': 6, 'learning_rate': 0.007645447947529722, 'gamma': 1.7186748266457832, 'lambda': 0.6368640199567146, 'alpha': 0.887296375349511, 'subsample': 0.889175030407053, 'colsample_bytree': 0.8165947119852965, 'min_child_weight': 17, 'max_delta_step': 3.576071533422662}. Best is trial 22 with value: 0.7598006233774228.
2026-03-16 10:06:16,723 - optuna.study.study - INFO - Trial 24 finished with value: 0.7580973096541438 and parameters: {'n_estimators': 745, 'max_depth': 8, 'learning_rate': 0.006179694884505491, 'gamma': 2.9089795295628442, 'lambda': 0.9183307102818558, 'alpha': 0.09701176860234866, 'subsample': 0.7760318426037235, 'colsample_bytree': 0.8939973052329977, 'min_child_weight': 20, 'max_delta_step': 4.874527403188905}. Best is trial 22 with value: 0.7598006233774228.
2026-03-16 10:06:30,070 - optuna.study.study - INFO - Trial 25 finished with value: 0.7544001829355534 and parameters: {'n_estimators': 803, 'max_depth': 7, 'learning_rate': 0.28030910357322597, 'gamma': 0.8533918740899509, 'lambda': 2.548772192061769, 'alpha': 0.27130555789594735, 'subsample': 0.8774468327741753, 'colsample_bytree': 0.7847719152496448, 'min_child_weight': 14, 'max_delta_step': 2.8559122121279508}. Best is trial 22 with value: 0.7598006233774228.
2026-03-16 10:06:58,674 - optuna.study.study - INFO - Trial 26 finished with value: 0.760298140987433 and parameters: {'n_estimators': 915, 'max_depth': 7, 'learning_rate': 0.009100983480963156, 'gamma': 1.660041842357681, 'lambda': 1.0280218642509706, 'alpha': 0.4134610441054304, 'subsample': 0.8236636267002393, 'colsample_bytree': 0.8749444197834837, 'min_child_weight': 17, 'max_delta_step': 4.597304001697394}. Best is trial 26 with value: 0.760298140987433.
2026-03-16 10:07:20,004 - optuna.study.study - INFO - Trial 27 finished with value: 0.7526212326918585 and parameters: {'n_estimators': 697, 'max_depth': 6, 'learning_rate': 0.005019508639233835, 'gamma': 1.5830456969073285, 'lambda': 1.1333115953674475, 'alpha': 0.6368711318048991, 'subsample': 0.8288140722318736, 'colsample_bytree': 0.870061252853249, 'min_child_weight': 15, 'max_delta_step': 4.235755084610182}. Best is trial 26 with value: 0.760298140987433.
2026-03-16 10:08:02,363 - optuna.study.study - INFO - Trial 28 finished with value: 0.7609731016325244 and parameters: {'n_estimators': 904, 'max_depth': 8, 'learning_rate': 0.009034892508487208, 'gamma': 0.8081989918233151, 'lambda': 1.091304338334014, 'alpha': 0.5219979716159422, 'subsample': 0.917058155036816, 'colsample_bytree': 0.9980093071879685, 'min_child_weight': 11, 'max_delta_step': 5.510135497644185}. Best is trial 28 with value: 0.7609731016325244.
2026-03-16 10:08:48,391 - optuna.study.study - INFO - Trial 29 finished with value: 0.7599662956842975 and parameters: {'n_estimators': 582, 'max_depth': 8, 'learning_rate': 0.009427503238479247, 'gamma': 0.6432635809852292, 'lambda': 1.5920022428996652, 'alpha': 0.46803453374670034, 'subsample': 0.9401618782277971, 'colsample_bytree': 0.9891469318673677, 'min_child_weight': 5, 'max_delta_step': 5.618902043159161}. Best is trial 28 with value: 0.7609731016325244.
