2026-03-15 23:49:09,183 - optuna.study.study - INFO - Trial 196 finished with value: 0.7607041940215099 and parameters: {'imbalance_method': 'Baseline', 'n_estimators': 536, 'max_depth': 7, 'learning_rate': 0.014317368698443484, 'gamma': 4.688548585366456e-07, 'lambda': 0.0020810626329212296, 'alpha': 0.01861364925473716, 'subsample': 0.7575467789284773, 'colsample_bytree': 0.7460263170629743}. Best is trial 73 with value: 0.7610533332344204.
2026-03-15 23:49:31,903 - optuna.study.study - INFO - Trial 197 finished with value: 0.7580528370700922 and parameters: {'imbalance_method': 'TomekLinks', 'n_estimators': 558, 'max_depth': 7, 'learning_rate': 0.01588970800028303, 'gamma': 4.38105640775957e-07, 'lambda': 0.0007801220784383582, 'alpha': 0.02022828872107773, 'subsample': 0.7385772105167617, 'colsample_bytree': 0.7398943023293485}. Best is trial 73 with value: 0.7610533332344204.
2026-03-15 23:49:52,142 - optuna.study.study - INFO - Trial 198 finished with value: 0.761081067121132 and parameters: {'imbalance_method': 'Baseline', 'n_estimators': 532, 'max_depth': 7, 'learning_rate': 0.018530740226615664, 'gamma': 5.978298180454096e-06, 'lambda': 0.0017031117031612508, 'alpha': 0.03444087211593188, 'subsample': 0.7556027224361621, 'colsample_bytree': 0.7519995940076959}. Best is trial 198 with value: 0.761081067121132.
2026-03-15 23:50:12,146 - optuna.study.study - INFO - Trial 199 finished with value: 0.7606519461508005 and parameters: {'imbalance_method': 'Baseline', 'n_estimators': 537, 'max_depth': 7, 'learning_rate': 0.01872883644657217, 'gamma': 7.074679581069164e-06, 'lambda': 0.0018074428810903231, 'alpha': 0.0313955570619775, 'subsample': 0.7527886332030382, 'colsample_bytree': 0.7301096342003737}. Best is trial 198 with value: 0.761081067121132.
2026-03-15 23:50:35,732 - optuna.study.study - INFO - Trial 200 finished with value: 0.7216399515308668 and parameters: {'imbalance_method': 'SMOTEENN', 'n_estimators': 523, 'max_depth': 6, 'learning_rate': 0.020165693828468043, 'gamma': 1.417923436072492e-05, 'lambda': 0.0015487233728350039, 'alpha': 0.028093337158431823, 'subsample': 0.7244582134885456, 'colsample_bytree': 0.7293646724556755}. Best is trial 198 with value: 0.761081067121132.
2026-03-15 23:50:55,598 - optuna.study.study - INFO - Trial 201 finished with value: 0.7603893512166239 and parameters: {'imbalance_method': 'Baseline', 'n_estimators': 528, 'max_depth': 7, 'learning_rate': 0.018248472439997672, 'gamma': 5.784185042804533e-06, 'lambda': 0.0018804395506413268, 'alpha': 0.014655303707243784, 'subsample': 0.751490206064379, 'colsample_bytree': 0.7451270099740235}. Best is trial 198 with value: 0.761081067121132.
2026-03-15 23:51:14,531 - optuna.study.study - INFO - Trial 202 finished with value: 0.7600994384702181 and parameters: {'imbalance_method': 'Baseline', 'n_estimators': 500, 'max_depth': 7, 'learning_rate': 0.018828637433947717, 'gamma': 8.601257932670571e-06, 'lambda': 0.00324158619579825, 'alpha': 0.044434240691122784, 'subsample': 0.7622435961717393, 'colsample_bytree': 0.7351915697769767}. Best is trial 198 with value: 0.761081067121132.
2026-03-15 23:51:35,386 - optuna.study.study - INFO - Trial 203 finished with value: 0.7598095094969516 and parameters: {'imbalance_method': 'Baseline', 'n_estimators': 535, 'max_depth': 7, 'learning_rate': 0.014615713562642288, 'gamma': 4.194872100550772e-06, 'lambda': 0.0011982945801211433, 'alpha': 0.057595966445500156, 'subsample': 0.7505070578385753, 'colsample_bytree': 0.7538778262663984}. Best is trial 198 with value: 0.761081067121132.
2026-03-15 23:51:57,536 - optuna.study.study - INFO - Trial 204 finished with value: 0.759709628005293 and parameters: {'imbalance_method': 'Baseline', 'n_estimators': 552, 'max_depth': 7, 'learning_rate': 0.011963254500809343, 'gamma': 2.637679285305556e-06, 'lambda': 0.001056858855173736, 'alpha': 0.005225076773664178, 'subsample': 0.7344745527634, 'colsample_bytree': 0.7613959959894522}. Best is trial 198 with value: 0.761081067121132.
2026-03-15 23:52:18,501 - optuna.study.study - INFO - Trial 205 finished with value: 0.7610219339187125 and parameters: {'imbalance_method': 'Baseline', 'n_estimators': 538, 'max_depth': 7, 'learning_rate': 0.020847259637418816, 'gamma': 7.180397548726702e-06, 'lambda': 0.0003736535119417193, 'alpha': 0.025187403889923726, 'subsample': 0.7580320511696502, 'colsample_bytree': 0.7447038859508069}. Best is trial 198 with value: 0.761081067121132.
2026-03-15 23:52:50,516 - optuna.study.study - INFO - Trial 206 finished with value: 0.7595789296109071 and parameters: {'imbalance_method': 'SMOTE', 'n_estimators': 577, 'max_depth': 7, 'learning_rate': 0.021082357025796437, 'gamma': 3.6108345749951693e-06, 'lambda': 0.00027961496131159117, 'alpha': 0.008059539146339941, 'subsample': 0.755623827901394, 'colsample_bytree': 0.7239066866935132}. Best is trial 198 with value: 0.761081067121132.
2026-03-15 23:53:09,483 - optuna.study.study - INFO - Trial 207 finished with value: 0.7612584675395327 and parameters: {'imbalance_method': 'Baseline', 'n_estimators': 539, 'max_depth': 7, 'learning_rate': 0.0181116545131285, 'gamma': 7.454094627623283e-06, 'lambda': 0.00036780803167629474, 'alpha': 0.014738256092695032, 'subsample': 0.7610581670971341, 'colsample_bytree': 0.7542241550990665}. Best is trial 207 with value: 0.7612584675395327.
2026-03-15 23:53:29,358 - optuna.study.study - INFO - Trial 208 finished with value: 0.7608944822531442 and parameters: {'imbalance_method': 'Baseline', 'n_estimators': 502, 'max_depth': 7, 'learning_rate': 0.017917822690993897, 'gamma': 2.1527225104518473e-05, 'lambda': 0.0001304506715576501, 'alpha': 0.021357805844513595, 'subsample': 0.7565858987756536, 'colsample_bytree': 0.7498479388920475}. Best is trial 207 with value: 0.7612584675395327.
2026-03-15 23:53:48,705 - optuna.study.study - INFO - Trial 209 finished with value: 0.7596549438909955 and parameters: {'imbalance_method': 'Baseline', 'n_estimators': 517, 'max_depth': 7, 'learning_rate': 0.0232822976931694, 'gamma': 4.0894608136865564e-05, 'lambda': 0.00012872066606322, 'alpha': 0.01890682636715534, 'subsample': 0.7435088213277395, 'colsample_bytree': 0.7333382392923931}. Best is trial 207 with value: 0.7612584675395327.
2026-03-15 23:54:03,355 - optuna.study.study - INFO - Trial 210 finished with value: 0.7594303585087552 and parameters: {'imbalance_method': 'Baseline', 'n_estimators': 483, 'max_depth': 6, 'learning_rate': 0.01955583143672793, 'gamma': 8.04931730022812e-06, 'lambda': 7.20099799035343e-05, 'alpha': 0.012875316235531155, 'subsample': 0.7289886112889632, 'colsample_bytree': 0.7196540615285223}. Best is trial 207 with value: 0.7612584675395327.
2026-03-15 23:54:24,379 - optuna.study.study - INFO - Trial 211 finished with value: 0.7610832763527146 and parameters: {'imbalance_method': 'Baseline', 'n_estimators': 544, 'max_depth': 7, 'learning_rate': 0.017418093336709628, 'gamma': 1.4558971144463405e-05, 'lambda': 0.00019563062722316175, 'alpha': 0.0259404614180323, 'subsample': 0.7603344887472755, 'colsample_bytree': 0.7483857797195276}. Best is trial 207 with value: 0.7612584675395327.
2026-03-15 23:54:45,629 - optuna.study.study - INFO - Trial 212 finished with value: 0.7604894953093367 and parameters: {'imbalance_method': 'Baseline', 'n_estimators': 541, 'max_depth': 7, 'learning_rate': 0.017909142256271014, 'gamma': 1.6430318815533527e-05, 'lambda': 0.00020593773666168817, 'alpha': 0.02265656820402238, 'subsample': 0.7633401165918516, 'colsample_bytree': 0.7510930511943894}. Best is trial 207 with value: 0.7612584675395327.
2026-03-15 23:55:03,094 - optuna.study.study - INFO - Trial 213 finished with value: 0.7599847000261996 and parameters: {'imbalance_method': 'Baseline', 'n_estimators': 460, 'max_depth': 7, 'learning_rate': 0.020972023664279114, 'gamma': 2.2900878704666532e-05, 'lambda': 0.0001152733721162895, 'alpha': 0.02980760274442036, 'subsample': 0.7451578004636761, 'colsample_bytree': 0.7452084580577891}. Best is trial 207 with value: 0.7612584675395327.
2026-03-15 23:55:21,507 - optuna.study.study - INFO - Trial 214 finished with value: 0.7597656963793981 and parameters: {'imbalance_method': 'Baseline', 'n_estimators': 503, 'max_depth': 7, 'learning_rate': 0.017677149405145778, 'gamma': 1.2419572672396735e-05, 'lambda': 0.00035693871589154207, 'alpha': 0.03750055952964612, 'subsample': 0.7566434211228439, 'colsample_bytree': 0.7082367090635863}. Best is trial 207 with value: 0.7612584675395327.
2026-03-15 23:55:39,228 - optuna.study.study - INFO - Trial 215 finished with value: 0.760647855491246 and parameters: {'imbalance_method': 'Baseline', 'n_estimators': 537, 'max_depth': 7, 'learning_rate': 0.01694778183929021, 'gamma': 6.815236412798484e-06, 'lambda': 0.00017697832315334523, 'alpha': 0.014099611296174172, 'subsample': 0.7677979151991531, 'colsample_bytree': 0.7381073823104394}. Best is trial 207 with value: 0.7612584675395327.
2026-03-15 23:55:56,690 - optuna.study.study - INFO - Trial 216 finished with value: 0.7604703596921284 and parameters: {'imbalance_method': 'Baseline', 'n_estimators': 538, 'max_depth': 7, 'learning_rate': 0.019730509944076498, 'gamma': 6.958559481928292e-06, 'lambda': 0.00017037129021573146, 'alpha': 0.010398332338768862, 'subsample': 0.7681628704036865, 'colsample_bytree': 0.7331709083608601}. Best is trial 207 with value: 0.7612584675395327.
2026-03-15 23:56:15,037 - optuna.study.study - INFO - Trial 217 finished with value: 0.7604561970380602 and parameters: {'imbalance_method': 'Baseline', 'n_estimators': 567, 'max_depth': 7, 'learning_rate': 0.016816991679148945, 'gamma': 6.590562272449792e-06, 'lambda': 0.00010095830654677559, 'alpha': 0.020449435967798416, 'subsample': 0.7558392071805023, 'colsample_bytree': 0.7426226531247816}. Best is trial 207 with value: 0.7612584675395327.
2026-03-16 06:37:34,908 - optuna.study.study - INFO - Trial 218 finished with value: 0.7574829229691179 and parameters: {'imbalance_method': 'Baseline', 'n_estimators': 529, 'max_depth': 11, 'learning_rate': 0.01855448146575952, 'gamma': 1.633835688090434e-05, 'lambda': 0.00021945538946493564, 'alpha': 0.012306541649751947, 'subsample': 0.7478344040676779, 'colsample_bytree': 0.7179365220970094}. Best is trial 207 with value: 0.7612584675395327.
2026-03-16 09:52:50,875 - optuna.storages._in_memory - INFO - A new study created in memory with name: Optimizacion_XGB_Balanceo
2026-03-16 09:52:50,883 - optuna.study._optimize - WARNING - Trial 0 failed with parameters: {'n_estimators': 920, 'max_depth': 7, 'learning_rate': 0.2622497727898701, 'gamma': 1.478738631610172, 'lambda': 0.518402885125941, 'alpha': 4.944467320543252, 'subsample': 0.6494218932591819, 'colsample_bytree': 0.8012500272806877, 'min_child_weight': 11, 'max_delta_step': 8.324946859183294} because of the following error: InvalidParameterError("The 'estimator' parameter of cross_val_score must be an object implementing 'fit'. Got [('capping_outliers', IQRCapper()), ('imputacion', SimpleImputer()), ('scaler', StandardScaler()), ('sampler', TomekLinks()), ('clf', XGBClassifier(base_score=None, booster=None, callbacks=None,\n              colsample_bylevel=None, colsample_bynode=None,\n              colsample_bytree=0.8012500272806877, device=None,\n              early_stopping_rounds=None, enable_categorical=False,\n              eval_metric='mlogloss', feature_types=None, feature_weights=None,\n              gamma=1.478738631610172, grow_policy=None, importance_type=None,\n              interaction_constraints=None, learning_rate=0.2622497727898701,\n              max_bin=None, max_cat_threshold=None, max_cat_to_onehot=None,\n              max_delta_step=8.324946859183294, max_depth=7, max_leaves=None,\n              min_child_weight=11, missing=nan, monotone_constraints=None,\n              multi_strategy=None, n_estimators=920, n_jobs=-1, num_class=4, ...))] instead.").
Traceback (most recent call last):
  File [35m"c:\Users\gonzalo.iglesias\AppData\Local\miniconda3\envs\machinelearning2\Lib\site-packages\optuna\study\_optimize.py"[0m, line [35m206[0m, in [35m_run_trial[0m
    value_or_values = func(trial)
  File [35m"C:\Users\gonzalo.iglesias\AppData\Local\Temp\ipykernel_24236\3874657623.py"[0m, line [35m52[0m, in [35mobjective[0m
    scores = cross_val_score(
        pasos_pipeline,
    ...<3 lines>...
        n_jobs=1
    )
  File [35m"c:\Users\gonzalo.iglesias\AppData\Local\miniconda3\envs\machinelearning2\Lib\site-packages\sklearn\utils\_param_validation.py"[0m, line [35m208[0m, in [35mwrapper[0m
    [31mvalidate_parameter_constraints[0m[1;31m([0m
    [31m~~~~~~~~~~~~~~~~~~~~~~~~~~~~~~[0m[1;31m^[0m
        [1;31mparameter_constraints, params, caller_name=func.__qualname__[0m
        [1;31m^^^^^^^^^^^^^^^^^^^^^^^^^^^^^^^^^^^^^^^^^^^^^^^^^^^^^^^^^^^^[0m
    [1;31m)[0m
    [1;31m^[0m
  File [35m"c:\Users\gonzalo.iglesias\AppData\Local\miniconda3\envs\machinelearning2\Lib\site-packages\sklearn\utils\_param_validation.py"[0m, line [35m98[0m, in [35mvalidate_parameter_constraints[0m
    raise InvalidParameterError(
    ...<2 lines>...
    )
[1;35msklearn.utils._param_validation.InvalidParameterError[0m: [35mThe 'estimator' parameter of cross_val_score must be an object implementing 'fit'. Got [('capping_outliers', IQRCapper()), ('imputacion', SimpleImputer()), ('scaler', StandardScaler()), ('sampler', TomekLinks()), ('clf', XGBClassifier(base_score=None, booster=None, callbacks=None,
              colsample_bylevel=None, colsample_bynode=None,
              colsample_bytree=0.8012500272806877, device=None,
              early_stopping_rounds=None, enable_categorical=False,
              eval_metric='mlogloss', feature_types=None, feature_weights=None,
              gamma=1.478738631610172, grow_policy=None, importance_type=None,
              interaction_constraints=None, learning_rate=0.2622497727898701,
              max_bin=None, max_cat_threshold=None, max_cat_to_onehot=None,
              max_delta_step=8.324946859183294, max_depth=7, max_leaves=None,
              min_child_weight=11, missing=nan, monotone_constraints=None,
              multi_strategy=None, n_estimators=920, n_jobs=-1, num_class=4, ...))] instead.[0m
2026-03-16 09:52:50,902 - optuna.study._optimize - WARNING - Trial 0 failed with value None.
2026-03-16 09:57:46,116 - optuna.storages._in_memory - INFO - A new study created in memory with name: Optimizacion_XGB_Balanceo
